Starting TraktSync...
Fetching watched shows from Trakt (this might take a moment)...
Fetching watched movies from Trakt...
Fetching Watch List from HDRezka...
Opening HDRezka...
Logging in...
Login failed or already logged in: Page.wait_for_selector: Timeout 5000ms exceeded.
Call log:
  - waiting for locator(".b-tophead-logout") to be visible
    - waiting for" https://hdrezka-home.tv/" navigation to finish...
    - navigated to "https://hdrezka-home.tv/"
    9 × locator resolved to hidden <a rel="nofollow" class="b-tophead-logout" href="https://hdrezka-home.tv/logout/">Выход</a>

Navigating to 'Continue Watching'...
Found 486 items in list.
[DEBUG] 'Реальная любовь' -> Raw: 'сегодня' | Parsed: 2025-12-24 13:22:34.300452
[DEBUG] 'Профессор Т' -> Raw: 'вчера' | Parsed: 2025-12-23 13:22:34.329323
[DEBUG] 'Достать ножи: Воскрешение покойника' -> Raw: 'вчера' | Parsed: 2025-12-23 13:22:34.356733
[DEBUG] 'Гарри Поттер и философский камень' -> Raw: 'вчера' | Parsed: 2025-12-23 13:22:34.384526
[DEBUG] 'Рождество не по плану / Лето. Солнце. Рождество' -> Raw: 'вчера' | Parsed: 2025-12-23 13:22:34.434360
[DEBUG] 'Перл из Уитстейбла' -> Raw: '21-12-2025' | Parsed: 2025-12-21 00:00:00
[DEBUG] 'Теория большого взрыва' -> Raw: '21-12-2025' | Parsed: 2025-12-21 00:00:00
[DEBUG] 'Доставить к Рождеству' -> Raw: '21-12-2025' | Parsed: 2025-12-21 00:00:00
[DEBUG] 'Одна на рождество' -> Raw: '20-12-2025' | Parsed: 2025-12-20 00:00:00
[DEBUG] 'Рождественское обещание' -> Raw: '20-12-2025' | Parsed: 2025-12-20 00:00:00
[DEBUG] 'Отпуск по обмену' -> Raw: '20-12-2025' | Parsed: 2025-12-20 00:00:00
[DEBUG] 'Пока ты спал' -> Raw: '19-12-2025' | Parsed: 2025-12-19 00:00:00
[DEBUG] 'Сознание' -> Raw: '16-12-2025' | Parsed: 2025-12-16 00:00:00
[DEBUG] 'Девочки Гилмор' -> Raw: '14-12-2025' | Parsed: 2025-12-14 00:00:00
[DEBUG] 'Последний отпуск / Последние каникулы' -> Raw: '14-12-2025' | Parsed: 2025-12-14 00:00:00
[DEBUG] 'Хорошая жена / Правильная жена' -> Raw: '14-12-2025' | Parsed: 2025-12-14 00:00:00
[DEBUG] 'Сознавайтесь, Флетч' -> Raw: '13-12-2025' | Parsed: 2025-12-13 00:00:00
[DEBUG] 'Подземелья и драконы: Честь среди воров' -> Raw: '12-12-2025' | Parsed: 2025-12-12 00:00:00
[DEBUG] 'Испытание невиновностью' -> Raw: '11-12-2025' | Parsed: 2025-12-11 00:00:00
[DEBUG] 'Убийства под омелой' -> Raw: '10-12-2025' | Parsed: 2025-12-10 00:00:00
[DEBUG] 'Идентификация' -> Raw: '09-12-2025' | Parsed: 2025-12-09 00:00:00
[DEBUG] 'Сумерки. Сага. Рассвет: Часть 2' -> Raw: '09-12-2025' | Parsed: 2025-12-09 00:00:00
[DEBUG] 'Сумерки. Сага. Рассвет: Часть 1' -> Raw: '09-12-2025' | Parsed: 2025-12-09 00:00:00
[DEBUG] 'Смотрите, как они бегут' -> Raw: '08-12-2025' | Parsed: 2025-12-08 00:00:00
[DEBUG] 'Из многих / Плюрибус / Счастье заразительно' -> Raw: '07-12-2025' | Parsed: 2025-12-07 00:00:00
[DEBUG] 'По кладбищенской дороге' -> Raw: '07-12-2025' | Parsed: 2025-12-07 00:00:00
[DEBUG] 'Сумерки. Сага. Затмение' -> Raw: '07-12-2025' | Parsed: 2025-12-07 00:00:00
[DEBUG] 'Иллюзионист' -> Raw: '06-12-2025' | Parsed: 2025-12-06 00:00:00
[DEBUG] 'Сумерки. Сага. Новолуние' -> Raw: '06-12-2025' | Parsed: 2025-12-06 00:00:00
[DEBUG] 'Сумерки' -> Raw: '06-12-2025' | Parsed: 2025-12-06 00:00:00
[DEBUG] 'Новый Амстердам' -> Raw: '05-12-2025' | Parsed: 2025-12-05 00:00:00
[DEBUG] 'Убийство в маленьком городке' -> Raw: '04-12-2025' | Parsed: 2025-12-04 00:00:00
[DEBUG] 'Гарри Поттер и Кубок огня' -> Raw: '04-12-2025' | Parsed: 2025-12-04 00:00:00
[DEBUG] 'Смерть на Ниле' -> Raw: '30-11-2025' | Parsed: 2025-11-30 00:00:00
[DEBUG] 'Гарри Поттер и узник Азкабана' -> Raw: '30-11-2025' | Parsed: 2025-11-30 00:00:00
[DEBUG] 'Гарри Поттер и Тайная комната' -> Raw: '30-11-2025' | Parsed: 2025-11-30 00:00:00
[DEBUG] 'Убийство в Провансе' -> Raw: '29-11-2025' | Parsed: 2025-11-29 00:00:00
[DEBUG] 'Убийство на пляже / Бродчёрч' -> Raw: '28-11-2025' | Parsed: 2025-11-28 00:00:00
[DEBUG] 'Шетланд' -> Raw: '27-11-2025' | Parsed: 2025-11-27 00:00:00
[DEBUG] 'Счастливый конец' -> Raw: '25-11-2025' | Parsed: 2025-11-25 00:00:00
[DEBUG] 'Гордость и предубеждение' -> Raw: '23-11-2025' | Parsed: 2025-11-23 00:00:00
[DEBUG] 'Джонатан Крик' -> Raw: '17-11-2025' | Parsed: 2025-11-17 00:00:00
[DEBUG] 'Бруклин 9-9' -> Raw: '17-11-2025' | Parsed: 2025-11-17 00:00:00
[DEBUG] 'Хинтерланд' -> Raw: '17-11-2025' | Parsed: 2025-11-17 00:00:00
[DEBUG] 'Тед Лассо' -> Raw: '17-11-2025' | Parsed: 2025-11-17 00:00:00
[DEBUG] 'Последняя дуэль' -> Raw: '16-11-2025' | Parsed: 2025-11-16 00:00:00
[DEBUG] 'Тайлер Рейк: Операция по спасению 2 / Эвакуация 2' -> Raw: '16-11-2025' | Parsed: 2025-11-16 00:00:00
[DEBUG] 'Идентификация Борна' -> Raw: '15-11-2025' | Parsed: 2025-11-15 00:00:00
[DEBUG] 'Твин Пикс' -> Raw: '15-11-2025' | Parsed: 2025-11-15 00:00:00
[DEBUG] 'Дандадан [ТВ-2]' -> Raw: '30-10-2025' | Parsed: 2025-10-30 00:00:00
[DEBUG] 'Клуб убийств Марлоу' -> Raw: '28-10-2025' | Parsed: 2025-10-28 00:00:00
[DEBUG] 'Карточный домик' -> Raw: '27-10-2025' | Parsed: 2025-10-27 00:00:00
[DEBUG] 'Любовь с иголочки / Эта фарфоровая кукла влюбилась [ТВ-1]' -> Raw: '26-10-2025' | Parsed: 2025-10-26 00:00:00
[DEBUG] 'Отчаянные домохозяйки' -> Raw: '22-10-2025' | Parsed: 2025-10-22 00:00:00
[DEBUG] 'Бриджертоны' -> Raw: '21-10-2025' | Parsed: 2025-10-21 00:00:00
[DEBUG] 'Резиденция' -> Raw: '20-10-2025' | Parsed: 2025-10-20 00:00:00
[DEBUG] 'Неукротимый / В глуши' -> Raw: '16-10-2025' | Parsed: 2025-10-16 00:00:00
[DEBUG] 'Люцифер' -> Raw: '13-10-2025' | Parsed: 2025-10-13 00:00:00
[DEBUG] 'Скандал' -> Raw: '12-10-2025' | Parsed: 2025-10-12 00:00:00
[DEBUG] 'Обмани меня / Теория лжи' -> Raw: '12-10-2025' | Parsed: 2025-10-12 00:00:00
[DEBUG] 'Дандадан [ТВ-1]' -> Raw: '12-10-2025' | Parsed: 2025-10-12 00:00:00
[DEBUG] 'С большой буквы / Жирным шрифтом' -> Raw: '10-10-2025' | Parsed: 2025-10-10 00:00:00
[DEBUG] 'Шорзи / Шорси' -> Raw: '08-10-2025' | Parsed: 2025-10-08 00:00:00
[DEBUG] 'Пожарная часть 19' -> Raw: '06-10-2025' | Parsed: 2025-10-06 00:00:00
[DEBUG] 'Моя геройская академия [ТВ-1]' -> Raw: '04-10-2025' | Parsed: 2025-10-04 00:00:00
[DEBUG] 'Кейпоп-охотницы на демонов' -> Raw: '11-09-2025' | Parsed: 2025-09-11 00:00:00
[DEBUG] 'Тайны Броукенвуда' -> Raw: '09-09-2025' | Parsed: 2025-09-09 00:00:00
[DEBUG] 'Это мы' -> Raw: '08-09-2025' | Parsed: 2025-09-08 00:00:00
[DEBUG] 'Расследования мадам Блан' -> Raw: '07-09-2025' | Parsed: 2025-09-07 00:00:00
[DEBUG] 'Умница' -> Raw: '06-09-2025' | Parsed: 2025-09-06 00:00:00
[DEBUG] 'Клиника' -> Raw: '06-09-2025' | Parsed: 2025-09-06 00:00:00
[DEBUG] 'Громовержцы*' -> Raw: '02-09-2025' | Parsed: 2025-09-02 00:00:00
[DEBUG] 'Большой потенциал' -> Raw: '31-08-2025' | Parsed: 2025-08-31 00:00:00
[DEBUG] 'Рецепты любви и убийства' -> Raw: '23-08-2025' | Parsed: 2025-08-23 00:00:00
[DEBUG] 'Джинни и Джорджия' -> Raw: '23-08-2025' | Parsed: 2025-08-23 00:00:00
[DEBUG] 'Супермен' -> Raw: '23-08-2025' | Parsed: 2025-08-23 00:00:00
[DEBUG] 'Дарби и Джоан' -> Raw: '22-08-2025' | Parsed: 2025-08-22 00:00:00
[DEBUG] 'Книжный' -> Raw: '22-08-2025' | Parsed: 2025-08-22 00:00:00
[DEBUG] 'Зови меня Кэт' -> Raw: '19-08-2025' | Parsed: 2025-08-19 00:00:00
[DEBUG] 'Кости' -> Raw: '17-08-2025' | Parsed: 2025-08-17 00:00:00
[DEBUG] 'Неуязвимый' -> Raw: '31-07-2025' | Parsed: 2025-07-31 00:00:00
[DEBUG] 'Ешь, молись, люби' -> Raw: '29-07-2025' | Parsed: 2025-07-29 00:00:00
[DEBUG] 'Секс в большом городе' -> Raw: '29-07-2025' | Parsed: 2025-07-29 00:00:00
[DEBUG] 'Как приручить дракона' -> Raw: '26-07-2025' | Parsed: 2025-07-26 00:00:00
[DEBUG] 'За гранью / Грань' -> Raw: '19-07-2025' | Parsed: 2025-07-19 00:00:00
[DEBUG] 'Макдональд и Доддс' -> Raw: '17-07-2025' | Parsed: 2025-07-17 00:00:00
[DEBUG] 'Белый воротничок' -> Raw: '16-07-2025' | Parsed: 2025-07-16 00:00:00
[DEBUG] 'Тайны Лауры' -> Raw: '14-07-2025' | Parsed: 2025-07-14 00:00:00
[DEBUG] 'Тайны Фрэнки Дрейк / Расследования Фрэнки Дрейк' -> Raw: '12-07-2025' | Parsed: 2025-07-12 00:00:00
[DEBUG] 'РеГенезис' -> Raw: '23-06-2025' | Parsed: 2025-06-23 00:00:00
[DEBUG] 'Стражи Галактики' -> Raw: '21-06-2025' | Parsed: 2025-06-21 00:00:00
[DEBUG] 'Болота / Пляжный коп' -> Raw: '19-06-2025' | Parsed: 2025-06-19 00:00:00
[DEBUG] 'Элементарно' -> Raw: '19-06-2025' | Parsed: 2025-06-19 00:00:00
[DEBUG] 'Бумажный дом' -> Raw: '06-06-2025' | Parsed: 2025-06-06 00:00:00
[DEBUG] 'Кухня' -> Raw: '06-06-2025' | Parsed: 2025-06-06 00:00:00
[DEBUG] 'Друзья' -> Raw: '01-06-2025' | Parsed: 2025-06-01 00:00:00
[DEBUG] 'Джек Ричер' -> Raw: '21-05-2025' | Parsed: 2025-05-21 00:00:00
[DEBUG] 'Доктор Хаус' -> Raw: '20-05-2025' | Parsed: 2025-05-20 00:00:00
[DEBUG] 'Иллюзия обмана' -> Raw: '19-04-2025' | Parsed: 2025-04-19 00:00:00
[DEBUG] 'Темное дитя' -> Raw: '06-04-2025' | Parsed: 2025-04-06 00:00:00
[DEBUG] 'Потерянная комната / Пропавшая комната' -> Raw: '06-04-2025' | Parsed: 2025-04-06 00:00:00
[DEBUG] 'Анатомия страсти / Анатомия Грей' -> Raw: '11-03-2025' | Parsed: 2025-03-11 00:00:00
[DEBUG] 'Сёгун' -> Raw: '01-03-2025' | Parsed: 2025-03-01 00:00:00
[DEBUG] 'Ущелье' -> Raw: '25-02-2025' | Parsed: 2025-02-25 00:00:00
[DEBUG] 'Однажды в Ирландии' -> Raw: '25-02-2025' | Parsed: 2025-02-25 00:00:00
[DEBUG] 'Доктор Кто' -> Raw: '03-02-2025' | Parsed: 2025-02-03 00:00:00
[DEBUG] 'Дюна' -> Raw: '03-01-2025' | Parsed: 2025-01-03 00:00:00
[DEBUG] 'Полярный экспресс' -> Raw: '01-01-2025' | Parsed: 2025-01-01 00:00:00
[DEBUG] 'Начальная школа «Эбботт»' -> Raw: '29-12-2024' | Parsed: 2024-12-29 00:00:00
[DEBUG] 'Аркейн' -> Raw: '28-12-2024' | Parsed: 2024-12-28 00:00:00
[DEBUG] 'Хоббит: Битва пяти воинств' -> Raw: '28-12-2024' | Parsed: 2024-12-28 00:00:00
[DEBUG] 'Хоббит: Пустошь Смауга' -> Raw: '27-12-2024' | Parsed: 2024-12-27 00:00:00
[DEBUG] 'Хоббит: Нежданное путешествие' -> Raw: '26-12-2024' | Parsed: 2024-12-26 00:00:00
[DEBUG] 'Тор 2: Царство тьмы' -> Raw: '23-12-2024' | Parsed: 2024-12-23 00:00:00
[DEBUG] 'Тор' -> Raw: '23-12-2024' | Parsed: 2024-12-23 00:00:00
[DEBUG] 'Дневник Бриджит Джонс' -> Raw: '22-12-2024' | Parsed: 2024-12-22 00:00:00
[DEBUG] 'Напарницы: Астрид и Рафаэлла' -> Raw: '22-12-2024' | Parsed: 2024-12-22 00:00:00
[DEBUG] 'Секретный уровень' -> Raw: '21-12-2024' | Parsed: 2024-12-21 00:00:00
[DEBUG] 'Сердца трёх' -> Raw: '20-12-2024' | Parsed: 2024-12-20 00:00:00
[DEBUG] 'Гарри Поттер и Дары Смерти: Часть II' -> Raw: '18-12-2024' | Parsed: 2024-12-18 00:00:00
[DEBUG] 'Гарри Поттер и Дары Смерти: Часть I' -> Raw: '17-12-2024' | Parsed: 2024-12-17 00:00:00
[DEBUG] 'Гарри Поттер и Принц-полукровка' -> Raw: '16-12-2024' | Parsed: 2024-12-16 00:00:00
[DEBUG] 'Гарри Поттер и Орден Феникса' -> Raw: '15-12-2024' | Parsed: 2024-12-15 00:00:00
[DEBUG] 'Мадам Си Джей Уокер: первая женщина-миллионер в США' -> Raw: '08-12-2024' | Parsed: 2024-12-08 00:00:00
[DEBUG] 'Мертвые до востребования' -> Raw: '06-12-2024' | Parsed: 2024-12-06 00:00:00
[DEBUG] 'Андор' -> Raw: '06-12-2024' | Parsed: 2024-12-06 00:00:00
[DEBUG] 'Супергёрл / Супердевушка' -> Raw: '01-12-2024' | Parsed: 2024-12-01 00:00:00
[DEBUG] 'Мобильный доспех Гандам: Стальнокровные сироты / Гандам: Железнокровные сироты' -> Raw: '24-11-2024' | Parsed: 2024-11-24 00:00:00
[DEBUG] 'Дэдпул и Росомаха' -> Raw: '08-11-2024' | Parsed: 2024-11-08 00:00:00
[DEBUG] 'Каскадёры' -> Raw: '24-10-2024' | Parsed: 2024-10-24 00:00:00
[DEBUG] 'Чужой: Ромул' -> Raw: '22-10-2024' | Parsed: 2024-10-22 00:00:00
[DEBUG] 'Медленные лошади / Хромые кони' -> Raw: '13-10-2024' | Parsed: 2024-10-13 00:00:00
[DEBUG] 'Майор Гром: Игра' -> Raw: '07-10-2024' | Parsed: 2024-10-07 00:00:00
[DEBUG] 'Парки и зоны отдыха' -> Raw: '02-09-2024' | Parsed: 2024-09-02 00:00:00
[DEBUG] 'Элли МакБил' -> Raw: '02-09-2024' | Parsed: 2024-09-02 00:00:00
[DEBUG] 'Как отделаться от парня за 10 дней' -> Raw: '30-08-2024' | Parsed: 2024-08-30 00:00:00
[DEBUG] 'Частная практика' -> Raw: '26-08-2024' | Parsed: 2024-08-26 00:00:00
[DEBUG] 'Коломбо' -> Raw: '23-08-2024' | Parsed: 2024-08-23 00:00:00
[DEBUG] 'Ворон' -> Raw: '22-08-2024' | Parsed: 2024-08-22 00:00:00
[DEBUG] 'Бэтмен: Крестоносец в плаще' -> Raw: '22-08-2024' | Parsed: 2024-08-22 00:00:00
[DEBUG] 'Киберпанк: Бегущие по краю' -> Raw: '21-08-2024' | Parsed: 2024-08-21 00:00:00
[DEBUG] 'Прибытие' -> Raw: '10-08-2024' | Parsed: 2024-08-10 00:00:00
[DEBUG] 'Довольно сложные дела' -> Raw: '09-08-2024' | Parsed: 2024-08-09 00:00:00
[DEBUG] 'Знакомьтесь, Джо Блэк' -> Raw: '31-07-2024' | Parsed: 2024-07-31 00:00:00
[DEBUG] 'Кастлвания' -> Raw: '29-07-2024' | Parsed: 2024-07-29 00:00:00
[DEBUG] 'Голубоглазый самурай' -> Raw: '28-07-2024' | Parsed: 2024-07-28 00:00:00
[DEBUG] 'Шоу Трумана' -> Raw: '21-07-2024' | Parsed: 2024-07-21 00:00:00
[DEBUG] 'Фоллаут' -> Raw: '20-07-2024' | Parsed: 2024-07-20 00:00:00
[DEBUG] 'Девочки Гилмор: Времена года' -> Raw: '17-07-2024' | Parsed: 2024-07-17 00:00:00
[DEBUG] 'Взрывные котята' -> Raw: '16-07-2024' | Parsed: 2024-07-16 00:00:00
[DEBUG] 'История Британии с Канк' -> Raw: '16-07-2024' | Parsed: 2024-07-16 00:00:00
[DEBUG] 'Тайлер Рейк: Операция по спасению / Эвакуация' -> Raw: '15-07-2024' | Parsed: 2024-07-15 00:00:00
[DEBUG] 'Мечтатель' -> Raw: '14-07-2024' | Parsed: 2024-07-14 00:00:00
[DEBUG] 'Замок Бландингс' -> Raw: '14-07-2024' | Parsed: 2024-07-14 00:00:00
[DEBUG] 'Самый быстрый Indian' -> Raw: '13-07-2024' | Parsed: 2024-07-13 00:00:00
[DEBUG] 'Месси' -> Raw: '13-07-2024' | Parsed: 2024-07-13 00:00:00
[DEBUG] 'Игра по чужим правилам' -> Raw: '13-07-2024' | Parsed: 2024-07-13 00:00:00
[DEBUG] 'Человек, который изменил всё' -> Raw: '13-07-2024' | Parsed: 2024-07-13 00:00:00
[DEBUG] 'Тихоокеанский рубеж' -> Raw: '12-07-2024' | Parsed: 2024-07-12 00:00:00
[DEBUG] 'Троя' -> Raw: '12-07-2024' | Parsed: 2024-07-12 00:00:00
[DEBUG] 'Чисто английские убийства' -> Raw: '11-07-2024' | Parsed: 2024-07-11 00:00:00
[DEBUG] 'Спецназ / Морские Котики' -> Raw: '11-07-2024' | Parsed: 2024-07-11 00:00:00
[DEBUG] 'Коронер' -> Raw: '10-07-2024' | Parsed: 2024-07-10 00:00:00
[DEBUG] 'Дюна: Часть вторая' -> Raw: '10-07-2024' | Parsed: 2024-07-10 00:00:00
[DEBUG] 'Новенькая' -> Raw: '08-07-2024' | Parsed: 2024-07-08 00:00:00
[DEBUG] 'Смерть в раю' -> Raw: '29-06-2024' | Parsed: 2024-06-29 00:00:00
[DEBUG] 'Стражи Галактики. Часть 3' -> Raw: '19-05-2024' | Parsed: 2024-05-19 00:00:00
[DEBUG] 'Флэш' -> Raw: '15-05-2024' | Parsed: 2024-05-15 00:00:00
[DEBUG] 'Мстители: Финал' -> Raw: '14-05-2024' | Parsed: 2024-05-14 00:00:00
[DEBUG] 'Мстители: Война бесконечности' -> Raw: '12-05-2024' | Parsed: 2024-05-12 00:00:00
[DEBUG] 'Стражи Галактики 2' -> Raw: '11-05-2024' | Parsed: 2024-05-11 00:00:00
[DEBUG] 'Ферма Кларксона' -> Raw: '11-05-2024' | Parsed: 2024-05-11 00:00:00
[DEBUG] 'Смерть не в раю / Вне рая' -> Raw: '01-05-2024' | Parsed: 2024-05-01 00:00:00
[DEBUG] 'Охотники за привидениями: Леденящий ужас' -> Raw: '01-05-2024' | Parsed: 2024-05-01 00:00:00
[DEBUG] 'Красные огни' -> Raw: '20-04-2024' | Parsed: 2024-04-20 00:00:00
[DEBUG] 'Ночной администратор' -> Raw: '19-04-2024' | Parsed: 2024-04-19 00:00:00
[DEBUG] 'Белый лотос' -> Raw: '18-04-2024' | Parsed: 2024-04-18 00:00:00
[DEBUG] 'Почему не Эванс?' -> Raw: '06-04-2024' | Parsed: 2024-04-06 00:00:00
[DEBUG] 'Моя жизнь — убийство' -> Raw: '04-04-2024' | Parsed: 2024-04-04 00:00:00
[DEBUG] 'Бэтмен' -> Raw: '31-03-2024' | Parsed: 2024-03-31 00:00:00
[DEBUG] 'Благие знамения' -> Raw: '24-03-2024' | Parsed: 2024-03-24 00:00:00
[DEBUG] 'Брат Кадфаэль' -> Raw: '19-03-2024' | Parsed: 2024-03-19 00:00:00
[DEBUG] 'Меломанка / Hi-Fi / Фанатик' -> Raw: '17-03-2024' | Parsed: 2024-03-17 00:00:00
[DEBUG] 'Адвокат дьявола' -> Raw: '17-03-2024' | Parsed: 2024-03-17 00:00:00
[DEBUG] 'Леди-детектив мисс Перегрин Фишер' -> Raw: '16-03-2024' | Parsed: 2024-03-16 00:00:00
[DEBUG] 'Ноттинг Хилл' -> Raw: '12-03-2024' | Parsed: 2024-03-12 00:00:00
[DEBUG] 'Драйв' -> Raw: '10-03-2024' | Parsed: 2024-03-10 00:00:00
[DEBUG] 'Крэнфорд' -> Raw: '09-03-2024' | Parsed: 2024-03-09 00:00:00
[DEBUG] 'Джон Уик 4' -> Raw: '07-03-2024' | Parsed: 2024-03-07 00:00:00
[DEBUG] 'Принцесса-невеста' -> Raw: '25-02-2024' | Parsed: 2024-02-25 00:00:00
[DEBUG] 'Безумный Макс: Дорога ярости' -> Raw: '25-02-2024' | Parsed: 2024-02-25 00:00:00
[DEBUG] 'Марсианин' -> Raw: '23-02-2024' | Parsed: 2024-02-23 00:00:00
[DEBUG] 'Психопаспорт [ТВ-1]' -> Raw: '22-02-2024' | Parsed: 2024-02-22 00:00:00
[DEBUG] 'Как важно быть серьезным' -> Raw: '18-02-2024' | Parsed: 2024-02-18 00:00:00
[DEBUG] 'Умри, но не сейчас' -> Raw: '18-02-2024' | Parsed: 2024-02-18 00:00:00
[DEBUG] 'Алита: Боевой ангел' -> Raw: '12-02-2024' | Parsed: 2024-02-12 00:00:00
[DEBUG] 'Зов крови / Потерянная' -> Raw: '02-02-2024' | Parsed: 2024-02-02 00:00:00
[DEBUG] 'Расследования Мердока' -> Raw: '23-01-2024' | Parsed: 2024-01-23 00:00:00
[DEBUG] 'Достать ножи: Стеклянная луковица' -> Raw: '19-01-2024' | Parsed: 2024-01-19 00:00:00
[DEBUG] 'Вечеринка / Афтепати' -> Raw: '18-01-2024' | Parsed: 2024-01-18 00:00:00
[DEBUG] 'Королевы тайн' -> Raw: '17-01-2024' | Parsed: 2024-01-17 00:00:00
[DEBUG] 'Игра престолов' -> Raw: '16-01-2024' | Parsed: 2024-01-16 00:00:00
[DEBUG] 'Шекспир и Хэтэуэй: Частные детективы' -> Raw: '13-01-2024' | Parsed: 2024-01-13 00:00:00
[DEBUG] 'Я – зомби' -> Raw: '11-01-2024' | Parsed: 2024-01-11 00:00:00
[DEBUG] 'Агата Рэйзин' -> Raw: '09-01-2024' | Parsed: 2024-01-09 00:00:00
[DEBUG] 'Ночные игры' -> Raw: '08-01-2024' | Parsed: 2024-01-08 00:00:00
[DEBUG] 'Рождественский коттедж' -> Raw: '07-01-2024' | Parsed: 2024-01-07 00:00:00
[DEBUG] 'Четыре Рождества' -> Raw: '07-01-2024' | Parsed: 2024-01-07 00:00:00
[DEBUG] 'Замерзшая из Майами' -> Raw: '02-01-2024' | Parsed: 2024-01-02 00:00:00
[DEBUG] 'Тариф Новогодний' -> Raw: '01-01-2024' | Parsed: 2024-01-01 00:00:00
[DEBUG] 'Золотой компас' -> Raw: '01-01-2024' | Parsed: 2024-01-01 00:00:00
[DEBUG] 'Братство волка' -> Raw: '22-12-2023' | Parsed: 2023-12-22 00:00:00
[DEBUG] 'Самая обаятельная и привлекательная' -> Raw: '17-12-2023' | Parsed: 2023-12-17 00:00:00
[DEBUG] 'Вам письмо' -> Raw: '13-12-2023' | Parsed: 2023-12-13 00:00:00
[DEBUG] 'Обыкновенное чудо' -> Raw: '03-12-2023' | Parsed: 2023-12-03 00:00:00
[DEBUG] 'Покровские ворота' -> Raw: '02-12-2023' | Parsed: 2023-12-02 00:00:00
[DEBUG] 'Пятый элемент' -> Raw: '26-11-2023' | Parsed: 2023-11-26 00:00:00
[DEBUG] 'Отец Браун' -> Raw: '25-11-2023' | Parsed: 2023-11-25 00:00:00
[DEBUG] 'Притворщик' -> Raw: '21-11-2023' | Parsed: 2023-11-21 00:00:00
[DEBUG] 'Доктор Стрэндж' -> Raw: '19-11-2023' | Parsed: 2023-11-19 00:00:00
[DEBUG] 'Железный человек' -> Raw: '19-11-2023' | Parsed: 2023-11-19 00:00:00
[DEBUG] 'Розмари и Тайм' -> Raw: '18-11-2023' | Parsed: 2023-11-18 00:00:00
[DEBUG] 'Темный рыцарь' -> Raw: '13-11-2023' | Parsed: 2023-11-13 00:00:00
[DEBUG] 'Бэтмен: Начало' -> Raw: '11-11-2023' | Parsed: 2023-11-11 00:00:00
[DEBUG] 'Миссия невыполнима: Смертельная расплата. Часть первая' -> Raw: '05-11-2023' | Parsed: 2023-11-05 00:00:00
[DEBUG] 'Вера' -> Raw: '01-11-2023' | Parsed: 2023-11-01 00:00:00
[DEBUG] 'Наследники' -> Raw: '01-11-2023' | Parsed: 2023-11-01 00:00:00
[DEBUG] 'Хорошие девчонки' -> Raw: '01-11-2023' | Parsed: 2023-11-01 00:00:00
[DEBUG] 'Падение дома Ашеров' -> Raw: '29-10-2023' | Parsed: 2023-10-29 00:00:00
[DEBUG] 'Человек-бензопила' -> Raw: '27-10-2023' | Parsed: 2023-10-27 00:00:00
[DEBUG] 'Блич [ТВ-1]' -> Raw: '27-10-2023' | Parsed: 2023-10-27 00:00:00
[DEBUG] 'Человек-паук: Паутина Вселенных' -> Raw: '27-10-2023' | Parsed: 2023-10-27 00:00:00
[DEBUG] 'Хороший год' -> Raw: '22-10-2023' | Parsed: 2023-10-22 00:00:00
[DEBUG] 'Дрянь' -> Raw: '22-10-2023' | Parsed: 2023-10-22 00:00:00
[DEBUG] 'Удивительная миссис Мейзел' -> Raw: '16-10-2023' | Parsed: 2023-10-16 00:00:00
[DEBUG] 'Манхэттенская история любви / Любовь на Манхэттене' -> Raw: '08-10-2023' | Parsed: 2023-10-08 00:00:00
[DEBUG] 'Мисс Марпл: Указующий перст' -> Raw: '04-10-2023' | Parsed: 2023-10-04 00:00:00
[DEBUG] 'Мисс Марпл: Зеркало треснуло' -> Raw: '02-10-2023' | Parsed: 2023-10-02 00:00:00
[DEBUG] 'Мисс Марпл: Тело в библиотеке' -> Raw: '02-10-2023' | Parsed: 2023-10-02 00:00:00
[DEBUG] 'Мисс Марпл Агаты Кристи' -> Raw: '01-10-2023' | Parsed: 2023-10-01 00:00:00
[DEBUG] 'Прослушка' -> Raw: '21-09-2023' | Parsed: 2023-09-21 00:00:00
[DEBUG] 'Гордость и предубеждение' -> Raw: '21-09-2023' | Parsed: 2023-09-21 00:00:00
[DEBUG] 'Бриджит Джонс: Грани разумного' -> Raw: '21-09-2023' | Parsed: 2023-09-21 00:00:00
[DEBUG] 'Девушка моего лучшего друга' -> Raw: '21-09-2023' | Parsed: 2023-09-21 00:00:00
[DEBUG] 'One Piece. Большой куш' -> Raw: '08-09-2023' | Parsed: 2023-09-08 00:00:00
[DEBUG] 'Спасти мистера Бэнкса' -> Raw: '06-09-2023' | Parsed: 2023-09-06 00:00:00
[DEBUG] 'Дживс и Вустер' -> Raw: '02-09-2023' | Parsed: 2023-09-02 00:00:00
[DEBUG] 'Зло' -> Raw: '02-09-2023' | Parsed: 2023-09-02 00:00:00
[DEBUG] 'Ночной агент' -> Raw: '02-09-2023' | Parsed: 2023-09-02 00:00:00
[DEBUG] 'Английский пациент' -> Raw: '27-08-2023' | Parsed: 2023-08-27 00:00:00
[DEBUG] 'Напарницы / Риццоли и Айлс' -> Raw: '26-08-2023' | Parsed: 2023-08-26 00:00:00
[DEBUG] 'Ликвидация' -> Raw: '11-08-2023' | Parsed: 2023-08-11 00:00:00
[DEBUG] 'Человек-паук: Через вселенные' -> Raw: '08-08-2023' | Parsed: 2023-08-08 00:00:00
[DEBUG] 'Азазель' -> Raw: '05-08-2023' | Parsed: 2023-08-05 00:00:00
[DEBUG] 'Лютер: Падшее солнце' -> Raw: '05-08-2023' | Parsed: 2023-08-05 00:00:00
[DEBUG] 'Пацаны' -> Raw: '04-08-2023' | Parsed: 2023-08-04 00:00:00
[DEBUG] 'Лас Вегас' -> Raw: '04-08-2023' | Parsed: 2023-08-04 00:00:00
[DEBUG] 'Анна-детективъ' -> Raw: '03-08-2023' | Parsed: 2023-08-03 00:00:00
[DEBUG] 'Открытый брак' -> Raw: '27-07-2023' | Parsed: 2023-07-27 00:00:00
[DEBUG] 'Трансформеры' -> Raw: '27-07-2023' | Parsed: 2023-07-27 00:00:00
[DEBUG] 'Джессика Джонс' -> Raw: '23-07-2023' | Parsed: 2023-07-23 00:00:00
[DEBUG] 'Как избежать наказания за убийство' -> Raw: '06-07-2023' | Parsed: 2023-07-06 00:00:00
[DEBUG] 'Шерлок Холмс' -> Raw: '02-07-2023' | Parsed: 2023-07-02 00:00:00
[DEBUG] 'Новобранец / Новичок / Салага' -> Raw: '07-06-2023' | Parsed: 2023-06-07 00:00:00
[DEBUG] 'Касл' -> Raw: '05-06-2023' | Parsed: 2023-06-05 00:00:00
[DEBUG] 'Убойный отдел' -> Raw: '05-06-2023' | Parsed: 2023-06-05 00:00:00
[DEBUG] 'Пуаро' -> Raw: '04-06-2023' | Parsed: 2023-06-04 00:00:00
[DEBUG] 'Секретные материалы' -> Raw: '04-06-2023' | Parsed: 2023-06-04 00:00:00
[DEBUG] 'Охотник х Охотник' -> Raw: '26-05-2023' | Parsed: 2023-05-26 00:00:00
[DEBUG] 'Обещать – не значит жениться' -> Raw: '17-05-2023' | Parsed: 2023-05-17 00:00:00
[DEBUG] 'Маэстро' -> Raw: '17-05-2023' | Parsed: 2023-05-17 00:00:00
[DEBUG] 'Братья Супер Марио в кино' -> Raw: '15-05-2023' | Parsed: 2023-05-15 00:00:00
[DEBUG] 'Перри Мэйсон' -> Raw: '11-05-2023' | Parsed: 2023-05-11 00:00:00
[DEBUG] 'Хранилище 13' -> Raw: '07-05-2023' | Parsed: 2023-05-07 00:00:00
[DEBUG] 'Темнее черного [ТВ-1]' -> Raw: '04-05-2023' | Parsed: 2023-05-04 00:00:00
[DEBUG] 'Дюрарара!! [ТВ-1] / Всадник без головы [ТВ-1]' -> Raw: '04-05-2023' | Parsed: 2023-05-04 00:00:00
[DEBUG] 'Топ Ган: Мэверик' -> Raw: '04-05-2023' | Parsed: 2023-05-04 00:00:00
[DEBUG] 'Властелин колец: Возвращение Короля' -> Raw: '04-05-2023' | Parsed: 2023-05-04 00:00:00
[DEBUG] 'Властелин колец: Две крепости' -> Raw: '01-05-2023' | Parsed: 2023-05-01 00:00:00
[DEBUG] 'Два парня и девушка' -> Raw: '30-04-2023' | Parsed: 2023-04-30 00:00:00
[DEBUG] 'Властелин колец: Братство кольца' -> Raw: '29-04-2023' | Parsed: 2023-04-29 00:00:00
[DEBUG] 'Кремниевая долина / Силиконовая долина' -> Raw: '22-04-2023' | Parsed: 2023-04-22 00:00:00
[DEBUG] 'Начальница' -> Raw: '22-04-2023' | Parsed: 2023-04-22 00:00:00
[DEBUG] 'Рыцарь дня' -> Raw: '21-04-2023' | Parsed: 2023-04-21 00:00:00
[DEBUG] 'Форсаж' -> Raw: '18-04-2023' | Parsed: 2023-04-18 00:00:00
[DEBUG] 'Помни' -> Raw: '15-04-2023' | Parsed: 2023-04-15 00:00:00
[DEBUG] 'Аватар: Путь воды' -> Raw: '11-04-2023' | Parsed: 2023-04-11 00:00:00
[DEBUG] 'Легенда о Vox Machina / Легенда Вокс Макины' -> Raw: '01-04-2023' | Parsed: 2023-04-01 00:00:00
[DEBUG] 'Джек Ричер' -> Raw: '27-03-2023' | Parsed: 2023-03-27 00:00:00
[DEBUG] 'Дежа вю / Дежавю' -> Raw: '26-03-2023' | Parsed: 2023-03-26 00:00:00
[DEBUG] 'Счастливое число Слевина' -> Raw: '22-03-2023' | Parsed: 2023-03-22 00:00:00
[DEBUG] 'В лучшем мире' -> Raw: '15-03-2023' | Parsed: 2023-03-15 00:00:00
[DEBUG] 'Миссис Брэдли' -> Raw: '14-03-2023' | Parsed: 2023-03-14 00:00:00
[DEBUG] 'Две девицы на мели / Две разорившиеся девочки' -> Raw: '13-03-2023' | Parsed: 2023-03-13 00:00:00
[DEBUG] 'Рекрут' -> Raw: '09-03-2023' | Parsed: 2023-03-09 00:00:00
[DEBUG] 'Харли Квинн' -> Raw: '07-03-2023' | Parsed: 2023-03-07 00:00:00
[DEBUG] 'Карнивал Роу' -> Raw: '07-03-2023' | Parsed: 2023-03-07 00:00:00
[DEBUG] 'Достать ножи' -> Raw: '04-03-2023' | Parsed: 2023-03-04 00:00:00
[DEBUG] 'Бэтмен: Под колпаком' -> Raw: '23-02-2023' | Parsed: 2023-02-23 00:00:00
[DEBUG] 'Бэтмен: Долгий Хэллоуин. Часть 1' -> Raw: '23-02-2023' | Parsed: 2023-02-23 00:00:00
[DEBUG] 'Город хищниц' -> Raw: '19-02-2023' | Parsed: 2023-02-19 00:00:00
[DEBUG] 'Лучший стрелок / Топ Ган' -> Raw: '12-02-2023' | Parsed: 2023-02-12 00:00:00
[DEBUG] 'Кукольный дом' -> Raw: '12-02-2023' | Parsed: 2023-02-12 00:00:00
[DEBUG] 'Покерфейс' -> Raw: '04-02-2023' | Parsed: 2023-02-04 00:00:00
[DEBUG] 'Разделение' -> Raw: '03-02-2023' | Parsed: 2023-02-03 00:00:00
[DEBUG] 'Шерлок' -> Raw: '10-01-2023' | Parsed: 2023-01-10 00:00:00
[DEBUG] 'Горбун из Нотр Дама' -> Raw: '24-12-2022' | Parsed: 2022-12-24 00:00:00
[DEBUG] 'Щелкунчик и четыре королевства' -> Raw: '24-12-2022' | Parsed: 2022-12-24 00:00:00
[DEBUG] 'День сурка' -> Raw: '24-12-2022' | Parsed: 2022-12-24 00:00:00
[DEBUG] 'Мыслить как преступник' -> Raw: '21-12-2022' | Parsed: 2022-12-21 00:00:00
[DEBUG] 'Пространство / Экспансия' -> Raw: '20-12-2022' | Parsed: 2022-12-20 00:00:00
[DEBUG] 'Молодой Морс / Индевор' -> Raw: '17-12-2022' | Parsed: 2022-12-17 00:00:00
[DEBUG] 'Инспектор Морс' -> Raw: '15-12-2022' | Parsed: 2022-12-15 00:00:00
[DEBUG] 'Эврика' -> Raw: '15-12-2022' | Parsed: 2022-12-15 00:00:00
[DEBUG] 'Гранд отель' -> Raw: '04-12-2022' | Parsed: 2022-12-04 00:00:00
[DEBUG] 'Тьма' -> Raw: '26-11-2022' | Parsed: 2022-11-26 00:00:00
[DEBUG] 'Горец' -> Raw: '26-11-2022' | Parsed: 2022-11-26 00:00:00
[DEBUG] 'Шазам!' -> Raw: '22-11-2022' | Parsed: 2022-11-22 00:00:00
[DEBUG] 'Чёрный Адам' -> Raw: '21-11-2022' | Parsed: 2022-11-21 00:00:00
[DEBUG] 'Легион' -> Raw: '20-11-2022' | Parsed: 2022-11-20 00:00:00
[DEBUG] 'Острые козырьки / Заточенные кепки' -> Raw: '19-11-2022' | Parsed: 2022-11-19 00:00:00
[DEBUG] 'Вечность' -> Raw: '10-11-2022' | Parsed: 2022-11-10 00:00:00
[DEBUG] 'Ультиматум Борна' -> Raw: '29-10-2022' | Parsed: 2022-10-29 00:00:00
[DEBUG] 'Следствие по телу' -> Raw: '28-10-2022' | Parsed: 2022-10-28 00:00:00
[DEBUG] 'Хороший доктор' -> Raw: '28-10-2022' | Parsed: 2022-10-28 00:00:00
[DEBUG] 'Превосходство Борна' -> Raw: '28-10-2022' | Parsed: 2022-10-28 00:00:00
[DEBUG] 'Тайные связи / Тайные операции' -> Raw: '22-10-2022' | Parsed: 2022-10-22 00:00:00
[DEBUG] 'S. W. A. T.: Спецназ города ангелов' -> Raw: '19-10-2022' | Parsed: 2022-10-19 00:00:00
[DEBUG] 'Хикару и Го' -> Raw: '08-10-2022' | Parsed: 2022-10-08 00:00:00
[DEBUG] 'Джуманджи' -> Raw: '30-09-2022' | Parsed: 2022-09-30 00:00:00
[DEBUG] 'Ясновидец' -> Raw: '09-09-2022' | Parsed: 2022-09-09 00:00:00
[DEBUG] 'Патриотизм Мориарти [ТВ-1]' -> Raw: '04-09-2022' | Parsed: 2022-09-04 00:00:00
[DEBUG] 'Непокоренный' -> Raw: '29-08-2022' | Parsed: 2022-08-29 00:00:00
[DEBUG] 'Шерлок Холмс и доктор Ватсон: Собака Баскервилей' -> Raw: '28-08-2022' | Parsed: 2022-08-28 00:00:00
[DEBUG] 'Шерлок Холмс и доктор Ватсон: Король шантажа' -> Raw: '28-08-2022' | Parsed: 2022-08-28 00:00:00
[DEBUG] 'Шерлок Холмс и доктор Ватсон: Кровавая надпись' -> Raw: '28-08-2022' | Parsed: 2022-08-28 00:00:00
[DEBUG] 'Шерлок Холмс и доктор Ватсон: Знакомство' -> Raw: '28-08-2022' | Parsed: 2022-08-28 00:00:00
[DEBUG] 'Созданный в Бездне [ТВ-1]' -> Raw: '27-08-2022' | Parsed: 2022-08-27 00:00:00
[DEBUG] 'Ход королевы / Ферзевый гамбит' -> Raw: '26-08-2022' | Parsed: 2022-08-26 00:00:00
[DEBUG] 'Гавайи 5.0 / Полиция Гавайев' -> Raw: '20-08-2022' | Parsed: 2022-08-20 00:00:00
[DEBUG] 'Слепая зона / Слепое пятно' -> Raw: '13-08-2022' | Parsed: 2022-08-13 00:00:00
[DEBUG] 'Джек Райан' -> Raw: '13-08-2022' | Parsed: 2022-08-13 00:00:00
[DEBUG] 'Человек на Луне' -> Raw: '12-08-2022' | Parsed: 2022-08-12 00:00:00
[DEBUG] 'Расследование сестры Бонифации' -> Raw: '06-08-2022' | Parsed: 2022-08-06 00:00:00
[DEBUG] 'Падение Олимпа' -> Raw: '01-08-2022' | Parsed: 2022-08-01 00:00:00
[DEBUG] 'Ford против Ferrari' -> Raw: '30-07-2022' | Parsed: 2022-07-30 00:00:00
[DEBUG] 'Основатель' -> Raw: '28-07-2022' | Parsed: 2022-07-28 00:00:00
[DEBUG] 'Дефективный детектив / Детектив Монк' -> Raw: '08-07-2022' | Parsed: 2022-07-08 00:00:00
[DEBUG] 'Анчартед: На картах не значится' -> Raw: '25-06-2022' | Parsed: 2022-06-25 00:00:00
[DEBUG] 'Кашемировая мафия' -> Raw: '25-06-2022' | Parsed: 2022-06-25 00:00:00
[DEBUG] 'Локи' -> Raw: '19-06-2022' | Parsed: 2022-06-19 00:00:00
[DEBUG] 'Патруль времени' -> Raw: '10-06-2022' | Parsed: 2022-06-10 00:00:00
[DEBUG] 'Мисс Марпл: Убийство в доме викария' -> Raw: '10-06-2022' | Parsed: 2022-06-10 00:00:00
[DEBUG] 'Мисс Марпл: Точно по расписанию' -> Raw: '08-06-2022' | Parsed: 2022-06-08 00:00:00
[DEBUG] 'Мисс Марпл: Забытое убийство' -> Raw: '06-06-2022' | Parsed: 2022-06-06 00:00:00
[DEBUG] 'Преступник: Великобритания' -> Raw: '05-06-2022' | Parsed: 2022-06-05 00:00:00
[DEBUG] 'Перелом' -> Raw: '05-06-2022' | Parsed: 2022-06-05 00:00:00
[DEBUG] 'На гребне волны' -> Raw: '04-06-2022' | Parsed: 2022-06-04 00:00:00
[DEBUG] 'Почти человек' -> Raw: '03-06-2022' | Parsed: 2022-06-03 00:00:00
[DEBUG] 'Мисс Марпл: Тайна Карибского залива' -> Raw: '02-06-2022' | Parsed: 2022-06-02 00:00:00
[DEBUG] 'Мисс Марпл: С помощью зеркала' -> Raw: '02-06-2022' | Parsed: 2022-06-02 00:00:00
[DEBUG] 'Чип и Дейл спешат на помощь (2022)' -> Raw: '01-06-2022' | Parsed: 2022-06-01 00:00:00
[DEBUG] 'Убийства в одном здании' -> Raw: '31-05-2022' | Parsed: 2022-05-31 00:00:00
[DEBUG] 'Леди-детектив мисс Фрайни Фишер' -> Raw: '16-05-2022' | Parsed: 2022-05-16 00:00:00
[DEBUG] 'В поле зрения / Подозреваемый' -> Raw: '13-04-2022' | Parsed: 2022-04-13 00:00:00
[DEBUG] 'Лунный рыцарь' -> Raw: '07-04-2022' | Parsed: 2022-04-07 00:00:00
[DEBUG] 'Человек-паук: Нет пути домой' -> Raw: '16-03-2022' | Parsed: 2022-03-16 00:00:00
[DEBUG] 'Рискованный бизнес' -> Raw: '13-03-2022' | Parsed: 2022-03-13 00:00:00
[DEBUG] 'Жестокие игры' -> Raw: '12-03-2022' | Parsed: 2022-03-12 00:00:00
[DEBUG] 'Сорвиголова' -> Raw: '09-03-2022' | Parsed: 2022-03-09 00:00:00
[DEBUG] 'Темный рыцарь: Возрождение легенды' -> Raw: '06-03-2022' | Parsed: 2022-03-06 00:00:00
[DEBUG] 'Мисс Марпл: Объявленное убийство' -> Raw: '04-03-2022' | Parsed: 2022-03-04 00:00:00
[DEBUG] 'Индиана Джонс: В поисках утраченного ковчега' -> Raw: '22-02-2022' | Parsed: 2022-02-22 00:00:00
[DEBUG] 'К звёздам' -> Raw: '22-02-2022' | Parsed: 2022-02-22 00:00:00
[DEBUG] 'Сквозь снег' -> Raw: '20-02-2022' | Parsed: 2022-02-20 00:00:00
[DEBUG] 'Настоящий детектив' -> Raw: '20-02-2022' | Parsed: 2022-02-20 00:00:00
[DEBUG] 'О чём говорят мужчины' -> Raw: '19-02-2022' | Parsed: 2022-02-19 00:00:00
[DEBUG] 'Три икса' -> Raw: '19-02-2022' | Parsed: 2022-02-19 00:00:00
[DEBUG] 'Бесславные ублюдки' -> Raw: '11-02-2022' | Parsed: 2022-02-11 00:00:00
[DEBUG] 'Лютер' -> Raw: '08-02-2022' | Parsed: 2022-02-08 00:00:00
[DEBUG] 'Пираты Карибского моря: Мертвецы не рассказывают сказки' -> Raw: '29-01-2022' | Parsed: 2022-01-29 00:00:00
[DEBUG] 'Деньги на двоих' -> Raw: '27-01-2022' | Parsed: 2022-01-27 00:00:00
[DEBUG] 'Пираты Карибского моря: На странных берегах' -> Raw: '23-01-2022' | Parsed: 2022-01-23 00:00:00
[DEBUG] 'Двадцать одно' -> Raw: '21-01-2022' | Parsed: 2022-01-21 00:00:00
[DEBUG] 'Пираты Карибского моря: На краю Света' -> Raw: '21-01-2022' | Parsed: 2022-01-21 00:00:00
[DEBUG] 'Пираты Карибского моря: Сундук мертвеца' -> Raw: '20-01-2022' | Parsed: 2022-01-20 00:00:00
[DEBUG] 'Пираты Карибского моря: Проклятие Черной жемчужины' -> Raw: '18-01-2022' | Parsed: 2022-01-18 00:00:00
[DEBUG] 'Фокус' -> Raw: '15-01-2022' | Parsed: 2022-01-15 00:00:00
[DEBUG] 'Лучшее предложение' -> Raw: '13-01-2022' | Parsed: 2022-01-13 00:00:00
[DEBUG] 'Гарри Поттер 20 лет спустя: Возвращение в Хогвартс' -> Raw: '12-01-2022' | Parsed: 2022-01-12 00:00:00
[DEBUG] 'Люди в черном: Интернэшнл' -> Raw: '09-01-2022' | Parsed: 2022-01-09 00:00:00
[DEBUG] 'Мир Дикого Запада / Западный мир' -> Raw: '09-01-2022' | Parsed: 2022-01-09 00:00:00
[DEBUG] 'Здесь и сейчас' -> Raw: '08-01-2022' | Parsed: 2022-01-08 00:00:00
[DEBUG] 'Ночной дозор' -> Raw: '07-01-2022' | Parsed: 2022-01-07 00:00:00
[DEBUG] 'В погоне за счастьем' -> Raw: '07-01-2022' | Parsed: 2022-01-07 00:00:00
[DEBUG] 'Подозрительные лица' -> Raw: '04-01-2022' | Parsed: 2022-01-04 00:00:00
[DEBUG] 'Предел риска' -> Raw: '04-01-2022' | Parsed: 2022-01-04 00:00:00
[DEBUG] 'Игра на понижение' -> Raw: '03-01-2022' | Parsed: 2022-01-03 00:00:00
[DEBUG] 'Волшебники' -> Raw: '02-01-2022' | Parsed: 2022-01-02 00:00:00
[DEBUG] 'Хроники Нарнии: Покоритель Зари' -> Raw: '02-01-2022' | Parsed: 2022-01-02 00:00:00
[DEBUG] 'Хроники Нарнии: Принц Каспиан' -> Raw: '01-01-2022' | Parsed: 2022-01-01 00:00:00
[DEBUG] 'Служебный роман' -> Raw: '01-01-2022' | Parsed: 2022-01-01 00:00:00
[DEBUG] 'Мисс Конгениальность' -> Raw: '01-01-2022' | Parsed: 2022-01-01 00:00:00
[DEBUG] 'Хроники Нарнии: Лев, колдунья и волшебный шкаф' -> Raw: '01-01-2022' | Parsed: 2022-01-01 00:00:00
[DEBUG] 'Черный Плащ' -> Raw: '31-12-2021' | Parsed: 2021-12-31 00:00:00
[DEBUG] 'Новое шоу Тома и Джерри' -> Raw: '31-12-2021' | Parsed: 2021-12-31 00:00:00
[DEBUG] 'Матрица: Воскрешение' -> Raw: '31-12-2021' | Parsed: 2021-12-31 00:00:00
[DEBUG] 'Друзья: Воссоединение' -> Raw: '30-12-2021' | Parsed: 2021-12-30 00:00:00
[DEBUG] 'Гнев человеческий' -> Raw: '30-12-2021' | Parsed: 2021-12-30 00:00:00
[DEBUG] 'Главный герой' -> Raw: '28-12-2021' | Parsed: 2021-12-28 00:00:00
[DEBUG] 'Человек-паук: Вдали от дома' -> Raw: '24-12-2021' | Parsed: 2021-12-24 00:00:00
[DEBUG] 'Человек-паук: Возвращение домой' -> Raw: '23-12-2021' | Parsed: 2021-12-23 00:00:00
[DEBUG] 'Лука' -> Raw: '20-12-2021' | Parsed: 2021-12-20 00:00:00
[DEBUG] 'Области тьмы' -> Raw: '19-12-2021' | Parsed: 2021-12-19 00:00:00
[DEBUG] 'Разум и чувства' -> Raw: '18-12-2021' | Parsed: 2021-12-18 00:00:00
[DEBUG] 'Законы привлекательности' -> Raw: '17-12-2021' | Parsed: 2021-12-17 00:00:00
[DEBUG] 'Правила съема: Метод Хитча' -> Raw: '17-12-2021' | Parsed: 2021-12-17 00:00:00
[DEBUG] 'Хэнкок' -> Raw: '16-12-2021' | Parsed: 2021-12-16 00:00:00
[DEBUG] 'Люди Икс' -> Raw: '16-12-2021' | Parsed: 2021-12-16 00:00:00
[DEBUG] 'Фантастические твари: Преступления Грин-де-Вальда' -> Raw: '15-12-2021' | Parsed: 2021-12-15 00:00:00
[DEBUG] 'Фантастические твари и где они обитают' -> Raw: '15-12-2021' | Parsed: 2021-12-15 00:00:00
[DEBUG] '300 спартанцев' -> Raw: '12-12-2021' | Parsed: 2021-12-12 00:00:00
[DEBUG] 'Меч короля Артура' -> Raw: '11-12-2021' | Parsed: 2021-12-11 00:00:00
[DEBUG] 'Агенты А.Н.К.Л.' -> Raw: '11-12-2021' | Parsed: 2021-12-11 00:00:00
[DEBUG] 'Назад в будущее 3' -> Raw: '01-12-2021' | Parsed: 2021-12-01 00:00:00
[DEBUG] 'Назад в будущее 2' -> Raw: '29-11-2021' | Parsed: 2021-11-29 00:00:00
[DEBUG] 'Назад в будущее' -> Raw: '29-11-2021' | Parsed: 2021-11-29 00:00:00
[DEBUG] 'Веном 2' -> Raw: '25-11-2021' | Parsed: 2021-11-25 00:00:00
[DEBUG] 'Карты, деньги, два ствола' -> Raw: '15-11-2021' | Parsed: 2021-11-15 00:00:00
[DEBUG] 'Матрица' -> Raw: '12-11-2021' | Parsed: 2021-11-12 00:00:00
[DEBUG] 'Рейд' -> Raw: '12-11-2021' | Parsed: 2021-11-12 00:00:00
[DEBUG] 'Богемская рапсодия' -> Raw: '12-11-2021' | Parsed: 2021-11-12 00:00:00
[DEBUG] 'Триумф' -> Raw: '08-11-2021' | Parsed: 2021-11-08 00:00:00
[DEBUG] 'Остров проклятых' -> Raw: '06-11-2021' | Parsed: 2021-11-06 00:00:00
[DEBUG] 'Как я встретил вашу маму' -> Raw: '05-11-2021' | Parsed: 2021-11-05 00:00:00
[DEBUG] 'Кейт и Лео' -> Raw: '30-10-2021' | Parsed: 2021-10-30 00:00:00
[DEBUG] 'Джон Уик 3' -> Raw: '29-10-2021' | Parsed: 2021-10-29 00:00:00
[DEBUG] 'Джон Уик 2' -> Raw: '25-10-2021' | Parsed: 2021-10-25 00:00:00
[DEBUG] 'Джон Уик' -> Raw: '24-10-2021' | Parsed: 2021-10-24 00:00:00
[DEBUG] 'Светлячок' -> Raw: '24-10-2021' | Parsed: 2021-10-24 00:00:00
[DEBUG] 'Kingsman: Секретная служба' -> Raw: '23-10-2021' | Parsed: 2021-10-23 00:00:00
[DEBUG] 'Обратная тяга' -> Raw: '19-10-2021' | Parsed: 2021-10-19 00:00:00
[DEBUG] 'Титаник' -> Raw: '14-10-2021' | Parsed: 2021-10-14 00:00:00
[DEBUG] 'Тринадцатый этаж' -> Raw: '25-09-2021' | Parsed: 2021-09-25 00:00:00
[DEBUG] 'Скотт Пилигрим против всех' -> Raw: '30-08-2021' | Parsed: 2021-08-30 00:00:00
[DEBUG] 'Константин: Повелитель тьмы' -> Raw: '28-08-2021' | Parsed: 2021-08-28 00:00:00
[DEBUG] 'Грабь награбленное / Воздействие' -> Raw: '26-08-2021' | Parsed: 2021-08-26 00:00:00
[DEBUG] 'Код Да Винчи' -> Raw: '06-08-2021' | Parsed: 2021-08-06 00:00:00
[DEBUG] 'Римские приключения' -> Raw: '01-08-2021' | Parsed: 2021-08-01 00:00:00
[DEBUG] 'P.S. Я люблю тебя' -> Raw: '23-07-2021' | Parsed: 2021-07-23 00:00:00
[DEBUG] 'Не пойман – не вор' -> Raw: '04-07-2021' | Parsed: 2021-07-04 00:00:00
[DEBUG] 'Любовь, смерть и роботы' -> Raw: '16-06-2021' | Parsed: 2021-06-16 00:00:00
[DEBUG] 'Аватар' -> Raw: '13-06-2021' | Parsed: 2021-06-13 00:00:00
[DEBUG] 'Гаттака' -> Raw: '12-06-2021' | Parsed: 2021-06-12 00:00:00
[DEBUG] 'Университет монстров' -> Raw: '10-06-2021' | Parsed: 2021-06-10 00:00:00
[DEBUG] 'Райя и последний дракон' -> Raw: '10-06-2021' | Parsed: 2021-06-10 00:00:00
[DEBUG] 'Твое имя' -> Raw: '07-06-2021' | Parsed: 2021-06-07 00:00:00
[DEBUG] 'Живая мишень' -> Raw: '05-06-2021' | Parsed: 2021-06-05 00:00:00
[DEBUG] 'Блудный сын' -> Raw: '05-06-2021' | Parsed: 2021-06-05 00:00:00
[DEBUG] 'Черная метка' -> Raw: '11-05-2021' | Parsed: 2021-05-11 00:00:00
[DEBUG] 'Король говорит!' -> Raw: '29-04-2021' | Parsed: 2021-04-29 00:00:00
[DEBUG] 'Армагеддон' -> Raw: '20-03-2021' | Parsed: 2021-03-20 00:00:00
[DEBUG] 'Трасса 60' -> Raw: '17-03-2021' | Parsed: 2021-03-17 00:00:00
[DEBUG] 'Зелёная книга' -> Raw: '15-03-2021' | Parsed: 2021-03-15 00:00:00
[DEBUG] 'Мирный воин' -> Raw: '13-03-2021' | Parsed: 2021-03-13 00:00:00
[DEBUG] 'Клаус' -> Raw: '01-03-2021' | Parsed: 2021-03-01 00:00:00
[DEBUG] 'Аэронавты' -> Raw: '01-03-2021' | Parsed: 2021-03-01 00:00:00
[DEBUG] 'Познакомьтесь с Дороти Дендридж' -> Raw: '28-02-2021' | Parsed: 2021-02-28 00:00:00
[DEBUG] 'Ирландец' -> Raw: '28-02-2021' | Parsed: 2021-02-28 00:00:00
[DEBUG] 'Начало' -> Raw: '28-02-2021' | Parsed: 2021-02-28 00:00:00
[DEBUG] 'Пока не сыграл в ящик' -> Raw: '26-02-2021' | Parsed: 2021-02-26 00:00:00
[DEBUG] 'Побег из Шоушенка' -> Raw: '25-02-2021' | Parsed: 2021-02-25 00:00:00
[DEBUG] 'Тайна Коко' -> Raw: '24-02-2021' | Parsed: 2021-02-24 00:00:00
[DEBUG] 'Унесенные ветром' -> Raw: '21-02-2021' | Parsed: 2021-02-21 00:00:00
[DEBUG] 'Маленькие женщины' -> Raw: '21-02-2021' | Parsed: 2021-02-21 00:00:00
[DEBUG] 'Меняющие реальность' -> Raw: '15-02-2021' | Parsed: 2021-02-15 00:00:00
[DEBUG] 'Две королевы' -> Raw: '14-02-2021' | Parsed: 2021-02-14 00:00:00
[DEBUG] 'Видоизмененный углерод' -> Raw: '13-02-2021' | Parsed: 2021-02-13 00:00:00
[DEBUG] 'Суррогаты' -> Raw: '07-02-2021' | Parsed: 2021-02-07 00:00:00
[DEBUG] 'Довод' -> Raw: '06-02-2021' | Parsed: 2021-02-06 00:00:00
[DEBUG] 'Чудо-женщина: 1984' -> Raw: '05-02-2021' | Parsed: 2021-02-05 00:00:00
[DEBUG] 'Душа' -> Raw: '31-01-2021' | Parsed: 2021-01-31 00:00:00
[DEBUG] 'Мэверик' -> Raw: '27-01-2021' | Parsed: 2021-01-27 00:00:00
[DEBUG] 'Девятые врата' -> Raw: '26-01-2021' | Parsed: 2021-01-26 00:00:00
[DEBUG] 'Отступники' -> Raw: '26-01-2021' | Parsed: 2021-01-26 00:00:00

Phase 1: Resolving IMDB IDs for 485 items...
Resolving IDs:   0%|                                                                                                                                                                                                                                                                             | 0/485 [00:00<?, ?it/s]Resolving IDs:   0%|                                                                                                                                                                                                                                                         | 0/485 [00:00<?, ?it/s, Cached: Рыцарь дня]Resolving IDs:   0%|4                                                                                                                                                                                                                                              | 1/485 [00:00<00:00, 1092.84it/s, Cached: Начальница]Resolving IDs:   0%|9                                                                                                                                                                                                                                    | 2/485 [00:00<00:00, 1374.51it/s, Cached: Кремниевая долина / ]Resolving IDs:   1%|#4                                                                                                                                                                                                                                   | 3/485 [00:00<00:00, 1550.19it/s, Cached: Властелин колец: Бра]Resolving IDs:   1%|#8                                                                                                                                                                                                                                    | 4/485 [00:00<00:00, 1693.81it/s, Cached: Два парня и девушка]Resolving IDs:   1%|##3                                                                                                                                                                                                                                  | 5/485 [00:00<00:00, 1822.03it/s, Cached: Рождество не по план]Resolving IDs:   1%|##8                                                                                                                                                                                                                                  | 6/485 [00:00<00:00, 1879.59it/s, Cached: Властелин колец: Две]Resolving IDs:   1%|###3                                                                                                                                                                                                                                 | 7/485 [00:00<00:00, 2005.06it/s, Cached: Властелин колец: Воз]Resolving IDs:   2%|###8                                                                                                                                                                                                                                     | 8/485 [00:00<00:00, 2059.94it/s, Cached: Топ Ган: Мэверик]Resolving IDs:   2%|####2                                                                                                                                                                                                                                | 9/485 [00:00<00:00, 2026.78it/s, Cached: Дюрарара!! [ТВ-1] / ]Resolving IDs:   2%|####7                                                                                                                                                                                                                               | 10/485 [00:00<00:00, 2007.13it/s, Cached: Темнее черного [ТВ-1]Resolving IDs:   2%|#####3                                                                                                                                                                                                                                      | 11/485 [00:00<00:00, 2013.76it/s, Cached: Хранилище 13]Resolving IDs:   2%|#####8                                                                                                                                                                                                                                      | 12/485 [00:00<00:00, 2034.67it/s, Cached: Перри Мэйсон]Resolving IDs:   3%|######1                                                                                                                                                                                                                             | 13/485 [00:00<00:00, 2075.76it/s, Cached: Братья Супер Марио в]Resolving IDs:   3%|######5                                                                                                                                                                                                                             | 14/485 [00:00<00:00, 2121.86it/s, Cached: Испытание невиновнос]Resolving IDs:   3%|#######                                                                                                                                                                                                                             | 15/485 [00:00<00:00, 2133.78it/s, Cached: Гарри Поттер и филос]Resolving IDs:   3%|#######9                                                                                                                                                                                                                                         | 16/485 [00:00<00:00, 2147.35it/s, Cached: Маэстро]Resolving IDs:   4%|#######9                                                                                                                                                                                                                            | 17/485 [00:00<00:00, 2188.69it/s, Cached: Обещать – не значит ]Resolving IDs:   4%|########5                                                                                                                                                                                                                              | 18/485 [00:00<00:00, 2207.08it/s, Cached: Охотник х Охотник]Resolving IDs:   4%|########9                                                                                                                                                                                                                           | 19/485 [00:00<00:00, 2232.14it/s, Cached: Хорошая жена / Прави]Resolving IDs:   4%|#########4                                                                                                                                                                                                                           | 20/485 [00:00<00:00, 2223.44it/s, Cached: Секретные материалы]Resolving IDs:   4%|##########5                                                                                                                                                                                                                                        | 21/485 [00:00<00:00, 2216.92it/s, Cached: Пуаро]Resolving IDs:   5%|##########6                                                                                                                                                                                                                                | 22/485 [00:00<00:00, 2211.18it/s, Cached: Убойный отдел]Resolving IDs:   5%|###########5                                                                                                                                                                                                                                        | 23/485 [00:00<00:00, 2199.63it/s, Cached: Касл]Resolving IDs:   5%|###########3                                                                                                                                                                                                                         | 24/485 [00:00<00:00, 2205.50it/s, Cached: Сознавайтесь, Флетч]Resolving IDs:   5%|###########7                                                                                                                                                                                                                        | 25/485 [00:00<00:00, 2215.83it/s, Cached: Новобранец / Новичок]Resolving IDs:   5%|############6                                                                                                                                                                                                                               | 26/485 [00:00<00:00, 2210.30it/s, Cached: Шерлок Холмс]Resolving IDs:   6%|############6                                                                                                                                                                                                                       | 27/485 [00:00<00:00, 2199.47it/s, Cached: Как избежать наказан]Resolving IDs:   6%|#############5                                                                                                                                                                                                                            | 28/485 [00:00<00:00, 2204.59it/s, Cached: Джессика Джонс]Resolving IDs:   6%|##############1                                                                                                                                                                                                                              | 29/485 [00:00<00:00, 2224.04it/s, Cached: Профессор Т]Resolving IDs:   6%|##############5                                                                                                                                                                                                                             | 30/485 [00:00<00:00, 2218.82it/s, Cached: Трансформеры]Resolving IDs:   6%|###############                                                                                                                                                                                                                            | 31/485 [00:00<00:00, 2210.19it/s, Cached: Открытый брак]Resolving IDs:   7%|###############4                                                                                                                                                                                                                          | 32/485 [00:00<00:00, 2231.79it/s, Cached: Анна-детективъ]Resolving IDs:   7%|################2                                                                                                                                                                                                                              | 33/485 [00:00<00:00, 2235.01it/s, Cached: Лас Вегас]Resolving IDs:   7%|################9                                                                                                                                                                                                                                 | 34/485 [00:00<00:00, 2240.86it/s, Cached: Пацаны]Resolving IDs:   7%|################4                                                                                                                                                                                                                   | 35/485 [00:00<00:00, 2247.37it/s, Cached: Лютер: Падшее солнце]Resolving IDs:   7%|#################8                                                                                                                                                                                                                               | 36/485 [00:00<00:00, 2255.14it/s, Cached: Азазель]Resolving IDs:   8%|#################3                                                                                                                                                                                                                  | 37/485 [00:00<00:00, 2264.25it/s, Cached: Человек-паук: Через ]Resolving IDs:   8%|##################6                                                                                                                                                                                                                           | 38/485 [00:00<00:00, 2264.23it/s, Cached: Ликвидация]Resolving IDs:   8%|##################3                                                                                                                                                                                                                 | 39/485 [00:00<00:00, 2259.74it/s, Cached: Напарницы / Риццоли ]Resolving IDs:   8%|##################9                                                                                                                                                                                                                   | 40/485 [00:00<00:00, 2249.95it/s, Cached: Английский пациент]Resolving IDs:   8%|###################2                                                                                                                                                                                                                | 41/485 [00:00<00:00, 2243.56it/s, Cached: Рождественское обеща]Resolving IDs:   9%|####################4                                                                                                                                                                                                                       | 42/485 [00:00<00:00, 2251.75it/s, Cached: Ночной агент]Resolving IDs:   9%|#####################7                                                                                                                                                                                                                               | 43/485 [00:00<00:00, 2251.03it/s, Cached: Зло]Resolving IDs:   9%|#####################2                                                                                                                                                                                                                    | 44/485 [00:00<00:00, 2255.69it/s, Cached: Дживс и Вустер]Resolving IDs:   9%|#####################1                                                                                                                                                                                                              | 45/485 [00:00<00:00, 2258.73it/s, Cached: Спасти мистера Бэнкс]Resolving IDs:   9%|#####################9                                                                                                                                                                                                                 | 46/485 [00:00<00:00, 2257.67it/s, Cached: Одна на рождество]Resolving IDs:  10%|######################6                                                                                                                                                                                                                   | 47/485 [00:00<00:00, 2250.42it/s, Cached: Девочки Гилмор]Resolving IDs:  10%|######################5                                                                                                                                                                                                             | 48/485 [00:00<00:00, 2243.89it/s, Cached: One Piece. Большой к]Resolving IDs:  10%|#######################                                                                                                                                                                                                             | 49/485 [00:00<00:00, 2240.25it/s, Cached: Девушка моего лучшег]Resolving IDs:  10%|#######################5                                                                                                                                                                                                            | 50/485 [00:00<00:00, 2227.84it/s, Cached: Бриджит Джонс: Грани]Resolving IDs:  11%|#######################9                                                                                                                                                                                                            | 51/485 [00:00<00:00, 2230.13it/s, Cached: Гордость и предубежд]Resolving IDs:  11%|#########################6                                                                                                                                                                                                                     | 52/485 [00:00<00:00, 2234.67it/s, Cached: Прослушка]Resolving IDs:  11%|########################9                                                                                                                                                                                                           | 53/485 [00:00<00:00, 2235.84it/s, Cached: Мисс Марпл Агаты Кри]Resolving IDs:  11%|#########################3                                                                                                                                                                                                          | 54/485 [00:00<00:00, 2228.44it/s, Cached: Мисс Марпл: Тело в б]Resolving IDs:  11%|#########################8                                                                                                                                                                                                          | 55/485 [00:00<00:00, 2227.33it/s, Cached: Мисс Марпл: Зеркало ]Resolving IDs:  12%|##########################3                                                                                                                                                                                                         | 56/485 [00:00<00:00, 2224.15it/s, Cached: Мисс Марпл: Указующи]Resolving IDs:  12%|##########################7                                                                                                                                                                                                         | 57/485 [00:00<00:00, 2221.08it/s, Cached: Манхэттенская истори]Resolving IDs:  12%|###########################2                                                                                                                                                                                                        | 58/485 [00:00<00:00, 2217.27it/s, Cached: Удивительная миссис ]Resolving IDs:  12%|#############################5                                                                                                                                                                                                                     | 59/485 [00:00<00:00, 2211.97it/s, Cached: Дрянь]Resolving IDs:  12%|#############################3                                                                                                                                                                                                               | 60/485 [00:00<00:00, 2208.56it/s, Cached: Хороший год]Resolving IDs:  13%|############################6                                                                                                                                                                                                       | 61/485 [00:00<00:00, 2204.09it/s, Cached: Человек-паук: Паутин]Resolving IDs:  13%|##############################2                                                                                                                                                                                                              | 62/485 [00:00<00:00, 2200.75it/s, Cached: Блич [ТВ-1]]Resolving IDs:  13%|##############################                                                                                                                                                                                                         | 63/485 [00:00<00:00, 2199.26it/s, Cached: Человек-бензопила]Resolving IDs:  13%|##############################2                                                                                                                                                                                                      | 64/485 [00:00<00:00, 2198.04it/s, Cached: Падение дома Ашеров]Resolving IDs:  13%|###############################                                                                                                                                                                                                         | 65/485 [00:00<00:00, 2191.54it/s, Cached: Хорошие девчонки]Resolving IDs:  14%|################################3                                                                                                                                                                                                             | 66/485 [00:00<00:00, 2187.66it/s, Cached: Наследники]Resolving IDs:  14%|#################################7                                                                                                                                                                                                                  | 67/485 [00:00<00:00, 2186.90it/s, Cached: Вера]Resolving IDs:  14%|###############################9                                                                                                                                                                                                    | 68/485 [00:00<00:00, 2187.03it/s, Cached: Миссия невыполнима: ]Resolving IDs:  14%|#################################2                                                                                                                                                                                                        | 69/485 [00:00<00:00, 2185.44it/s, Cached: Бэтмен: Начало]Resolving IDs:  14%|#################################9                                                                                                                                                                                                         | 70/485 [00:00<00:00, 2190.04it/s, Cached: Темный рыцарь]Resolving IDs:  15%|##################################2                                                                                                                                                                                                       | 71/485 [00:00<00:00, 2189.42it/s, Cached: Розмари и Тайм]Resolving IDs:  15%|##################################4                                                                                                                                                                                                     | 72/485 [00:00<00:00, 2185.81it/s, Cached: Железный человек]Resolving IDs:  15%|###################################2                                                                                                                                                                                                      | 73/485 [00:00<00:00, 2181.54it/s, Cached: Доктор Стрэндж]Resolving IDs:  15%|##################################7                                                                                                                                                                                                 | 74/485 [00:00<00:00, 2178.61it/s, Cached: Подземелья и драконы]Resolving IDs:  15%|####################################8                                                                                                                                                                                                         | 75/485 [00:00<00:00, 2173.47it/s, Cached: Притворщик]Resolving IDs:  16%|#####################################2                                                                                                                                                                                                        | 76/485 [00:00<00:00, 2172.16it/s, Cached: Отец Браун]Resolving IDs:  16%|#####################################3                                                                                                                                                                                                     | 77/485 [00:00<00:00, 2166.73it/s, Cached: Пятый элемент]Resolving IDs:  16%|#####################################1                                                                                                                                                                                                 | 78/485 [00:00<00:00, 2158.45it/s, Cached: Покровские ворота]Resolving IDs:  16%|#####################################6                                                                                                                                                                                                 | 79/485 [00:00<00:00, 2157.69it/s, Cached: Обыкновенное чудо]Resolving IDs:  16%|#######################################2                                                                                                                                                                                                      | 80/485 [00:00<00:00, 2156.21it/s, Cached: Вам письмо]Resolving IDs:  17%|######################################                                                                                                                                                                                              | 81/485 [00:00<00:00, 2144.23it/s, Cached: Самая обаятельная и ]Resolving IDs:  17%|#######################################5                                                                                                                                                                                                  | 82/485 [00:00<00:00, 2142.90it/s, Cached: Братство волка]Resolving IDs:  17%|########################################                                                                                                                                                                                                  | 83/485 [00:00<00:00, 2146.31it/s, Cached: Золотой компас]Resolving IDs:  17%|########################################8                                                                                                                                                                                                   | 84/485 [00:00<00:00, 2142.54it/s, Cached: Пока ты спал]Resolving IDs:  18%|########################################6                                                                                                                                                                                               | 85/485 [00:00<00:00, 2142.36it/s, Cached: Тариф Новогодний]Resolving IDs:  18%|########################################6                                                                                                                                                                                            | 86/485 [00:00<00:00, 2140.07it/s, Cached: Замерзшая из Майами]Resolving IDs:  18%|#########################################6                                                                                                                                                                                              | 87/485 [00:00<00:00, 2140.74it/s, Cached: Четыре Рождества]Resolving IDs:  18%|#########################################3                                                                                                                                                                                          | 88/485 [00:00<00:00, 2140.75it/s, Cached: Рождественский котте]Resolving IDs:  18%|#########################################8                                                                                                                                                                                          | 89/485 [00:00<00:00, 2136.46it/s, Cached: Сумерки. Сага. Рассв]Resolving IDs:  19%|###########################################9                                                                                                                                                                                                 | 90/485 [00:00<00:00, 2134.81it/s, Cached: Ночные игры]Resolving IDs:  19%|############################################2                                                                                                                                                                                               | 91/485 [00:00<00:00, 2140.86it/s, Cached: Агата Рэйзин]Resolving IDs:  19%|############################################                                                                                                                                                                                            | 92/485 [00:00<00:00, 2142.49it/s, Cached: Отпуск по обмену]Resolving IDs:  19%|#############################################8                                                                                                                                                                                                 | 93/485 [00:00<00:00, 2141.60it/s, Cached: Я – зомби]Resolving IDs:  19%|############################################1                                                                                                                                                                                       | 94/485 [00:00<00:00, 2141.40it/s, Cached: Шекспир и Хэтэуэй: Ч]Resolving IDs:  20%|#############################################8                                                                                                                                                                                            | 95/485 [00:00<00:00, 2140.13it/s, Cached: Игра престолов]Resolving IDs:  20%|##############################################5                                                                                                                                                                                            | 96/485 [00:00<00:00, 2136.13it/s, Cached: Королевы тайн]Resolving IDs:  20%|#############################################6                                                                                                                                                                                      | 97/485 [00:00<00:00, 2136.94it/s, Cached: Вечеринка / Афтепати]Resolving IDs:  20%|################################################4                                                                                                                                                                                               | 98/485 [00:00<00:00, 2141.65it/s, Cached: Сознание]Resolving IDs:  20%|##############################################5                                                                                                                                                                                     | 99/485 [00:00<00:00, 2144.91it/s, Cached: Достать ножи: Стекля]Resolving IDs:  21%|##############################################8                                                                                                                                                                                    | 100/485 [00:00<00:00, 2142.47it/s, Cached: Расследования Мердок]Resolving IDs:  21%|###############################################2                                                                                                                                                                                   | 101/485 [00:00<00:00, 2142.62it/s, Cached: Зов крови / Потерянн]Resolving IDs:  21%|###############################################9                                                                                                                                                                                    | 102/485 [00:00<00:00, 2139.31it/s, Cached: Алита: Боевой ангел]Resolving IDs:  21%|################################################6                                                                                                                                                                                    | 103/485 [00:00<00:00, 2141.70it/s, Cached: Умри, но не сейчас]Resolving IDs:  21%|################################################6                                                                                                                                                                                  | 104/485 [00:00<00:00, 2143.86it/s, Cached: Как важно быть серье]Resolving IDs:  22%|#################################################3                                                                                                                                                                                  | 105/485 [00:00<00:00, 2140.55it/s, Cached: Психопаспорт [ТВ-1]]Resolving IDs:  22%|####################################################                                                                                                                                                                                          | 106/485 [00:00<00:00, 2142.46it/s, Cached: Марсианин]Resolving IDs:  22%|##################################################                                                                                                                                                                                 | 107/485 [00:00<00:00, 2141.78it/s, Cached: Безумный Макс: Дорог]Resolving IDs:  22%|###################################################2                                                                                                                                                                                  | 108/485 [00:00<00:00, 2142.54it/s, Cached: Принцесса-невеста]Resolving IDs:  22%|#####################################################2                                                                                                                                                                                       | 109/485 [00:00<00:00, 2142.34it/s, Cached: Джон Уик 4]Resolving IDs:  23%|######################################################2                                                                                                                                                                                        | 110/485 [00:00<00:00, 2147.71it/s, Cached: Крэнфорд]Resolving IDs:  23%|#######################################################3                                                                                                                                                                                          | 111/485 [00:00<00:00, 2151.94it/s, Cached: Драйв]Resolving IDs:  23%|######################################################2                                                                                                                                                                                    | 112/485 [00:00<00:00, 2147.42it/s, Cached: Ноттинг Хилл]Resolving IDs:  23%|######################################################7                                                                                                                                                                                    | 113/485 [00:00<00:00, 1033.07it/s, Cached: Ноттинг Хилл]Resolving IDs:  23%|####################################################8                                                                                                                                                                              | 113/485 [00:00<00:00, 1033.07it/s, Cached: Леди-детектив мисс П]Resolving IDs:  24%|######################################################5                                                                                                                                                                                 | 114/485 [00:00<00:00, 1033.07it/s, Cached: Адвокат дьявола]Resolving IDs:  24%|#####################################################8                                                                                                                                                                             | 115/485 [00:00<00:00, 1033.07it/s, Cached: Меломанка / Hi-Fi / ]Resolving IDs:  24%|#######################################################9                                                                                                                                                                                  | 116/485 [00:00<00:00, 1033.07it/s, Cached: Брат Кадфаэль]Resolving IDs:  24%|#######################################################9                                                                                                                                                                                | 117/485 [00:00<00:00, 1033.07it/s, Cached: Благие знамения]Resolving IDs:  24%|##########################################################6                                                                                                                                                                                      | 118/485 [00:00<00:00, 1033.07it/s, Cached: Бэтмен]Resolving IDs:  25%|#######################################################6                                                                                                                                                                           | 119/485 [00:00<00:00, 1033.07it/s, Cached: Моя жизнь — убийство]Resolving IDs:  25%|#########################################################1                                                                                                                                                                             | 120/485 [00:00<00:00, 1033.07it/s, Cached: Почему не Эванс?]Resolving IDs:  25%|##########################################################8                                                                                                                                                                                 | 121/485 [00:00<00:00, 1033.07it/s, Cached: Белый лотос]Resolving IDs:  25%|#########################################################1                                                                                                                                                                         | 122/485 [00:00<00:00, 1033.07it/s, Cached: Ночной администратор]Resolving IDs:  25%|#########################################################5                                                                                                                                                                         | 123/485 [00:00<00:00, 1033.07it/s, Cached: Достать ножи: Воскре]Resolving IDs:  26%|############################################################                                                                                                                                                                               | 124/485 [00:00<00:00, 1033.07it/s, Cached: Красные огни]Resolving IDs:  26%|##########################################################5                                                                                                                                                                        | 125/485 [00:00<00:00, 1033.07it/s, Cached: Охотники за привиден]Resolving IDs:  26%|##########################################################9                                                                                                                                                                        | 126/485 [00:00<00:00, 1033.07it/s, Cached: Смерть не в раю / Вн]Resolving IDs:  26%|############################################################7                                                                                                                                                                           | 127/485 [00:00<00:00, 1033.07it/s, Cached: Ферма Кларксона]Resolving IDs:  26%|############################################################4                                                                                                                                                                        | 128/485 [00:00<00:00, 1033.07it/s, Cached: Стражи Галактики 2]Resolving IDs:  27%|############################################################3                                                                                                                                                                      | 129/485 [00:00<00:00, 1033.07it/s, Cached: Мстители: Война беск]Resolving IDs:  27%|##############################################################1                                                                                                                                                                         | 130/485 [00:00<00:00, 1033.07it/s, Cached: Мстители: Финал]Resolving IDs:  27%|#################################################################6                                                                                                                                                                                 | 131/485 [00:00<00:00, 1033.07it/s, Cached: Флэш]Resolving IDs:  27%|#############################################################7                                                                                                                                                                     | 132/485 [00:00<00:00, 1033.07it/s, Cached: Стражи Галактики. Ча]Resolving IDs:  27%|################################################################4                                                                                                                                                                          | 133/485 [00:00<00:00, 1033.07it/s, Cached: Смерть в раю]Resolving IDs:  28%|#################################################################7                                                                                                                                                                            | 134/485 [00:00<00:00, 1033.07it/s, Cached: Новенькая]Resolving IDs:  28%|###############################################################7                                                                                                                                                                     | 135/485 [00:00<00:00, 1033.07it/s, Cached: Дюна: Часть вторая]Resolving IDs:  28%|#################################################################                                                                                                                                                                       | 136/485 [00:00<00:00, 1033.07it/s, Cached: Реальная любовь]Resolving IDs:  28%|###################################################################7                                                                                                                                                                            | 137/485 [00:00<00:00, 1033.07it/s, Cached: Коронер]Resolving IDs:  28%|################################################################5                                                                                                                                                                  | 138/485 [00:00<00:00, 1033.07it/s, Cached: Спецназ / Морские Ко]Resolving IDs:  29%|#################################################################                                                                                                                                                                  | 139/485 [00:00<00:00, 1033.07it/s, Cached: Чисто английские уби]Resolving IDs:  29%|######################################################################1                                                                                                                                                                            | 140/485 [00:00<00:00, 1033.07it/s, Cached: Троя]Resolving IDs:  29%|##################################################################2                                                                                                                                                                 | 141/485 [00:00<00:00, 1033.07it/s, Cached: Тихоокеанский рубеж]Resolving IDs:  29%|##################################################################4                                                                                                                                                                | 142/485 [00:00<00:00, 1033.07it/s, Cached: Человек, который изм]Resolving IDs:  29%|##################################################################9                                                                                                                                                                | 143/485 [00:00<00:00, 1033.07it/s, Cached: Человек-паук: Вдали ]Resolving IDs:  30%|###################################################################3                                                                                                                                                               | 144/485 [00:00<00:00, 1033.07it/s, Cached: Игра по чужим правил]Resolving IDs:  30%|###################################################################8                                                                                                                                                               | 145/485 [00:00<00:00, 1033.07it/s, Cached: Убийство на пляже / ]Resolving IDs:  30%|######################################################################4                                                                                                                                                                   | 146/485 [00:00<00:00, 1033.07it/s, Cached: Главный герой]Resolving IDs:  30%|#########################################################################3                                                                                                                                                                        | 147/485 [00:00<00:00, 1033.07it/s, Cached: Месси]Resolving IDs:  31%|#####################################################################2                                                                                                                                                             | 148/485 [00:00<00:00, 1033.07it/s, Cached: Сумерки. Сага. Новол]Resolving IDs:  31%|######################################################################6                                                                                                                                                               | 149/485 [00:00<00:00, 1033.07it/s, Cached: Гнев человеческий]Resolving IDs:  31%|######################################################################2                                                                                                                                                            | 150/485 [00:00<00:00, 1033.07it/s, Cached: Самый быстрый Indian]Resolving IDs:  31%|######################################################################6                                                                                                                                                            | 151/485 [00:00<00:00, 1033.07it/s, Cached: Из многих / Плюрибус]Resolving IDs:  31%|#######################################################################1                                                                                                                                                           | 152/485 [00:00<00:00, 1033.07it/s, Cached: Друзья: Воссоединени]Resolving IDs:  32%|#########################################################################1                                                                                                                                                              | 153/485 [00:00<00:00, 1033.07it/s, Cached: Замок Бландингс]Resolving IDs:  32%|########################################################################                                                                                                                                                           | 154/485 [00:00<00:00, 1033.07it/s, Cached: По кладбищенской дор]Resolving IDs:  32%|########################################################################5                                                                                                                                                          | 155/485 [00:00<00:00, 1033.07it/s, Cached: Матрица: Воскрешение]Resolving IDs:  32%|############################################################################5                                                                                                                                                                 | 156/485 [00:00<00:00, 1033.07it/s, Cached: Мечтатель]Resolving IDs:  32%|#########################################################################4                                                                                                                                                         | 157/485 [00:00<00:00, 1033.07it/s, Cached: Сумерки. Сага. Затме]Resolving IDs:  33%|#########################################################################9                                                                                                                                                         | 158/485 [00:00<00:00, 1033.07it/s, Cached: Новое шоу Тома и Дже]Resolving IDs:  33%|##########################################################################4                                                                                                                                                        | 159/485 [00:00<00:00, 1033.07it/s, Cached: Тайлер Рейк: Операци]Resolving IDs:  33%|#############################################################################8                                                                                                                                                              | 160/485 [00:00<00:00, 1033.07it/s, Cached: Иллюзионист]Resolving IDs:  33%|##############################################################################3                                                                                                                                                             | 161/485 [00:00<00:00, 1033.07it/s, Cached: Черный Плащ]Resolving IDs:  33%|###########################################################################8                                                                                                                                                       | 162/485 [00:00<00:00, 1033.07it/s, Cached: История Британии с К]Resolving IDs:  34%|############################################################################2                                                                                                                                                      | 163/485 [00:00<00:00, 1033.07it/s, Cached: Хроники Нарнии: Лев,]Resolving IDs:  34%|##############################################################################4                                                                                                                                                         | 164/485 [00:00<00:00, 1033.07it/s, Cached: Взрывные котята]Resolving IDs:  34%|#############################################################################2                                                                                                                                                     | 165/485 [00:00<00:00, 1033.07it/s, Cached: Мисс Конгениальность]Resolving IDs:  34%|#############################################################################6                                                                                                                                                     | 166/485 [00:00<00:00, 1033.07it/s, Cached: Девочки Гилмор: Врем]Resolving IDs:  34%|###############################################################################8                                                                                                                                                        | 167/485 [00:00<00:00, 1033.07it/s, Cached: Служебный роман]Resolving IDs:  35%|###################################################################################1                                                                                                                                                            | 168/485 [00:00<00:00, 1033.07it/s, Cached: Фоллаут]Resolving IDs:  35%|###############################################################################                                                                                                                                                    | 169/485 [00:00<00:00, 1033.07it/s, Cached: Хроники Нарнии: Прин]Resolving IDs:  35%|##################################################################################7                                                                                                                                                         | 170/485 [00:00<00:00, 1033.07it/s, Cached: Шоу Трумана]Resolving IDs:  35%|################################################################################                                                                                                                                                   | 171/485 [00:00<00:00, 1033.07it/s, Cached: Хроники Нарнии: Поко]Resolving IDs:  35%|################################################################################5                                                                                                                                                  | 172/485 [00:00<00:00, 1033.07it/s, Cached: Голубоглазый самурай]Resolving IDs:  36%|####################################################################################5                                                                                                                                                        | 173/485 [00:00<00:00, 1033.07it/s, Cached: Волшебники]Resolving IDs:  36%|#####################################################################################                                                                                                                                                        | 174/485 [00:00<00:00, 1033.07it/s, Cached: Кастлвания]Resolving IDs:  36%|##################################################################################9                                                                                                                                                   | 175/485 [00:00<00:00, 1033.07it/s, Cached: Игра на понижение]Resolving IDs:  36%|##################################################################################3                                                                                                                                                | 176/485 [00:00<00:00, 1033.07it/s, Cached: Знакомьтесь, Джо Блэ]Resolving IDs:  36%|#####################################################################################7                                                                                                                                                     | 177/485 [00:00<00:00, 1033.07it/s, Cached: Предел риска]Resolving IDs:  37%|###################################################################################3                                                                                                                                               | 178/485 [00:00<00:00, 1033.07it/s, Cached: Довольно сложные дел]Resolving IDs:  37%|######################################################################################3                                                                                                                                                   | 179/485 [00:00<00:00, 1033.07it/s, Cached: Идентификация]Resolving IDs:  37%|####################################################################################6                                                                                                                                               | 180/485 [00:00<00:00, 1033.07it/s, Cached: Подозрительные лица]Resolving IDs:  37%|#########################################################################################1                                                                                                                                                     | 181/485 [00:00<00:00, 1033.07it/s, Cached: Прибытие]Resolving IDs:  38%|#####################################################################################1                                                                                                                                             | 182/485 [00:00<00:00, 1033.07it/s, Cached: В погоне за счастьем]Resolving IDs:  38%|#####################################################################################6                                                                                                                                             | 183/485 [00:00<00:00, 1033.07it/s, Cached: Киберпанк: Бегущие п]Resolving IDs:  38%|#########################################################################################1                                                                                                                                                 | 184/485 [00:00<00:00, 1033.07it/s, Cached: Ночной дозор]Resolving IDs:  38%|######################################################################################5                                                                                                                                            | 185/485 [00:00<00:00, 1033.07it/s, Cached: Бэтмен: Крестоносец ]Resolving IDs:  38%|#########################################################################################3                                                                                                                                               | 186/485 [00:00<00:00, 1033.07it/s, Cached: Здесь и сейчас]Resolving IDs:  39%|#############################################################################################3                                                                                                                                       