Starting TraktSync...
Fetching watched shows from Trakt (this might take a moment)...
Fetching watched movies from Trakt...
Fetching Watch List from HDRezka...
Opening HDRezka...
Logging in...
Login failed or already logged in: Page.wait_for_selector: Timeout 5000ms exceeded.
Call log:
  - waiting for locator(".b-tophead-logout") to be visible
    - waiting for" https://hdrezka-home.tv/" navigation to finish...
    - navigated to "https://hdrezka-home.tv/"
    9 × locator resolved to hidden <a rel="nofollow" class="b-tophead-logout" href="https://hdrezka-home.tv/logout/">Выход</a>

Navigating to 'Continue Watching'...
Found 486 items in list.
[DEBUG] 'Профессор Т' -> Raw: 'вчера' | Parsed: 2025-12-22 22:07:34.500985
[DEBUG] 'Достать ножи: Воскрешение покойника' -> Raw: 'вчера' | Parsed: 2025-12-22 22:07:34.540646
[DEBUG] 'Гарри Поттер и философский камень' -> Raw: 'вчера' | Parsed: 2025-12-22 22:07:34.566023
[DEBUG] 'Рождество не по плану / Лето. Солнце. Рождество' -> Raw: 'вчера' | Parsed: 2025-12-22 22:07:34.585705
[DEBUG] 'Перл из Уитстейбла' -> Raw: '21-12-2025' | Parsed: 2025-12-21 00:00:00
[DEBUG] 'Теория большого взрыва' -> Raw: '21-12-2025' | Parsed: 2025-12-21 00:00:00
[DEBUG] 'Доставить к Рождеству' -> Raw: '21-12-2025' | Parsed: 2025-12-21 00:00:00
[DEBUG] 'Одна на рождество' -> Raw: '20-12-2025' | Parsed: 2025-12-20 00:00:00
[DEBUG] 'Рождественское обещание' -> Raw: '20-12-2025' | Parsed: 2025-12-20 00:00:00
[DEBUG] 'Отпуск по обмену' -> Raw: '20-12-2025' | Parsed: 2025-12-20 00:00:00
[DEBUG] 'Пока ты спал' -> Raw: '19-12-2025' | Parsed: 2025-12-19 00:00:00
[DEBUG] 'Сознание' -> Raw: '16-12-2025' | Parsed: 2025-12-16 00:00:00
[DEBUG] 'Девочки Гилмор' -> Raw: '14-12-2025' | Parsed: 2025-12-14 00:00:00
[DEBUG] 'Последний отпуск / Последние каникулы' -> Raw: '14-12-2025' | Parsed: 2025-12-14 00:00:00
[DEBUG] 'Хорошая жена / Правильная жена' -> Raw: '14-12-2025' | Parsed: 2025-12-14 00:00:00
[DEBUG] 'Сознавайтесь, Флетч' -> Raw: '13-12-2025' | Parsed: 2025-12-13 00:00:00
[DEBUG] 'Подземелья и драконы: Честь среди воров' -> Raw: '12-12-2025' | Parsed: 2025-12-12 00:00:00
[DEBUG] 'Испытание невиновностью' -> Raw: '11-12-2025' | Parsed: 2025-12-11 00:00:00
[DEBUG] 'Убийства под омелой' -> Raw: '10-12-2025' | Parsed: 2025-12-10 00:00:00
[DEBUG] 'Идентификация' -> Raw: '09-12-2025' | Parsed: 2025-12-09 00:00:00
[DEBUG] 'Сумерки. Сага. Рассвет: Часть 2' -> Raw: '09-12-2025' | Parsed: 2025-12-09 00:00:00
[DEBUG] 'Сумерки. Сага. Рассвет: Часть 1' -> Raw: '09-12-2025' | Parsed: 2025-12-09 00:00:00
[DEBUG] 'Смотрите, как они бегут' -> Raw: '08-12-2025' | Parsed: 2025-12-08 00:00:00
[DEBUG] 'Из многих / Плюрибус / Счастье заразительно' -> Raw: '07-12-2025' | Parsed: 2025-12-07 00:00:00
[DEBUG] 'По кладбищенской дороге' -> Raw: '07-12-2025' | Parsed: 2025-12-07 00:00:00
[DEBUG] 'Сумерки. Сага. Затмение' -> Raw: '07-12-2025' | Parsed: 2025-12-07 00:00:00
[DEBUG] 'Иллюзионист' -> Raw: '06-12-2025' | Parsed: 2025-12-06 00:00:00
[DEBUG] 'Сумерки. Сага. Новолуние' -> Raw: '06-12-2025' | Parsed: 2025-12-06 00:00:00
[DEBUG] 'Сумерки' -> Raw: '06-12-2025' | Parsed: 2025-12-06 00:00:00
[DEBUG] 'Новый Амстердам' -> Raw: '05-12-2025' | Parsed: 2025-12-05 00:00:00
[DEBUG] 'Убийство в маленьком городке' -> Raw: '04-12-2025' | Parsed: 2025-12-04 00:00:00
[DEBUG] 'Гарри Поттер и Кубок огня' -> Raw: '04-12-2025' | Parsed: 2025-12-04 00:00:00
[DEBUG] 'Смерть на Ниле' -> Raw: '30-11-2025' | Parsed: 2025-11-30 00:00:00
[DEBUG] 'Гарри Поттер и узник Азкабана' -> Raw: '30-11-2025' | Parsed: 2025-11-30 00:00:00
[DEBUG] 'Гарри Поттер и Тайная комната' -> Raw: '30-11-2025' | Parsed: 2025-11-30 00:00:00
[DEBUG] 'Убийство в Провансе' -> Raw: '29-11-2025' | Parsed: 2025-11-29 00:00:00
[DEBUG] 'Убийство на пляже / Бродчёрч' -> Raw: '28-11-2025' | Parsed: 2025-11-28 00:00:00
[DEBUG] 'Шетланд' -> Raw: '27-11-2025' | Parsed: 2025-11-27 00:00:00
[DEBUG] 'Счастливый конец' -> Raw: '25-11-2025' | Parsed: 2025-11-25 00:00:00
[DEBUG] 'Гордость и предубеждение' -> Raw: '23-11-2025' | Parsed: 2025-11-23 00:00:00
[DEBUG] 'Джонатан Крик' -> Raw: '17-11-2025' | Parsed: 2025-11-17 00:00:00
[DEBUG] 'Бруклин 9-9' -> Raw: '17-11-2025' | Parsed: 2025-11-17 00:00:00
[DEBUG] 'Хинтерланд' -> Raw: '17-11-2025' | Parsed: 2025-11-17 00:00:00
[DEBUG] 'Тед Лассо' -> Raw: '17-11-2025' | Parsed: 2025-11-17 00:00:00
[DEBUG] 'Последняя дуэль' -> Raw: '16-11-2025' | Parsed: 2025-11-16 00:00:00
[DEBUG] 'Тайлер Рейк: Операция по спасению 2 / Эвакуация 2' -> Raw: '16-11-2025' | Parsed: 2025-11-16 00:00:00
[DEBUG] 'Идентификация Борна' -> Raw: '15-11-2025' | Parsed: 2025-11-15 00:00:00
[DEBUG] 'Твин Пикс' -> Raw: '15-11-2025' | Parsed: 2025-11-15 00:00:00
[DEBUG] 'Дандадан [ТВ-2]' -> Raw: '30-10-2025' | Parsed: 2025-10-30 00:00:00
[DEBUG] 'Клуб убийств Марлоу' -> Raw: '28-10-2025' | Parsed: 2025-10-28 00:00:00
[DEBUG] 'Карточный домик' -> Raw: '27-10-2025' | Parsed: 2025-10-27 00:00:00
[DEBUG] 'Любовь с иголочки / Эта фарфоровая кукла влюбилась [ТВ-1]' -> Raw: '26-10-2025' | Parsed: 2025-10-26 00:00:00
[DEBUG] 'Отчаянные домохозяйки' -> Raw: '22-10-2025' | Parsed: 2025-10-22 00:00:00
[DEBUG] 'Бриджертоны' -> Raw: '21-10-2025' | Parsed: 2025-10-21 00:00:00
[DEBUG] 'Резиденция' -> Raw: '20-10-2025' | Parsed: 2025-10-20 00:00:00
[DEBUG] 'Неукротимый / В глуши' -> Raw: '16-10-2025' | Parsed: 2025-10-16 00:00:00
[DEBUG] 'Люцифер' -> Raw: '13-10-2025' | Parsed: 2025-10-13 00:00:00
[DEBUG] 'Скандал' -> Raw: '12-10-2025' | Parsed: 2025-10-12 00:00:00
[DEBUG] 'Обмани меня / Теория лжи' -> Raw: '12-10-2025' | Parsed: 2025-10-12 00:00:00
[DEBUG] 'Дандадан [ТВ-1]' -> Raw: '12-10-2025' | Parsed: 2025-10-12 00:00:00
[DEBUG] 'С большой буквы / Жирным шрифтом' -> Raw: '10-10-2025' | Parsed: 2025-10-10 00:00:00
[DEBUG] 'Шорзи / Шорси' -> Raw: '08-10-2025' | Parsed: 2025-10-08 00:00:00
[DEBUG] 'Пожарная часть 19' -> Raw: '06-10-2025' | Parsed: 2025-10-06 00:00:00
[DEBUG] 'Моя геройская академия [ТВ-1]' -> Raw: '04-10-2025' | Parsed: 2025-10-04 00:00:00
[DEBUG] 'Кейпоп-охотницы на демонов' -> Raw: '11-09-2025' | Parsed: 2025-09-11 00:00:00
[DEBUG] 'Тайны Броукенвуда' -> Raw: '09-09-2025' | Parsed: 2025-09-09 00:00:00
[DEBUG] 'Это мы' -> Raw: '08-09-2025' | Parsed: 2025-09-08 00:00:00
[DEBUG] 'Расследования мадам Блан' -> Raw: '07-09-2025' | Parsed: 2025-09-07 00:00:00
[DEBUG] 'Умница' -> Raw: '06-09-2025' | Parsed: 2025-09-06 00:00:00
[DEBUG] 'Клиника' -> Raw: '06-09-2025' | Parsed: 2025-09-06 00:00:00
[DEBUG] 'Громовержцы*' -> Raw: '02-09-2025' | Parsed: 2025-09-02 00:00:00
[DEBUG] 'Большой потенциал' -> Raw: '31-08-2025' | Parsed: 2025-08-31 00:00:00
[DEBUG] 'Рецепты любви и убийства' -> Raw: '23-08-2025' | Parsed: 2025-08-23 00:00:00
[DEBUG] 'Джинни и Джорджия' -> Raw: '23-08-2025' | Parsed: 2025-08-23 00:00:00
[DEBUG] 'Супермен' -> Raw: '23-08-2025' | Parsed: 2025-08-23 00:00:00
[DEBUG] 'Дарби и Джоан' -> Raw: '22-08-2025' | Parsed: 2025-08-22 00:00:00
[DEBUG] 'Книжный' -> Raw: '22-08-2025' | Parsed: 2025-08-22 00:00:00
[DEBUG] 'Зови меня Кэт' -> Raw: '19-08-2025' | Parsed: 2025-08-19 00:00:00
[DEBUG] 'Кости' -> Raw: '17-08-2025' | Parsed: 2025-08-17 00:00:00
[DEBUG] 'Неуязвимый' -> Raw: '31-07-2025' | Parsed: 2025-07-31 00:00:00
[DEBUG] 'Ешь, молись, люби' -> Raw: '29-07-2025' | Parsed: 2025-07-29 00:00:00
[DEBUG] 'Секс в большом городе' -> Raw: '29-07-2025' | Parsed: 2025-07-29 00:00:00
[DEBUG] 'Как приручить дракона' -> Raw: '26-07-2025' | Parsed: 2025-07-26 00:00:00
[DEBUG] 'За гранью / Грань' -> Raw: '19-07-2025' | Parsed: 2025-07-19 00:00:00
[DEBUG] 'Макдональд и Доддс' -> Raw: '17-07-2025' | Parsed: 2025-07-17 00:00:00
[DEBUG] 'Белый воротничок' -> Raw: '16-07-2025' | Parsed: 2025-07-16 00:00:00
[DEBUG] 'Тайны Лауры' -> Raw: '14-07-2025' | Parsed: 2025-07-14 00:00:00
[DEBUG] 'Тайны Фрэнки Дрейк / Расследования Фрэнки Дрейк' -> Raw: '12-07-2025' | Parsed: 2025-07-12 00:00:00
[DEBUG] 'РеГенезис' -> Raw: '23-06-2025' | Parsed: 2025-06-23 00:00:00
[DEBUG] 'Стражи Галактики' -> Raw: '21-06-2025' | Parsed: 2025-06-21 00:00:00
[DEBUG] 'Болота / Пляжный коп' -> Raw: '19-06-2025' | Parsed: 2025-06-19 00:00:00
[DEBUG] 'Элементарно' -> Raw: '19-06-2025' | Parsed: 2025-06-19 00:00:00
[DEBUG] 'Бумажный дом' -> Raw: '06-06-2025' | Parsed: 2025-06-06 00:00:00
[DEBUG] 'Кухня' -> Raw: '06-06-2025' | Parsed: 2025-06-06 00:00:00
[DEBUG] 'Друзья' -> Raw: '01-06-2025' | Parsed: 2025-06-01 00:00:00
[DEBUG] 'Джек Ричер' -> Raw: '21-05-2025' | Parsed: 2025-05-21 00:00:00
[DEBUG] 'Доктор Хаус' -> Raw: '20-05-2025' | Parsed: 2025-05-20 00:00:00
[DEBUG] 'Иллюзия обмана' -> Raw: '19-04-2025' | Parsed: 2025-04-19 00:00:00
[DEBUG] 'Темное дитя' -> Raw: '06-04-2025' | Parsed: 2025-04-06 00:00:00
[DEBUG] 'Потерянная комната / Пропавшая комната' -> Raw: '06-04-2025' | Parsed: 2025-04-06 00:00:00
[DEBUG] 'Анатомия страсти / Анатомия Грей' -> Raw: '11-03-2025' | Parsed: 2025-03-11 00:00:00
[DEBUG] 'Сёгун' -> Raw: '01-03-2025' | Parsed: 2025-03-01 00:00:00
[DEBUG] 'Ущелье' -> Raw: '25-02-2025' | Parsed: 2025-02-25 00:00:00
[DEBUG] 'Однажды в Ирландии' -> Raw: '25-02-2025' | Parsed: 2025-02-25 00:00:00
[DEBUG] 'Доктор Кто' -> Raw: '03-02-2025' | Parsed: 2025-02-03 00:00:00
[DEBUG] 'Дюна' -> Raw: '03-01-2025' | Parsed: 2025-01-03 00:00:00
[DEBUG] 'Полярный экспресс' -> Raw: '01-01-2025' | Parsed: 2025-01-01 00:00:00
[DEBUG] 'Начальная школа «Эбботт»' -> Raw: '29-12-2024' | Parsed: 2024-12-29 00:00:00
[DEBUG] 'Аркейн' -> Raw: '28-12-2024' | Parsed: 2024-12-28 00:00:00
[DEBUG] 'Хоббит: Битва пяти воинств' -> Raw: '28-12-2024' | Parsed: 2024-12-28 00:00:00
[DEBUG] 'Хоббит: Пустошь Смауга' -> Raw: '27-12-2024' | Parsed: 2024-12-27 00:00:00
[DEBUG] 'Хоббит: Нежданное путешествие' -> Raw: '26-12-2024' | Parsed: 2024-12-26 00:00:00
[DEBUG] 'Тор 2: Царство тьмы' -> Raw: '23-12-2024' | Parsed: 2024-12-23 00:00:00
[DEBUG] 'Тор' -> Raw: '23-12-2024' | Parsed: 2024-12-23 00:00:00
[DEBUG] 'Дневник Бриджит Джонс' -> Raw: '22-12-2024' | Parsed: 2024-12-22 00:00:00
[DEBUG] 'Напарницы: Астрид и Рафаэлла' -> Raw: '22-12-2024' | Parsed: 2024-12-22 00:00:00
[DEBUG] 'Секретный уровень' -> Raw: '21-12-2024' | Parsed: 2024-12-21 00:00:00
[DEBUG] 'Реальная любовь' -> Raw: '21-12-2024' | Parsed: 2024-12-21 00:00:00
[DEBUG] 'Сердца трёх' -> Raw: '20-12-2024' | Parsed: 2024-12-20 00:00:00
[DEBUG] 'Гарри Поттер и Дары Смерти: Часть II' -> Raw: '18-12-2024' | Parsed: 2024-12-18 00:00:00
[DEBUG] 'Гарри Поттер и Дары Смерти: Часть I' -> Raw: '17-12-2024' | Parsed: 2024-12-17 00:00:00
[DEBUG] 'Гарри Поттер и Принц-полукровка' -> Raw: '16-12-2024' | Parsed: 2024-12-16 00:00:00
[DEBUG] 'Гарри Поттер и Орден Феникса' -> Raw: '15-12-2024' | Parsed: 2024-12-15 00:00:00
[DEBUG] 'Мадам Си Джей Уокер: первая женщина-миллионер в США' -> Raw: '08-12-2024' | Parsed: 2024-12-08 00:00:00
[DEBUG] 'Мертвые до востребования' -> Raw: '06-12-2024' | Parsed: 2024-12-06 00:00:00
[DEBUG] 'Андор' -> Raw: '06-12-2024' | Parsed: 2024-12-06 00:00:00
[DEBUG] 'Супергёрл / Супердевушка' -> Raw: '01-12-2024' | Parsed: 2024-12-01 00:00:00
[DEBUG] 'Мобильный доспех Гандам: Стальнокровные сироты / Гандам: Железнокровные сироты' -> Raw: '24-11-2024' | Parsed: 2024-11-24 00:00:00
[DEBUG] 'Дэдпул и Росомаха' -> Raw: '08-11-2024' | Parsed: 2024-11-08 00:00:00
[DEBUG] 'Каскадёры' -> Raw: '24-10-2024' | Parsed: 2024-10-24 00:00:00
[DEBUG] 'Чужой: Ромул' -> Raw: '22-10-2024' | Parsed: 2024-10-22 00:00:00
[DEBUG] 'Медленные лошади / Хромые кони' -> Raw: '13-10-2024' | Parsed: 2024-10-13 00:00:00
[DEBUG] 'Майор Гром: Игра' -> Raw: '07-10-2024' | Parsed: 2024-10-07 00:00:00
[DEBUG] 'Парки и зоны отдыха' -> Raw: '02-09-2024' | Parsed: 2024-09-02 00:00:00
[DEBUG] 'Элли МакБил' -> Raw: '02-09-2024' | Parsed: 2024-09-02 00:00:00
[DEBUG] 'Как отделаться от парня за 10 дней' -> Raw: '30-08-2024' | Parsed: 2024-08-30 00:00:00
[DEBUG] 'Частная практика' -> Raw: '26-08-2024' | Parsed: 2024-08-26 00:00:00
[DEBUG] 'Коломбо' -> Raw: '23-08-2024' | Parsed: 2024-08-23 00:00:00
[DEBUG] 'Ворон' -> Raw: '22-08-2024' | Parsed: 2024-08-22 00:00:00
[DEBUG] 'Бэтмен: Крестоносец в плаще' -> Raw: '22-08-2024' | Parsed: 2024-08-22 00:00:00
[DEBUG] 'Киберпанк: Бегущие по краю' -> Raw: '21-08-2024' | Parsed: 2024-08-21 00:00:00
[DEBUG] 'Прибытие' -> Raw: '10-08-2024' | Parsed: 2024-08-10 00:00:00
[DEBUG] 'Довольно сложные дела' -> Raw: '09-08-2024' | Parsed: 2024-08-09 00:00:00
[DEBUG] 'Знакомьтесь, Джо Блэк' -> Raw: '31-07-2024' | Parsed: 2024-07-31 00:00:00
[DEBUG] 'Кастлвания' -> Raw: '29-07-2024' | Parsed: 2024-07-29 00:00:00
[DEBUG] 'Голубоглазый самурай' -> Raw: '28-07-2024' | Parsed: 2024-07-28 00:00:00
[DEBUG] 'Шоу Трумана' -> Raw: '21-07-2024' | Parsed: 2024-07-21 00:00:00
[DEBUG] 'Фоллаут' -> Raw: '20-07-2024' | Parsed: 2024-07-20 00:00:00
[DEBUG] 'Девочки Гилмор: Времена года' -> Raw: '17-07-2024' | Parsed: 2024-07-17 00:00:00
[DEBUG] 'Взрывные котята' -> Raw: '16-07-2024' | Parsed: 2024-07-16 00:00:00
[DEBUG] 'История Британии с Канк' -> Raw: '16-07-2024' | Parsed: 2024-07-16 00:00:00
[DEBUG] 'Тайлер Рейк: Операция по спасению / Эвакуация' -> Raw: '15-07-2024' | Parsed: 2024-07-15 00:00:00
[DEBUG] 'Мечтатель' -> Raw: '14-07-2024' | Parsed: 2024-07-14 00:00:00
[DEBUG] 'Замок Бландингс' -> Raw: '14-07-2024' | Parsed: 2024-07-14 00:00:00
[DEBUG] 'Самый быстрый Indian' -> Raw: '13-07-2024' | Parsed: 2024-07-13 00:00:00
[DEBUG] 'Месси' -> Raw: '13-07-2024' | Parsed: 2024-07-13 00:00:00
[DEBUG] 'Игра по чужим правилам' -> Raw: '13-07-2024' | Parsed: 2024-07-13 00:00:00
[DEBUG] 'Человек, который изменил всё' -> Raw: '13-07-2024' | Parsed: 2024-07-13 00:00:00
[DEBUG] 'Тихоокеанский рубеж' -> Raw: '12-07-2024' | Parsed: 2024-07-12 00:00:00
[DEBUG] 'Троя' -> Raw: '12-07-2024' | Parsed: 2024-07-12 00:00:00
[DEBUG] 'Чисто английские убийства' -> Raw: '11-07-2024' | Parsed: 2024-07-11 00:00:00
[DEBUG] 'Спецназ / Морские Котики' -> Raw: '11-07-2024' | Parsed: 2024-07-11 00:00:00
[DEBUG] 'Коронер' -> Raw: '10-07-2024' | Parsed: 2024-07-10 00:00:00
[DEBUG] 'Дюна: Часть вторая' -> Raw: '10-07-2024' | Parsed: 2024-07-10 00:00:00
[DEBUG] 'Новенькая' -> Raw: '08-07-2024' | Parsed: 2024-07-08 00:00:00
[DEBUG] 'Смерть в раю' -> Raw: '29-06-2024' | Parsed: 2024-06-29 00:00:00
[DEBUG] 'Стражи Галактики. Часть 3' -> Raw: '19-05-2024' | Parsed: 2024-05-19 00:00:00
[DEBUG] 'Флэш' -> Raw: '15-05-2024' | Parsed: 2024-05-15 00:00:00
[DEBUG] 'Мстители: Финал' -> Raw: '14-05-2024' | Parsed: 2024-05-14 00:00:00
[DEBUG] 'Мстители: Война бесконечности' -> Raw: '12-05-2024' | Parsed: 2024-05-12 00:00:00
[DEBUG] 'Стражи Галактики 2' -> Raw: '11-05-2024' | Parsed: 2024-05-11 00:00:00
[DEBUG] 'Ферма Кларксона' -> Raw: '11-05-2024' | Parsed: 2024-05-11 00:00:00
[DEBUG] 'Смерть не в раю / Вне рая' -> Raw: '01-05-2024' | Parsed: 2024-05-01 00:00:00
[DEBUG] 'Охотники за привидениями: Леденящий ужас' -> Raw: '01-05-2024' | Parsed: 2024-05-01 00:00:00
[DEBUG] 'Красные огни' -> Raw: '20-04-2024' | Parsed: 2024-04-20 00:00:00
[DEBUG] 'Ночной администратор' -> Raw: '19-04-2024' | Parsed: 2024-04-19 00:00:00
[DEBUG] 'Белый лотос' -> Raw: '18-04-2024' | Parsed: 2024-04-18 00:00:00
[DEBUG] 'Почему не Эванс?' -> Raw: '06-04-2024' | Parsed: 2024-04-06 00:00:00
[DEBUG] 'Моя жизнь — убийство' -> Raw: '04-04-2024' | Parsed: 2024-04-04 00:00:00
[DEBUG] 'Бэтмен' -> Raw: '31-03-2024' | Parsed: 2024-03-31 00:00:00
[DEBUG] 'Благие знамения' -> Raw: '24-03-2024' | Parsed: 2024-03-24 00:00:00
[DEBUG] 'Брат Кадфаэль' -> Raw: '19-03-2024' | Parsed: 2024-03-19 00:00:00
[DEBUG] 'Меломанка / Hi-Fi / Фанатик' -> Raw: '17-03-2024' | Parsed: 2024-03-17 00:00:00
[DEBUG] 'Адвокат дьявола' -> Raw: '17-03-2024' | Parsed: 2024-03-17 00:00:00
[DEBUG] 'Леди-детектив мисс Перегрин Фишер' -> Raw: '16-03-2024' | Parsed: 2024-03-16 00:00:00
[DEBUG] 'Ноттинг Хилл' -> Raw: '12-03-2024' | Parsed: 2024-03-12 00:00:00
[DEBUG] 'Драйв' -> Raw: '10-03-2024' | Parsed: 2024-03-10 00:00:00
[DEBUG] 'Крэнфорд' -> Raw: '09-03-2024' | Parsed: 2024-03-09 00:00:00
[DEBUG] 'Джон Уик 4' -> Raw: '07-03-2024' | Parsed: 2024-03-07 00:00:00
[DEBUG] 'Принцесса-невеста' -> Raw: '25-02-2024' | Parsed: 2024-02-25 00:00:00
[DEBUG] 'Безумный Макс: Дорога ярости' -> Raw: '25-02-2024' | Parsed: 2024-02-25 00:00:00
[DEBUG] 'Марсианин' -> Raw: '23-02-2024' | Parsed: 2024-02-23 00:00:00
[DEBUG] 'Психопаспорт [ТВ-1]' -> Raw: '22-02-2024' | Parsed: 2024-02-22 00:00:00
[DEBUG] 'Как важно быть серьезным' -> Raw: '18-02-2024' | Parsed: 2024-02-18 00:00:00
[DEBUG] 'Умри, но не сейчас' -> Raw: '18-02-2024' | Parsed: 2024-02-18 00:00:00
[DEBUG] 'Алита: Боевой ангел' -> Raw: '12-02-2024' | Parsed: 2024-02-12 00:00:00
[DEBUG] 'Зов крови / Потерянная' -> Raw: '02-02-2024' | Parsed: 2024-02-02 00:00:00
[DEBUG] 'Расследования Мердока' -> Raw: '23-01-2024' | Parsed: 2024-01-23 00:00:00
[DEBUG] 'Достать ножи: Стеклянная луковица' -> Raw: '19-01-2024' | Parsed: 2024-01-19 00:00:00
[DEBUG] 'Вечеринка / Афтепати' -> Raw: '18-01-2024' | Parsed: 2024-01-18 00:00:00
[DEBUG] 'Королевы тайн' -> Raw: '17-01-2024' | Parsed: 2024-01-17 00:00:00
[DEBUG] 'Игра престолов' -> Raw: '16-01-2024' | Parsed: 2024-01-16 00:00:00
[DEBUG] 'Шекспир и Хэтэуэй: Частные детективы' -> Raw: '13-01-2024' | Parsed: 2024-01-13 00:00:00
[DEBUG] 'Я – зомби' -> Raw: '11-01-2024' | Parsed: 2024-01-11 00:00:00
[DEBUG] 'Агата Рэйзин' -> Raw: '09-01-2024' | Parsed: 2024-01-09 00:00:00
[DEBUG] 'Ночные игры' -> Raw: '08-01-2024' | Parsed: 2024-01-08 00:00:00
[DEBUG] 'Рождественский коттедж' -> Raw: '07-01-2024' | Parsed: 2024-01-07 00:00:00
[DEBUG] 'Четыре Рождества' -> Raw: '07-01-2024' | Parsed: 2024-01-07 00:00:00
[DEBUG] 'Замерзшая из Майами' -> Raw: '02-01-2024' | Parsed: 2024-01-02 00:00:00
[DEBUG] 'Тариф Новогодний' -> Raw: '01-01-2024' | Parsed: 2024-01-01 00:00:00
[DEBUG] 'Золотой компас' -> Raw: '01-01-2024' | Parsed: 2024-01-01 00:00:00
[DEBUG] 'Братство волка' -> Raw: '22-12-2023' | Parsed: 2023-12-22 00:00:00
[DEBUG] 'Самая обаятельная и привлекательная' -> Raw: '17-12-2023' | Parsed: 2023-12-17 00:00:00
[DEBUG] 'Вам письмо' -> Raw: '13-12-2023' | Parsed: 2023-12-13 00:00:00
[DEBUG] 'Обыкновенное чудо' -> Raw: '03-12-2023' | Parsed: 2023-12-03 00:00:00
[DEBUG] 'Покровские ворота' -> Raw: '02-12-2023' | Parsed: 2023-12-02 00:00:00
[DEBUG] 'Пятый элемент' -> Raw: '26-11-2023' | Parsed: 2023-11-26 00:00:00
[DEBUG] 'Отец Браун' -> Raw: '25-11-2023' | Parsed: 2023-11-25 00:00:00
[DEBUG] 'Притворщик' -> Raw: '21-11-2023' | Parsed: 2023-11-21 00:00:00
[DEBUG] 'Доктор Стрэндж' -> Raw: '19-11-2023' | Parsed: 2023-11-19 00:00:00
[DEBUG] 'Железный человек' -> Raw: '19-11-2023' | Parsed: 2023-11-19 00:00:00
[DEBUG] 'Розмари и Тайм' -> Raw: '18-11-2023' | Parsed: 2023-11-18 00:00:00
[DEBUG] 'Темный рыцарь' -> Raw: '13-11-2023' | Parsed: 2023-11-13 00:00:00
[DEBUG] 'Бэтмен: Начало' -> Raw: '11-11-2023' | Parsed: 2023-11-11 00:00:00
[DEBUG] 'Миссия невыполнима: Смертельная расплата. Часть первая' -> Raw: '05-11-2023' | Parsed: 2023-11-05 00:00:00
[DEBUG] 'Вера' -> Raw: '01-11-2023' | Parsed: 2023-11-01 00:00:00
[DEBUG] 'Наследники' -> Raw: '01-11-2023' | Parsed: 2023-11-01 00:00:00
[DEBUG] 'Хорошие девчонки' -> Raw: '01-11-2023' | Parsed: 2023-11-01 00:00:00
[DEBUG] 'Падение дома Ашеров' -> Raw: '29-10-2023' | Parsed: 2023-10-29 00:00:00
[DEBUG] 'Человек-бензопила' -> Raw: '27-10-2023' | Parsed: 2023-10-27 00:00:00
[DEBUG] 'Блич [ТВ-1]' -> Raw: '27-10-2023' | Parsed: 2023-10-27 00:00:00
[DEBUG] 'Человек-паук: Паутина Вселенных' -> Raw: '27-10-2023' | Parsed: 2023-10-27 00:00:00
[DEBUG] 'Хороший год' -> Raw: '22-10-2023' | Parsed: 2023-10-22 00:00:00
[DEBUG] 'Дрянь' -> Raw: '22-10-2023' | Parsed: 2023-10-22 00:00:00
[DEBUG] 'Удивительная миссис Мейзел' -> Raw: '16-10-2023' | Parsed: 2023-10-16 00:00:00
[DEBUG] 'Манхэттенская история любви / Любовь на Манхэттене' -> Raw: '08-10-2023' | Parsed: 2023-10-08 00:00:00
[DEBUG] 'Мисс Марпл: Указующий перст' -> Raw: '04-10-2023' | Parsed: 2023-10-04 00:00:00
[DEBUG] 'Мисс Марпл: Зеркало треснуло' -> Raw: '02-10-2023' | Parsed: 2023-10-02 00:00:00
[DEBUG] 'Мисс Марпл: Тело в библиотеке' -> Raw: '02-10-2023' | Parsed: 2023-10-02 00:00:00
[DEBUG] 'Мисс Марпл Агаты Кристи' -> Raw: '01-10-2023' | Parsed: 2023-10-01 00:00:00
[DEBUG] 'Прослушка' -> Raw: '21-09-2023' | Parsed: 2023-09-21 00:00:00
[DEBUG] 'Гордость и предубеждение' -> Raw: '21-09-2023' | Parsed: 2023-09-21 00:00:00
[DEBUG] 'Бриджит Джонс: Грани разумного' -> Raw: '21-09-2023' | Parsed: 2023-09-21 00:00:00
[DEBUG] 'Девушка моего лучшего друга' -> Raw: '21-09-2023' | Parsed: 2023-09-21 00:00:00
[DEBUG] 'One Piece. Большой куш' -> Raw: '08-09-2023' | Parsed: 2023-09-08 00:00:00
[DEBUG] 'Спасти мистера Бэнкса' -> Raw: '06-09-2023' | Parsed: 2023-09-06 00:00:00
[DEBUG] 'Дживс и Вустер' -> Raw: '02-09-2023' | Parsed: 2023-09-02 00:00:00
[DEBUG] 'Зло' -> Raw: '02-09-2023' | Parsed: 2023-09-02 00:00:00
[DEBUG] 'Ночной агент' -> Raw: '02-09-2023' | Parsed: 2023-09-02 00:00:00
[DEBUG] 'Английский пациент' -> Raw: '27-08-2023' | Parsed: 2023-08-27 00:00:00
[DEBUG] 'Напарницы / Риццоли и Айлс' -> Raw: '26-08-2023' | Parsed: 2023-08-26 00:00:00
[DEBUG] 'Ликвидация' -> Raw: '11-08-2023' | Parsed: 2023-08-11 00:00:00
[DEBUG] 'Человек-паук: Через вселенные' -> Raw: '08-08-2023' | Parsed: 2023-08-08 00:00:00
[DEBUG] 'Азазель' -> Raw: '05-08-2023' | Parsed: 2023-08-05 00:00:00
[DEBUG] 'Лютер: Падшее солнце' -> Raw: '05-08-2023' | Parsed: 2023-08-05 00:00:00
[DEBUG] 'Пацаны' -> Raw: '04-08-2023' | Parsed: 2023-08-04 00:00:00
[DEBUG] 'Лас Вегас' -> Raw: '04-08-2023' | Parsed: 2023-08-04 00:00:00
[DEBUG] 'Анна-детективъ' -> Raw: '03-08-2023' | Parsed: 2023-08-03 00:00:00
[DEBUG] 'Открытый брак' -> Raw: '27-07-2023' | Parsed: 2023-07-27 00:00:00
[DEBUG] 'Трансформеры' -> Raw: '27-07-2023' | Parsed: 2023-07-27 00:00:00
[DEBUG] 'Джессика Джонс' -> Raw: '23-07-2023' | Parsed: 2023-07-23 00:00:00
[DEBUG] 'Как избежать наказания за убийство' -> Raw: '06-07-2023' | Parsed: 2023-07-06 00:00:00
[DEBUG] 'Шерлок Холмс' -> Raw: '02-07-2023' | Parsed: 2023-07-02 00:00:00
[DEBUG] 'Новобранец / Новичок / Салага' -> Raw: '07-06-2023' | Parsed: 2023-06-07 00:00:00
[DEBUG] 'Касл' -> Raw: '05-06-2023' | Parsed: 2023-06-05 00:00:00
[DEBUG] 'Убойный отдел' -> Raw: '05-06-2023' | Parsed: 2023-06-05 00:00:00
[DEBUG] 'Пуаро' -> Raw: '04-06-2023' | Parsed: 2023-06-04 00:00:00
[DEBUG] 'Секретные материалы' -> Raw: '04-06-2023' | Parsed: 2023-06-04 00:00:00
[DEBUG] 'Охотник х Охотник' -> Raw: '26-05-2023' | Parsed: 2023-05-26 00:00:00
[DEBUG] 'Обещать – не значит жениться' -> Raw: '17-05-2023' | Parsed: 2023-05-17 00:00:00
[DEBUG] 'Маэстро' -> Raw: '17-05-2023' | Parsed: 2023-05-17 00:00:00
[DEBUG] 'Братья Супер Марио в кино' -> Raw: '15-05-2023' | Parsed: 2023-05-15 00:00:00
[DEBUG] 'Перри Мэйсон' -> Raw: '11-05-2023' | Parsed: 2023-05-11 00:00:00
[DEBUG] 'Хранилище 13' -> Raw: '07-05-2023' | Parsed: 2023-05-07 00:00:00
[DEBUG] 'Темнее черного [ТВ-1]' -> Raw: '04-05-2023' | Parsed: 2023-05-04 00:00:00
[DEBUG] 'Дюрарара!! [ТВ-1] / Всадник без головы [ТВ-1]' -> Raw: '04-05-2023' | Parsed: 2023-05-04 00:00:00
[DEBUG] 'Топ Ган: Мэверик' -> Raw: '04-05-2023' | Parsed: 2023-05-04 00:00:00
[DEBUG] 'Властелин колец: Возвращение Короля' -> Raw: '04-05-2023' | Parsed: 2023-05-04 00:00:00
[DEBUG] 'Властелин колец: Две крепости' -> Raw: '01-05-2023' | Parsed: 2023-05-01 00:00:00
[DEBUG] 'Два парня и девушка' -> Raw: '30-04-2023' | Parsed: 2023-04-30 00:00:00
[DEBUG] 'Властелин колец: Братство кольца' -> Raw: '29-04-2023' | Parsed: 2023-04-29 00:00:00
[DEBUG] 'Кремниевая долина / Силиконовая долина' -> Raw: '22-04-2023' | Parsed: 2023-04-22 00:00:00
[DEBUG] 'Начальница' -> Raw: '22-04-2023' | Parsed: 2023-04-22 00:00:00
[DEBUG] 'Рыцарь дня' -> Raw: '21-04-2023' | Parsed: 2023-04-21 00:00:00
[DEBUG] 'Форсаж' -> Raw: '18-04-2023' | Parsed: 2023-04-18 00:00:00
[DEBUG] 'Помни' -> Raw: '15-04-2023' | Parsed: 2023-04-15 00:00:00
[DEBUG] 'Аватар: Путь воды' -> Raw: '11-04-2023' | Parsed: 2023-04-11 00:00:00
[DEBUG] 'Легенда о Vox Machina / Легенда Вокс Макины' -> Raw: '01-04-2023' | Parsed: 2023-04-01 00:00:00
[DEBUG] 'Джек Ричер' -> Raw: '27-03-2023' | Parsed: 2023-03-27 00:00:00
[DEBUG] 'Дежа вю / Дежавю' -> Raw: '26-03-2023' | Parsed: 2023-03-26 00:00:00
[DEBUG] 'Счастливое число Слевина' -> Raw: '22-03-2023' | Parsed: 2023-03-22 00:00:00
[DEBUG] 'В лучшем мире' -> Raw: '15-03-2023' | Parsed: 2023-03-15 00:00:00
[DEBUG] 'Миссис Брэдли' -> Raw: '14-03-2023' | Parsed: 2023-03-14 00:00:00
[DEBUG] 'Две девицы на мели / Две разорившиеся девочки' -> Raw: '13-03-2023' | Parsed: 2023-03-13 00:00:00
[DEBUG] 'Рекрут' -> Raw: '09-03-2023' | Parsed: 2023-03-09 00:00:00
[DEBUG] 'Харли Квинн' -> Raw: '07-03-2023' | Parsed: 2023-03-07 00:00:00
[DEBUG] 'Карнивал Роу' -> Raw: '07-03-2023' | Parsed: 2023-03-07 00:00:00
[DEBUG] 'Достать ножи' -> Raw: '04-03-2023' | Parsed: 2023-03-04 00:00:00
[DEBUG] 'Бэтмен: Под колпаком' -> Raw: '23-02-2023' | Parsed: 2023-02-23 00:00:00
[DEBUG] 'Бэтмен: Долгий Хэллоуин. Часть 1' -> Raw: '23-02-2023' | Parsed: 2023-02-23 00:00:00
[DEBUG] 'Город хищниц' -> Raw: '19-02-2023' | Parsed: 2023-02-19 00:00:00
[DEBUG] 'Лучший стрелок / Топ Ган' -> Raw: '12-02-2023' | Parsed: 2023-02-12 00:00:00
[DEBUG] 'Кукольный дом' -> Raw: '12-02-2023' | Parsed: 2023-02-12 00:00:00
[DEBUG] 'Покерфейс' -> Raw: '04-02-2023' | Parsed: 2023-02-04 00:00:00
[DEBUG] 'Разделение' -> Raw: '03-02-2023' | Parsed: 2023-02-03 00:00:00
[DEBUG] 'Шерлок' -> Raw: '10-01-2023' | Parsed: 2023-01-10 00:00:00
[DEBUG] 'Горбун из Нотр Дама' -> Raw: '24-12-2022' | Parsed: 2022-12-24 00:00:00
[DEBUG] 'Щелкунчик и четыре королевства' -> Raw: '24-12-2022' | Parsed: 2022-12-24 00:00:00
[DEBUG] 'День сурка' -> Raw: '24-12-2022' | Parsed: 2022-12-24 00:00:00
[DEBUG] 'Мыслить как преступник' -> Raw: '21-12-2022' | Parsed: 2022-12-21 00:00:00
[DEBUG] 'Пространство / Экспансия' -> Raw: '20-12-2022' | Parsed: 2022-12-20 00:00:00
[DEBUG] 'Молодой Морс / Индевор' -> Raw: '17-12-2022' | Parsed: 2022-12-17 00:00:00
[DEBUG] 'Инспектор Морс' -> Raw: '15-12-2022' | Parsed: 2022-12-15 00:00:00
[DEBUG] 'Эврика' -> Raw: '15-12-2022' | Parsed: 2022-12-15 00:00:00
[DEBUG] 'Гранд отель' -> Raw: '04-12-2022' | Parsed: 2022-12-04 00:00:00
[DEBUG] 'Тьма' -> Raw: '26-11-2022' | Parsed: 2022-11-26 00:00:00
[DEBUG] 'Горец' -> Raw: '26-11-2022' | Parsed: 2022-11-26 00:00:00
[DEBUG] 'Шазам!' -> Raw: '22-11-2022' | Parsed: 2022-11-22 00:00:00
[DEBUG] 'Чёрный Адам' -> Raw: '21-11-2022' | Parsed: 2022-11-21 00:00:00
[DEBUG] 'Легион' -> Raw: '20-11-2022' | Parsed: 2022-11-20 00:00:00
[DEBUG] 'Острые козырьки / Заточенные кепки' -> Raw: '19-11-2022' | Parsed: 2022-11-19 00:00:00
[DEBUG] 'Вечность' -> Raw: '10-11-2022' | Parsed: 2022-11-10 00:00:00
[DEBUG] 'Ультиматум Борна' -> Raw: '29-10-2022' | Parsed: 2022-10-29 00:00:00
[DEBUG] 'Следствие по телу' -> Raw: '28-10-2022' | Parsed: 2022-10-28 00:00:00
[DEBUG] 'Хороший доктор' -> Raw: '28-10-2022' | Parsed: 2022-10-28 00:00:00
[DEBUG] 'Превосходство Борна' -> Raw: '28-10-2022' | Parsed: 2022-10-28 00:00:00
[DEBUG] 'Тайные связи / Тайные операции' -> Raw: '22-10-2022' | Parsed: 2022-10-22 00:00:00
[DEBUG] 'S. W. A. T.: Спецназ города ангелов' -> Raw: '19-10-2022' | Parsed: 2022-10-19 00:00:00
[DEBUG] 'Хикару и Го' -> Raw: '08-10-2022' | Parsed: 2022-10-08 00:00:00
[DEBUG] 'Джуманджи' -> Raw: '30-09-2022' | Parsed: 2022-09-30 00:00:00
[DEBUG] 'Ясновидец' -> Raw: '09-09-2022' | Parsed: 2022-09-09 00:00:00
[DEBUG] 'Патриотизм Мориарти [ТВ-1]' -> Raw: '04-09-2022' | Parsed: 2022-09-04 00:00:00
[DEBUG] 'Непокоренный' -> Raw: '29-08-2022' | Parsed: 2022-08-29 00:00:00
[DEBUG] 'Шерлок Холмс и доктор Ватсон: Собака Баскервилей' -> Raw: '28-08-2022' | Parsed: 2022-08-28 00:00:00
[DEBUG] 'Шерлок Холмс и доктор Ватсон: Король шантажа' -> Raw: '28-08-2022' | Parsed: 2022-08-28 00:00:00
[DEBUG] 'Шерлок Холмс и доктор Ватсон: Кровавая надпись' -> Raw: '28-08-2022' | Parsed: 2022-08-28 00:00:00
[DEBUG] 'Шерлок Холмс и доктор Ватсон: Знакомство' -> Raw: '28-08-2022' | Parsed: 2022-08-28 00:00:00
[DEBUG] 'Созданный в Бездне [ТВ-1]' -> Raw: '27-08-2022' | Parsed: 2022-08-27 00:00:00
[DEBUG] 'Ход королевы / Ферзевый гамбит' -> Raw: '26-08-2022' | Parsed: 2022-08-26 00:00:00
[DEBUG] 'Гавайи 5.0 / Полиция Гавайев' -> Raw: '20-08-2022' | Parsed: 2022-08-20 00:00:00
[DEBUG] 'Слепая зона / Слепое пятно' -> Raw: '13-08-2022' | Parsed: 2022-08-13 00:00:00
[DEBUG] 'Джек Райан' -> Raw: '13-08-2022' | Parsed: 2022-08-13 00:00:00
[DEBUG] 'Человек на Луне' -> Raw: '12-08-2022' | Parsed: 2022-08-12 00:00:00
[DEBUG] 'Расследование сестры Бонифации' -> Raw: '06-08-2022' | Parsed: 2022-08-06 00:00:00
[DEBUG] 'Падение Олимпа' -> Raw: '01-08-2022' | Parsed: 2022-08-01 00:00:00
[DEBUG] 'Ford против Ferrari' -> Raw: '30-07-2022' | Parsed: 2022-07-30 00:00:00
[DEBUG] 'Основатель' -> Raw: '28-07-2022' | Parsed: 2022-07-28 00:00:00
[DEBUG] 'Дефективный детектив / Детектив Монк' -> Raw: '08-07-2022' | Parsed: 2022-07-08 00:00:00
[DEBUG] 'Анчартед: На картах не значится' -> Raw: '25-06-2022' | Parsed: 2022-06-25 00:00:00
[DEBUG] 'Кашемировая мафия' -> Raw: '25-06-2022' | Parsed: 2022-06-25 00:00:00
[DEBUG] 'Локи' -> Raw: '19-06-2022' | Parsed: 2022-06-19 00:00:00
[DEBUG] 'Патруль времени' -> Raw: '10-06-2022' | Parsed: 2022-06-10 00:00:00
[DEBUG] 'Мисс Марпл: Убийство в доме викария' -> Raw: '10-06-2022' | Parsed: 2022-06-10 00:00:00
[DEBUG] 'Мисс Марпл: Точно по расписанию' -> Raw: '08-06-2022' | Parsed: 2022-06-08 00:00:00
[DEBUG] 'Мисс Марпл: Забытое убийство' -> Raw: '06-06-2022' | Parsed: 2022-06-06 00:00:00
[DEBUG] 'Преступник: Великобритания' -> Raw: '05-06-2022' | Parsed: 2022-06-05 00:00:00
[DEBUG] 'Перелом' -> Raw: '05-06-2022' | Parsed: 2022-06-05 00:00:00
[DEBUG] 'На гребне волны' -> Raw: '04-06-2022' | Parsed: 2022-06-04 00:00:00
[DEBUG] 'Почти человек' -> Raw: '03-06-2022' | Parsed: 2022-06-03 00:00:00
[DEBUG] 'Мисс Марпл: Тайна Карибского залива' -> Raw: '02-06-2022' | Parsed: 2022-06-02 00:00:00
[DEBUG] 'Мисс Марпл: С помощью зеркала' -> Raw: '02-06-2022' | Parsed: 2022-06-02 00:00:00
[DEBUG] 'Чип и Дейл спешат на помощь (2022)' -> Raw: '01-06-2022' | Parsed: 2022-06-01 00:00:00
[DEBUG] 'Убийства в одном здании' -> Raw: '31-05-2022' | Parsed: 2022-05-31 00:00:00
[DEBUG] 'Леди-детектив мисс Фрайни Фишер' -> Raw: '16-05-2022' | Parsed: 2022-05-16 00:00:00
[DEBUG] 'В поле зрения / Подозреваемый' -> Raw: '13-04-2022' | Parsed: 2022-04-13 00:00:00
[DEBUG] 'Лунный рыцарь' -> Raw: '07-04-2022' | Parsed: 2022-04-07 00:00:00
[DEBUG] 'Человек-паук: Нет пути домой' -> Raw: '16-03-2022' | Parsed: 2022-03-16 00:00:00
[DEBUG] 'Рискованный бизнес' -> Raw: '13-03-2022' | Parsed: 2022-03-13 00:00:00
[DEBUG] 'Жестокие игры' -> Raw: '12-03-2022' | Parsed: 2022-03-12 00:00:00
[DEBUG] 'Сорвиголова' -> Raw: '09-03-2022' | Parsed: 2022-03-09 00:00:00
[DEBUG] 'Темный рыцарь: Возрождение легенды' -> Raw: '06-03-2022' | Parsed: 2022-03-06 00:00:00
[DEBUG] 'Мисс Марпл: Объявленное убийство' -> Raw: '04-03-2022' | Parsed: 2022-03-04 00:00:00
[DEBUG] 'Индиана Джонс: В поисках утраченного ковчега' -> Raw: '22-02-2022' | Parsed: 2022-02-22 00:00:00
[DEBUG] 'К звёздам' -> Raw: '22-02-2022' | Parsed: 2022-02-22 00:00:00
[DEBUG] 'Сквозь снег' -> Raw: '20-02-2022' | Parsed: 2022-02-20 00:00:00
[DEBUG] 'Настоящий детектив' -> Raw: '20-02-2022' | Parsed: 2022-02-20 00:00:00
[DEBUG] 'О чём говорят мужчины' -> Raw: '19-02-2022' | Parsed: 2022-02-19 00:00:00
[DEBUG] 'Три икса' -> Raw: '19-02-2022' | Parsed: 2022-02-19 00:00:00
[DEBUG] 'Бесславные ублюдки' -> Raw: '11-02-2022' | Parsed: 2022-02-11 00:00:00
[DEBUG] 'Лютер' -> Raw: '08-02-2022' | Parsed: 2022-02-08 00:00:00
[DEBUG] 'Пираты Карибского моря: Мертвецы не рассказывают сказки' -> Raw: '29-01-2022' | Parsed: 2022-01-29 00:00:00
[DEBUG] 'Деньги на двоих' -> Raw: '27-01-2022' | Parsed: 2022-01-27 00:00:00
[DEBUG] 'Пираты Карибского моря: На странных берегах' -> Raw: '23-01-2022' | Parsed: 2022-01-23 00:00:00
[DEBUG] 'Двадцать одно' -> Raw: '21-01-2022' | Parsed: 2022-01-21 00:00:00
[DEBUG] 'Пираты Карибского моря: На краю Света' -> Raw: '21-01-2022' | Parsed: 2022-01-21 00:00:00
[DEBUG] 'Пираты Карибского моря: Сундук мертвеца' -> Raw: '20-01-2022' | Parsed: 2022-01-20 00:00:00
[DEBUG] 'Пираты Карибского моря: Проклятие Черной жемчужины' -> Raw: '18-01-2022' | Parsed: 2022-01-18 00:00:00
[DEBUG] 'Фокус' -> Raw: '15-01-2022' | Parsed: 2022-01-15 00:00:00
[DEBUG] 'Лучшее предложение' -> Raw: '13-01-2022' | Parsed: 2022-01-13 00:00:00
[DEBUG] 'Гарри Поттер 20 лет спустя: Возвращение в Хогвартс' -> Raw: '12-01-2022' | Parsed: 2022-01-12 00:00:00
[DEBUG] 'Люди в черном: Интернэшнл' -> Raw: '09-01-2022' | Parsed: 2022-01-09 00:00:00
[DEBUG] 'Мир Дикого Запада / Западный мир' -> Raw: '09-01-2022' | Parsed: 2022-01-09 00:00:00
[DEBUG] 'Здесь и сейчас' -> Raw: '08-01-2022' | Parsed: 2022-01-08 00:00:00
[DEBUG] 'Ночной дозор' -> Raw: '07-01-2022' | Parsed: 2022-01-07 00:00:00
[DEBUG] 'В погоне за счастьем' -> Raw: '07-01-2022' | Parsed: 2022-01-07 00:00:00
[DEBUG] 'Подозрительные лица' -> Raw: '04-01-2022' | Parsed: 2022-01-04 00:00:00
[DEBUG] 'Предел риска' -> Raw: '04-01-2022' | Parsed: 2022-01-04 00:00:00
[DEBUG] 'Игра на понижение' -> Raw: '03-01-2022' | Parsed: 2022-01-03 00:00:00
[DEBUG] 'Волшебники' -> Raw: '02-01-2022' | Parsed: 2022-01-02 00:00:00
[DEBUG] 'Хроники Нарнии: Покоритель Зари' -> Raw: '02-01-2022' | Parsed: 2022-01-02 00:00:00
[DEBUG] 'Хроники Нарнии: Принц Каспиан' -> Raw: '01-01-2022' | Parsed: 2022-01-01 00:00:00
[DEBUG] 'Служебный роман' -> Raw: '01-01-2022' | Parsed: 2022-01-01 00:00:00
[DEBUG] 'Мисс Конгениальность' -> Raw: '01-01-2022' | Parsed: 2022-01-01 00:00:00
[DEBUG] 'Хроники Нарнии: Лев, колдунья и волшебный шкаф' -> Raw: '01-01-2022' | Parsed: 2022-01-01 00:00:00
[DEBUG] 'Черный Плащ' -> Raw: '31-12-2021' | Parsed: 2021-12-31 00:00:00
[DEBUG] 'Новое шоу Тома и Джерри' -> Raw: '31-12-2021' | Parsed: 2021-12-31 00:00:00
[DEBUG] 'Матрица: Воскрешение' -> Raw: '31-12-2021' | Parsed: 2021-12-31 00:00:00
[DEBUG] 'Друзья: Воссоединение' -> Raw: '30-12-2021' | Parsed: 2021-12-30 00:00:00
[DEBUG] 'Гнев человеческий' -> Raw: '30-12-2021' | Parsed: 2021-12-30 00:00:00
[DEBUG] 'Главный герой' -> Raw: '28-12-2021' | Parsed: 2021-12-28 00:00:00
[DEBUG] 'Человек-паук: Вдали от дома' -> Raw: '24-12-2021' | Parsed: 2021-12-24 00:00:00
[DEBUG] 'Человек-паук: Возвращение домой' -> Raw: '23-12-2021' | Parsed: 2021-12-23 00:00:00
[DEBUG] 'Лука' -> Raw: '20-12-2021' | Parsed: 2021-12-20 00:00:00
[DEBUG] 'Области тьмы' -> Raw: '19-12-2021' | Parsed: 2021-12-19 00:00:00
[DEBUG] 'Разум и чувства' -> Raw: '18-12-2021' | Parsed: 2021-12-18 00:00:00
[DEBUG] 'Законы привлекательности' -> Raw: '17-12-2021' | Parsed: 2021-12-17 00:00:00
[DEBUG] 'Правила съема: Метод Хитча' -> Raw: '17-12-2021' | Parsed: 2021-12-17 00:00:00
[DEBUG] 'Хэнкок' -> Raw: '16-12-2021' | Parsed: 2021-12-16 00:00:00
[DEBUG] 'Люди Икс' -> Raw: '16-12-2021' | Parsed: 2021-12-16 00:00:00
[DEBUG] 'Фантастические твари: Преступления Грин-де-Вальда' -> Raw: '15-12-2021' | Parsed: 2021-12-15 00:00:00
[DEBUG] 'Фантастические твари и где они обитают' -> Raw: '15-12-2021' | Parsed: 2021-12-15 00:00:00
[DEBUG] '300 спартанцев' -> Raw: '12-12-2021' | Parsed: 2021-12-12 00:00:00
[DEBUG] 'Меч короля Артура' -> Raw: '11-12-2021' | Parsed: 2021-12-11 00:00:00
[DEBUG] 'Агенты А.Н.К.Л.' -> Raw: '11-12-2021' | Parsed: 2021-12-11 00:00:00
[DEBUG] 'Назад в будущее 3' -> Raw: '01-12-2021' | Parsed: 2021-12-01 00:00:00
[DEBUG] 'Назад в будущее 2' -> Raw: '29-11-2021' | Parsed: 2021-11-29 00:00:00
[DEBUG] 'Назад в будущее' -> Raw: '29-11-2021' | Parsed: 2021-11-29 00:00:00
[DEBUG] 'Веном 2' -> Raw: '25-11-2021' | Parsed: 2021-11-25 00:00:00
[DEBUG] 'Карты, деньги, два ствола' -> Raw: '15-11-2021' | Parsed: 2021-11-15 00:00:00
[DEBUG] 'Матрица' -> Raw: '12-11-2021' | Parsed: 2021-11-12 00:00:00
[DEBUG] 'Рейд' -> Raw: '12-11-2021' | Parsed: 2021-11-12 00:00:00
[DEBUG] 'Богемская рапсодия' -> Raw: '12-11-2021' | Parsed: 2021-11-12 00:00:00
[DEBUG] 'Триумф' -> Raw: '08-11-2021' | Parsed: 2021-11-08 00:00:00
[DEBUG] 'Остров проклятых' -> Raw: '06-11-2021' | Parsed: 2021-11-06 00:00:00
[DEBUG] 'Как я встретил вашу маму' -> Raw: '05-11-2021' | Parsed: 2021-11-05 00:00:00
[DEBUG] 'Кейт и Лео' -> Raw: '30-10-2021' | Parsed: 2021-10-30 00:00:00
[DEBUG] 'Джон Уик 3' -> Raw: '29-10-2021' | Parsed: 2021-10-29 00:00:00
[DEBUG] 'Джон Уик 2' -> Raw: '25-10-2021' | Parsed: 2021-10-25 00:00:00
[DEBUG] 'Джон Уик' -> Raw: '24-10-2021' | Parsed: 2021-10-24 00:00:00
[DEBUG] 'Светлячок' -> Raw: '24-10-2021' | Parsed: 2021-10-24 00:00:00
[DEBUG] 'Kingsman: Секретная служба' -> Raw: '23-10-2021' | Parsed: 2021-10-23 00:00:00
[DEBUG] 'Обратная тяга' -> Raw: '19-10-2021' | Parsed: 2021-10-19 00:00:00
[DEBUG] 'Титаник' -> Raw: '14-10-2021' | Parsed: 2021-10-14 00:00:00
[DEBUG] 'Тринадцатый этаж' -> Raw: '25-09-2021' | Parsed: 2021-09-25 00:00:00
[DEBUG] 'Скотт Пилигрим против всех' -> Raw: '30-08-2021' | Parsed: 2021-08-30 00:00:00
[DEBUG] 'Константин: Повелитель тьмы' -> Raw: '28-08-2021' | Parsed: 2021-08-28 00:00:00
[DEBUG] 'Грабь награбленное / Воздействие' -> Raw: '26-08-2021' | Parsed: 2021-08-26 00:00:00
[DEBUG] 'Код Да Винчи' -> Raw: '06-08-2021' | Parsed: 2021-08-06 00:00:00
[DEBUG] 'Римские приключения' -> Raw: '01-08-2021' | Parsed: 2021-08-01 00:00:00
[DEBUG] 'P.S. Я люблю тебя' -> Raw: '23-07-2021' | Parsed: 2021-07-23 00:00:00
[DEBUG] 'Не пойман – не вор' -> Raw: '04-07-2021' | Parsed: 2021-07-04 00:00:00
[DEBUG] 'Любовь, смерть и роботы' -> Raw: '16-06-2021' | Parsed: 2021-06-16 00:00:00
[DEBUG] 'Аватар' -> Raw: '13-06-2021' | Parsed: 2021-06-13 00:00:00
[DEBUG] 'Гаттака' -> Raw: '12-06-2021' | Parsed: 2021-06-12 00:00:00
[DEBUG] 'Университет монстров' -> Raw: '10-06-2021' | Parsed: 2021-06-10 00:00:00
[DEBUG] 'Райя и последний дракон' -> Raw: '10-06-2021' | Parsed: 2021-06-10 00:00:00
[DEBUG] 'Твое имя' -> Raw: '07-06-2021' | Parsed: 2021-06-07 00:00:00
[DEBUG] 'Живая мишень' -> Raw: '05-06-2021' | Parsed: 2021-06-05 00:00:00
[DEBUG] 'Блудный сын' -> Raw: '05-06-2021' | Parsed: 2021-06-05 00:00:00
[DEBUG] 'Черная метка' -> Raw: '11-05-2021' | Parsed: 2021-05-11 00:00:00
[DEBUG] 'Король говорит!' -> Raw: '29-04-2021' | Parsed: 2021-04-29 00:00:00
[DEBUG] 'Армагеддон' -> Raw: '20-03-2021' | Parsed: 2021-03-20 00:00:00
[DEBUG] 'Трасса 60' -> Raw: '17-03-2021' | Parsed: 2021-03-17 00:00:00
[DEBUG] 'Зелёная книга' -> Raw: '15-03-2021' | Parsed: 2021-03-15 00:00:00
[DEBUG] 'Мирный воин' -> Raw: '13-03-2021' | Parsed: 2021-03-13 00:00:00
[DEBUG] 'Клаус' -> Raw: '01-03-2021' | Parsed: 2021-03-01 00:00:00
[DEBUG] 'Аэронавты' -> Raw: '01-03-2021' | Parsed: 2021-03-01 00:00:00
[DEBUG] 'Познакомьтесь с Дороти Дендридж' -> Raw: '28-02-2021' | Parsed: 2021-02-28 00:00:00
[DEBUG] 'Ирландец' -> Raw: '28-02-2021' | Parsed: 2021-02-28 00:00:00
[DEBUG] 'Начало' -> Raw: '28-02-2021' | Parsed: 2021-02-28 00:00:00
[DEBUG] 'Пока не сыграл в ящик' -> Raw: '26-02-2021' | Parsed: 2021-02-26 00:00:00
[DEBUG] 'Побег из Шоушенка' -> Raw: '25-02-2021' | Parsed: 2021-02-25 00:00:00
[DEBUG] 'Тайна Коко' -> Raw: '24-02-2021' | Parsed: 2021-02-24 00:00:00
[DEBUG] 'Унесенные ветром' -> Raw: '21-02-2021' | Parsed: 2021-02-21 00:00:00
[DEBUG] 'Маленькие женщины' -> Raw: '21-02-2021' | Parsed: 2021-02-21 00:00:00
[DEBUG] 'Меняющие реальность' -> Raw: '15-02-2021' | Parsed: 2021-02-15 00:00:00
[DEBUG] 'Две королевы' -> Raw: '14-02-2021' | Parsed: 2021-02-14 00:00:00
[DEBUG] 'Видоизмененный углерод' -> Raw: '13-02-2021' | Parsed: 2021-02-13 00:00:00
[DEBUG] 'Суррогаты' -> Raw: '07-02-2021' | Parsed: 2021-02-07 00:00:00
[DEBUG] 'Довод' -> Raw: '06-02-2021' | Parsed: 2021-02-06 00:00:00
[DEBUG] 'Чудо-женщина: 1984' -> Raw: '05-02-2021' | Parsed: 2021-02-05 00:00:00
[DEBUG] 'Душа' -> Raw: '31-01-2021' | Parsed: 2021-01-31 00:00:00
[DEBUG] 'Мэверик' -> Raw: '27-01-2021' | Parsed: 2021-01-27 00:00:00
[DEBUG] 'Девятые врата' -> Raw: '26-01-2021' | Parsed: 2021-01-26 00:00:00
[DEBUG] 'Отступники' -> Raw: '26-01-2021' | Parsed: 2021-01-26 00:00:00

Phase 1: Resolving IMDB IDs for 485 items...
Resolving IDs:   0%|          | 0/485 [00:00<?, ?it/s]Resolving IDs:   0%|          | 0/485 [00:00<?, ?it/s, Cached: Клаус]Resolving IDs:   0%|          | 1/485 [00:00<00:00, 3628.29it/s, Cached: Ход королевы / Ферзе]Resolving IDs:   0%|          | 2/485 [00:00<00:00, 6065.52it/s, Cached: Братство волка]      Resolving IDs:   1%|          | 3/485 [00:00<00:00, 8004.40it/s, Cached: Мирный воин]   Resolving IDs:   1%|          | 4/485 [00:00<00:00, 9559.67it/s, Cached: Созданный в Бездне []Resolving IDs:   1%|          | 5/485 [00:00<00:00, 10882.99it/s, Cached: Золотой компас]     Resolving IDs:   1%|          | 6/485 [00:00<00:00, 12006.60it/s, Cached: Зелёная книга] Resolving IDs:   1%|▏         | 7/485 [00:00<00:00, 12894.22it/s, Cached: Шерлок Холмс и докто]Resolving IDs:   2%|▏         | 8/485 [00:00<00:00, 13273.11it/s, Cached: Тариф Новогодний]    Resolving IDs:   2%|▏         | 9/485 [00:00<00:00, 13554.30it/s, Cached: Трасса 60]       Resolving IDs:   2%|▏         | 10/485 [00:00<00:00, 13842.59it/s, Cached: Шерлок Холмс и докто]Resolving IDs:   2%|▏         | 11/485 [00:00<00:00, 14341.73it/s, Cached: Замерзшая из Майами] Resolving IDs:   2%|▏         | 12/485 [00:00<00:00, 14877.81it/s, Cached: Подземелья и драконы]Resolving IDs:   3%|▎         | 13/485 [00:00<00:00, 15368.08it/s, Cached: Армагеддон]          Resolving IDs:   3%|▎         | 14/485 [00:00<00:00, 15819.03it/s, Cached: Шерлок Холмс и докто]Resolving IDs:   3%|▎         | 15/485 [00:00<00:00, 16181.73it/s, Cached: Четыре Рождества]    Resolving IDs:   3%|▎         | 16/485 [00:00<00:00, 16594.67it/s, Cached: Король говорит!] Resolving IDs:   4%|▎         | 17/485 [00:00<00:00, 16980.99it/s, Cached: Шерлок Холмс и докто]Resolving IDs:   4%|▎         | 18/485 [00:00<00:00, 17335.81it/s, Cached: Рождественский котте]Resolving IDs:   4%|▍         | 19/485 [00:00<00:00, 17666.10it/s, Cached: Черная метка]        Resolving IDs:   4%|▍         | 20/485 [00:00<00:00, 17962.76it/s, Cached: Непокоренный]Resolving IDs:   4%|▍         | 21/485 [00:00<00:00, 18270.15it/s, Cached: Ночные игры] Resolving IDs:   5%|▍         | 22/485 [00:00<00:00, 18555.14it/s, Cached: Блудный сын]Resolving IDs:   5%|▍         | 23/485 [00:00<00:00, 18819.55it/s, Cached: Патриотизм Мориарти ]Resolving IDs:   5%|▍         | 24/485 [00:00<00:00, 19065.02it/s, Cached: Агата Рэйзин]        Resolving IDs:   5%|▌         | 25/485 [00:00<00:00, 19254.06it/s, Cached: Живая мишень]Resolving IDs:   5%|▌         | 26/485 [00:00<00:00, 19452.71it/s, Cached: Ясновидец]   Resolving IDs:   6%|▌         | 27/485 [00:00<00:00, 19657.39it/s, Cached: Я – зомби]Resolving IDs:   6%|▌         | 28/485 [00:00<00:00, 19854.69it/s, Cached: Твое имя] Resolving IDs:   6%|▌         | 29/485 [00:00<00:00, 20065.13it/s, Cached: Джуманджи]Resolving IDs:   6%|▌         | 30/485 [00:00<00:00, 20246.04it/s, Cached: Шекспир и Хэтэуэй: Ч]Resolving IDs:   6%|▋         | 31/485 [00:00<00:00, 20415.05it/s, Cached: Рождество не по план]Resolving IDs:   7%|▋         | 32/485 [00:00<00:00, 20541.43it/s, Cached: Райя и последний дра]Resolving IDs:   7%|▋         | 33/485 [00:00<00:00, 20514.60it/s, Cached: Хикару и Го]         Resolving IDs:   7%|▋         | 34/485 [00:00<00:00, 20392.73it/s, Cached: Игра престолов]Resolving IDs:   7%|▋         | 35/485 [00:00<00:00, 20517.21it/s, Cached: Университет монстров]Resolving IDs:   7%|▋         | 36/485 [00:00<00:00, 20591.16it/s, Cached: S. W. A. T.: Спецназ]Resolving IDs:   8%|▊         | 37/485 [00:00<00:00, 20530.39it/s, Cached: Королевы тайн]       Resolving IDs:   8%|▊         | 38/485 [00:00<00:00, 20531.18it/s, Cached: Гаттака]      Resolving IDs:   8%|▊         | 39/485 [00:00<00:00, 20547.40it/s, Cached: Тайные связи / Тайны]Resolving IDs:   8%|▊         | 40/485 [00:00<00:00, 20605.77it/s, Cached: Вечеринка / Афтепати]Resolving IDs:   8%|▊         | 41/485 [00:00<00:00, 20721.35it/s, Cached: Аватар]              Resolving IDs:   9%|▊         | 42/485 [00:00<00:00, 20849.90it/s, Cached: Превосходство Борна]Resolving IDs:   9%|▉         | 43/485 [00:00<00:00, 20915.58it/s, Cached: Достать ножи: Стекля]Resolving IDs:   9%|▉         | 44/485 [00:00<00:00, 20834.20it/s, Cached: Любовь, смерть и роб]Resolving IDs:   9%|▉         | 45/485 [00:00<00:00, 20869.49it/s, Cached: Хороший доктор]      Resolving IDs:   9%|▉         | 46/485 [00:00<00:00, 20962.41it/s, Cached: Расследования Мердок]Resolving IDs:  10%|▉         | 47/485 [00:00<00:00, 21061.14it/s, Cached: Не пойман – не вор]  Resolving IDs:  10%|▉         | 48/485 [00:00<00:00, 21046.06it/s, Cached: Следствие по телу] Resolving IDs:  10%|█         | 49/485 [00:00<00:00, 20992.94it/s, Cached: Зов крови / Потерянн]Resolving IDs:  10%|█         | 50/485 [00:00<00:00, 20961.04it/s, Cached: P.S. Я люблю тебя]   Resolving IDs:  11%|█         | 51/485 [00:00<00:00, 20928.43it/s, Cached: Ультиматум Борна] Resolving IDs:  11%|█         | 52/485 [00:00<00:00, 20879.17it/s, Cached: Алита: Боевой ангел]Resolving IDs:  11%|█         | 53/485 [00:00<00:00, 20830.03it/s, Cached: Римские приключения]Resolving IDs:  11%|█         | 54/485 [00:00<00:00, 20784.84it/s, Cached: Вечность]           Resolving IDs:  11%|█▏        | 55/485 [00:00<00:00, 20758.28it/s, Cached: Умри, но не сейчас]Resolving IDs:  12%|█▏        | 56/485 [00:00<00:00, 20719.92it/s, Cached: Код Да Винчи]      Resolving IDs:  12%|█▏        | 57/485 [00:00<00:00, 20683.05it/s, Cached: Острые козырьки / За]Resolving IDs:  12%|█▏        | 58/485 [00:00<00:00, 20659.84it/s, Cached: Как важно быть серье]Resolving IDs:  12%|█▏        | 59/485 [00:00<00:00, 20630.59it/s, Cached: Грабь награбленное /]Resolving IDs:  12%|█▏        | 60/485 [00:00<00:00, 20600.71it/s, Cached: Легион]              Resolving IDs:  13%|█▎        | 61/485 [00:00<00:00, 20583.47it/s, Cached: Психопаспорт [ТВ-1]]Resolving IDs:  13%|█▎        | 62/485 [00:00<00:00, 20553.81it/s, Cached: Константин: Повелите]Resolving IDs:  13%|█▎        | 63/485 [00:00<00:00, 20525.18it/s, Cached: Чёрный Адам]         Resolving IDs:  13%|█▎        | 64/485 [00:00<00:00, 20481.88it/s, Cached: Марсианин]  Resolving IDs:  13%|█▎        | 65/485 [00:00<00:00, 20377.44it/s, Cached: Скотт Пилигрим проти]Resolving IDs:  14%|█▎        | 66/485 [00:00<00:00, 20266.79it/s, Cached: Шазам!]              Resolving IDs:  14%|█▍        | 67/485 [00:00<00:00, 20217.15it/s, Cached: Безумный Макс: Дорог]Resolving IDs:  14%|█▍        | 68/485 [00:00<00:00, 20194.91it/s, Cached: Тринадцатый этаж]    Resolving IDs:  14%|█▍        | 69/485 [00:00<00:00, 20150.88it/s, Cached: Горец]           Resolving IDs:  14%|█▍        | 70/485 [00:00<00:00, 20144.17it/s, Cached: Принцесса-невеста]Resolving IDs:  15%|█▍        | 71/485 [00:00<00:00, 20124.04it/s, Cached: Титаник]          Resolving IDs:  15%|█▍        | 72/485 [00:00<00:00, 20119.25it/s, Cached: Тьма]   Resolving IDs:  15%|█▌        | 73/485 [00:00<00:00, 20114.58it/s, Cached: Джон Уик 4]Resolving IDs:  15%|█▌        | 74/485 [00:00<00:00, 20061.95it/s, Cached: Обратная тяга]Resolving IDs:  15%|█▌        | 75/485 [00:00<00:00, 20022.46it/s, Cached: Гранд отель]  Resolving IDs:  16%|█▌        | 76/485 [00:00<00:00, 20011.75it/s, Cached: Крэнфорд]   Resolving IDs:  16%|█▌        | 77/485 [00:00<00:00, 20000.09it/s, Cached: Kingsman: Секретная ]Resolving IDs:  16%|█▌        | 78/485 [00:00<00:00, 19985.08it/s, Cached: Эврика]              Resolving IDs:  16%|█▋        | 79/485 [00:00<00:00, 19981.31it/s, Cached: Драйв] Resolving IDs:  16%|█▋        | 80/485 [00:00<00:00, 19977.63it/s, Cached: Светлячок]Resolving IDs:  17%|█▋        | 81/485 [00:00<00:00, 20042.39it/s, Cached: Инспектор Морс]Resolving IDs:  17%|█▋        | 82/485 [00:00<00:00, 20108.33it/s, Cached: Ноттинг Хилл]  Resolving IDs:  17%|█▋        | 83/485 [00:00<00:00, 20176.61it/s, Cached: Джон Уик]    Resolving IDs:  17%|█▋        | 84/485 [00:00<00:00, 20247.20it/s, Cached: Молодой Морс / Индев]Resolving IDs:  18%|█▊        | 85/485 [00:00<00:00, 20308.51it/s, Cached: Леди-детектив мисс П]Resolving IDs:  18%|█▊        | 86/485 [00:00<00:00, 20332.01it/s, Cached: Джон Уик 2]          Resolving IDs:  18%|█▊        | 87/485 [00:00<00:00, 20391.42it/s, Cached: Пространство / Экспа]Resolving IDs:  18%|█▊        | 88/485 [00:00<00:00, 20454.35it/s, Cached: Адвокат дьявола]     Resolving IDs:  18%|█▊        | 89/485 [00:00<00:00, 20515.12it/s, Cached: Джон Уик 3]     Resolving IDs:  19%|█▊        | 90/485 [00:00<00:00, 20580.49it/s, Cached: Мыслить как преступн]Resolving IDs:  19%|█▉        | 91/485 [00:00<00:00, 20582.49it/s, Cached: Меломанка / Hi-Fi / ]Resolving IDs:  19%|█▉        | 92/485 [00:00<00:00, 20588.84it/s, Cached: Кейт и Лео]          Resolving IDs:  19%|█▉        | 93/485 [00:00<00:00, 20643.01it/s, Cached: День сурка]Resolving IDs:  19%|█▉        | 94/485 [00:00<00:00, 20702.82it/s, Cached: Брат Кадфаэль]Resolving IDs:  20%|█▉        | 95/485 [00:00<00:00, 20758.47it/s, Cached: Как я встретил вашу ]Resolving IDs:  20%|█▉        | 96/485 [00:00<00:00, 20808.95it/s, Cached: Щелкунчик и четыре к]Resolving IDs:  20%|██        | 97/485 [00:00<00:00, 20859.69it/s, Cached: Благие знамения]     Resolving IDs:  20%|██        | 98/485 [00:00<00:00, 20914.96it/s, Cached: Остров проклятых]Resolving IDs:  20%|██        | 99/485 [00:00<00:00, 20969.40it/s, Cached: Горбун из Нотр Дама]Resolving IDs:  21%|██        | 100/485 [00:00<00:00, 21021.97it/s, Cached: Бэтмен]            Resolving IDs:  21%|██        | 101/485 [00:00<00:00, 21079.00it/s, Cached: Триумф]Resolving IDs:  21%|██        | 102/485 [00:00<00:00, 21136.26it/s, Cached: Шерлок]Resolving IDs:  21%|██        | 103/485 [00:00<00:00, 21190.63it/s, Cached: Моя жизнь — убийство]Resolving IDs:  21%|██▏       | 104/485 [00:00<00:00, 21234.91it/s, Cached: Последний отпуск / П]Resolving IDs:  22%|██▏       | 105/485 [00:00<00:00, 21276.48it/s, Cached: Богемская рапсодия]  Resolving IDs:  22%|██▏       | 106/485 [00:00<00:00, 21321.51it/s, Cached: Разделение]        Resolving IDs:  22%|██▏       | 107/485 [00:00<00:00, 21368.94it/s, Cached: Почему не Эванс?]Resolving IDs:  22%|██▏       | 108/485 [00:00<00:00, 21412.66it/s, Cached: Рейд]            Resolving IDs:  22%|██▏       | 109/485 [00:00<00:00, 21461.79it/s, Cached: Покерфейс]Resolving IDs:  23%|██▎       | 110/485 [00:00<00:00, 21512.26it/s, Cached: Белый лотос]Resolving IDs:  23%|██▎       | 111/485 [00:00<00:00, 21561.05it/s, Cached: Матрица]    Resolving IDs:  23%|██▎       | 112/485 [00:00<00:00, 21609.18it/s, Cached: Кукольный дом]Resolving IDs:  23%|██▎       | 113/485 [00:00<00:00, 21656.68it/s, Cached: Ночной администратор]Resolving IDs:  24%|██▎       | 114/485 [00:00<00:00, 21701.57it/s, Cached: Карты, деньги, два с]Resolving IDs:  24%|██▎       | 115/485 [00:00<00:00, 21745.86it/s, Cached: Лучший стрелок / Топ]Resolving IDs:  24%|██▍       | 116/485 [00:00<00:00, 21788.59it/s, Cached: Красные огни]        Resolving IDs:  24%|██▍       | 117/485 [00:00<00:00, 21833.67it/s, Cached: Веном 2]     Resolving IDs:  24%|██▍       | 118/485 [00:00<00:00, 21882.04it/s, Cached: Город хищниц]Resolving IDs:  25%|██▍       | 119/485 [00:00<00:00, 21924.02it/s, Cached: Охотники за привиден]Resolving IDs:  25%|██▍       | 120/485 [00:00<00:00, 21953.96it/s, Cached: Назад в будущее]     Resolving IDs:  25%|██▍       | 121/485 [00:00<00:00, 21988.25it/s, Cached: Бэтмен: Долгий Хэлло]Resolving IDs:  25%|██▌       | 122/485 [00:00<00:00, 22023.03it/s, Cached: Смерть не в раю / Вн]Resolving IDs:  25%|██▌       | 123/485 [00:00<00:00, 22061.12it/s, Cached: Назад в будущее 2]   Resolving IDs:  26%|██▌       | 124/485 [00:00<00:00, 22097.79it/s, Cached: Бэтмен: Под колпаком]Resolving IDs:  26%|██▌       | 125/485 [00:00<00:00, 22114.39it/s, Cached: Ферма Кларксона]     Resolving IDs:  26%|██▌       | 126/485 [00:00<00:00, 22144.66it/s, Cached: Назад в будущее 3]Resolving IDs:  26%|██▌       | 127/485 [00:00<00:00, 22182.84it/s, Cached: Достать ножи]     Resolving IDs:  26%|██▋       | 128/485 [00:00<00:00, 22219.64it/s, Cached: Стражи Галактики 2]Resolving IDs:  27%|██▋       | 129/485 [00:00<00:00, 22255.98it/s, Cached: Агенты А.Н.К.Л.]   Resolving IDs:  27%|██▋       | 130/485 [00:00<00:00, 22294.62it/s, Cached: Карнивал Роу]   Resolving IDs:  27%|██▋       | 131/485 [00:00<00:00, 22330.07it/s, Cached: Мстители: Война беск]Resolving IDs:  27%|██▋       | 132/485 [00:00<00:00, 22365.10it/s, Cached: Меч короля Артура]   Resolving IDs:  27%|██▋       | 133/485 [00:00<00:00, 22400.61it/s, Cached: Харли Квинн]      Resolving IDs:  28%|██▊       | 134/485 [00:00<00:00, 22433.91it/s, Cached: Мстители: Финал]Resolving IDs:  28%|██▊       | 135/485 [00:00<00:00, 22466.81it/s, Cached: 300 спартанцев] Resolving IDs:  28%|██▊       | 136/485 [00:00<00:00, 22500.21it/s, Cached: Рекрут]        Resolving IDs:  28%|██▊       | 137/485 [00:00<00:00, 22518.21it/s, Cached: Флэш]  Resolving IDs:  28%|██▊       | 138/485 [00:00<00:00, 22492.19it/s, Cached: Фантастические твари]Resolving IDs:  29%|██▊       | 139/485 [00:00<00:00, 22514.32it/s, Cached: Две девицы на мели /]Resolving IDs:  29%|██▉       | 140/485 [00:00<00:00, 22540.50it/s, Cached: Стражи Галактики. Ча]Resolving IDs:  29%|██▉       | 141/485 [00:00<00:00, 22570.68it/s, Cached: Фантастические твари]Resolving IDs:  29%|██▉       | 142/485 [00:00<00:00, 22601.36it/s, Cached: Миссис Брэдли]       Resolving IDs:  29%|██▉       | 143/485 [00:00<00:00, 22633.41it/s, Cached: Смерть в раю] Resolving IDs:  30%|██▉       | 144/485 [00:00<00:00, 22665.11it/s, Cached: Люди Икс]    Resolving IDs:  30%|██▉       | 145/485 [00:00<00:00, 22696.45it/s, Cached: В лучшем мире]Resolving IDs:  30%|███       | 146/485 [00:00<00:00, 22725.76it/s, Cached: Новенькая]    Resolving IDs:  30%|███       | 147/485 [00:00<00:00, 22758.11it/s, Cached: Хэнкок]   Resolving IDs:  31%|███       | 148/485 [00:00<00:00, 22787.60it/s, Cached: Счастливое число Сле]Resolving IDs:  31%|███       | 149/485 [00:00<00:00, 22817.60it/s, Cached: Дюна: Часть вторая]  Resolving IDs:  31%|███       | 150/485 [00:00<00:00, 22845.62it/s, Cached: Достать ножи: Воскре]Resolving IDs:  31%|███       | 151/485 [00:00<00:00, 22874.17it/s, Cached: Правила съема: Метод]Resolving IDs:  31%|███▏      | 152/485 [00:00<00:00, 22904.05it/s, Cached: Дежа вю / Дежавю]    Resolving IDs:  32%|███▏      | 153/485 [00:00<00:00, 22932.80it/s, Cached: Коронер]         Resolving IDs:  32%|███▏      | 154/485 [00:00<00:00, 22963.70it/s, Cached: Законы привлекательн]Resolving IDs:  32%|███▏      | 155/485 [00:00<00:00, 22991.02it/s, Cached: Джек Ричер]          Resolving IDs:  32%|███▏      | 156/485 [00:00<00:00, 23017.25it/s, Cached: Спецназ / Морские Ко]Resolving IDs:  32%|███▏      | 157/485 [00:00<00:00, 23040.79it/s, Cached: Легенда о Vox Machin]Resolving IDs:  33%|███▎      | 158/485 [00:00<00:00, 23066.48it/s, Cached: Чисто английские уби]Resolving IDs:  33%|███▎      | 159/485 [00:00<00:00, 23092.71it/s, Cached: Сознание]            Resolving IDs:  33%|███▎      | 160/485 [00:00<00:00, 23121.06it/s, Cached: Разум и чувства]Resolving IDs:  33%|███▎      | 161/485 [00:00<00:00, 23145.94it/s, Cached: Области тьмы]   Resolving IDs:  33%|███▎      | 162/485 [00:00<00:00, 23171.37it/s, Cached: Аватар: Путь воды]Resolving IDs:  34%|███▎      | 163/485 [00:00<00:00, 23197.32it/s, Cached: Троя]             Resolving IDs:  34%|███▍      | 164/485 [00:00<00:00, 23210.48it/s, Cached: Лука]Resolving IDs:  34%|███▍      | 165/485 [00:00<00:00, 23214.93it/s, Cached: Помни]Resolving IDs:  34%|███▍      | 166/485 [00:00<00:00, 23240.24it/s, Cached: Тихоокеанский рубеж]Resolving IDs:  34%|███▍      | 167/485 [00:00<00:00, 23261.45it/s, Cached: Гарри Поттер и филос]Resolving IDs:  35%|███▍      | 168/485 [00:00<00:00, 23284.75it/s, Cached: Человек-паук: Возвра]Resolving IDs:  35%|███▍      | 169/485 [00:00<00:00, 23307.05it/s, Cached: Форсаж]              Resolving IDs:  35%|███▌      | 170/485 [00:00<00:00, 23333.72it/s, Cached: Человек, который изм]Resolving IDs:  35%|███▌      | 171/485 [00:00<00:00, 23357.08it/s, Cached: Человек-паук: Вдали ]Resolving IDs:  35%|███▌      | 172/485 [00:00<00:00, 23380.23it/s, Cached: Рыцарь дня]          Resolving IDs:  36%|███▌      | 173/485 [00:00<00:00, 23404.66it/s, Cached: Игра по чужим правил]Resolving IDs:  36%|███▌      | 174/485 [00:00<00:00, 23428.10it/s, Cached: Начальница]          Resolving IDs:  36%|███▌      | 175/485 [00:00<00:00, 23452.83it/s, Cached: Главный герой]Resolving IDs:  36%|███▋      | 176/485 [00:00<00:00, 23478.07it/s, Cached: Месси]        Resolving IDs:  36%|███▋      | 177/485 [00:00<00:00, 23504.57it/s, Cached: Пока ты спал]Resolving IDs:  37%|███▋      | 178/485 [00:00<00:00, 23526.38it/s, Cached: Гнев человеческий]Resolving IDs:  37%|███▋      | 179/485 [00:00<00:00, 23548.72it/s, Cached: Кремниевая долина / ]Resolving IDs:  37%|███▋      | 180/485 [00:00<00:00, 23570.86it/s, Cached: Самый быстрый Indian]Resolving IDs:  37%|███▋      | 181/485 [00:00<00:00, 23573.75it/s, Cached: Друзья: Воссоединени]Resolving IDs:  38%|███▊      | 182/485 [00:00<00:00, 23592.64it/s, Cached: Властелин колец: Бра]Resolving IDs:  38%|███▊      | 183/485 [00:00<00:00, 23611.35it/s, Cached: Замок Бландингс]     Resolving IDs:  38%|███▊      | 184/485 [00:00<00:00, 23634.22it/s, Cached: Матрица: Воскрешение]Resolving IDs:  38%|███▊      | 185/485 [00:00<00:00, 23655.46it/s, Cached: Два парня и девушка] Resolving IDs:  38%|███▊      | 186/485 [00:00<00:00, 23676.50it/s, Cached: Мечтатель]          Resolving IDs:  39%|███▊      | 187/485 [00:00<00:00, 23698.78it/s, Cached: Новое шоу Тома и Дже]Resolving IDs:  39%|███▉      | 188/485 [00:00<00:00, 23718.73it/s, Cached: Властелин колец: Две]Resolving IDs:  39%|███▉      | 189/485 [00:00<00:00, 23739.21it/s, Cached: Тайлер Рейк: Операци]Resolving IDs:  39%|███▉      | 190/485 [00:00<00:00, 23758.80it/s, Cached: Черный Плащ]         Resolving IDs:  39%|███▉      | 191/485 [00:00<00:00, 23779.63it/s, Cached: Властелин колец: Воз]Resolving IDs:  40%|███▉      | 192/485 [00:00<00:00, 23805.21it/s, Cached: История Британии с К]Resolving IDs:  40%|███▉      | 193/485 [00:00<00:00, 23825.66it/s, Cached: Хроники Нарнии: Лев,]Resolving IDs:  40%|████      | 194/485 [00:00<00:00, 23843.14it/s, Cached: Топ Ган: Мэверик]    Resolving IDs:  40%|████      | 195/485 [00:00<00:00, 23861.86it/s, Cached: Взрывные котята] Resolving IDs:  40%|████      | 196/485 [00:00<00:00, 23881.12it/s, Cached: Девочки Гилмор: Врем]Resolving IDs:  41%|████      | 197/485 [00:00<00:00, 23900.90it/s, Cached: Дюрарара!! [ТВ-1] / ]Resolving IDs:  41%|████      | 198/485 [00:00<00:00, 23920.51it/s, Cached: Мисс Конгениальность]Resolving IDs:  41%|████      | 199/485 [00:00<00:00, 23940.64it/s, Cached: Служебный роман]     Resolving IDs:  41%|████      | 200/485 [00:00<00:00, 23957.18it/s, Cached: Темнее черного [ТВ-1]Resolving IDs:  41%|████▏     | 201/485 [00:00<00:00, 23974.95it/s, Cached: Фоллаут]             Resolving IDs:  42%|████▏     | 202/485 [00:00<00:00, 23994.60it/s, Cached: Отпуск по обмену]Resolving IDs:  42%|████▏     | 203/485 [00:00<00:00, 24010.71it/s, Cached: Хроники Нарнии: Прин]Resolving IDs:  42%|████▏     | 204/485 [00:00<00:00, 24026.68it/s, Cached: Хранилище 13]        Resolving IDs:  42%|████▏     | 205/485 [00:00<00:00, 24045.20it/s, Cached: Шоу Трумана] Resolving IDs:  42%|████▏     | 206/485 [00:00<00:00, 24064.24it/s, Cached: Хроники Нарнии: Поко]Resolving IDs:  43%|████▎     | 207/485 [00:00<00:00, 24011.20it/s, Cached: Перри Мэйсон]        Resolving IDs:  43%|████▎     | 208/485 [00:00<00:00, 23973.38it/s, Cached: Голубоглазый самурай]Resolving IDs:  43%|████▎     | 209/485 [00:00<00:00, 23978.60it/s, Cached: Волшебники]          Resolving IDs:  43%|████▎     | 210/485 [00:00<00:00, 23990.30it/s, Cached: Братья Супер Марио в]Resolving IDs:  44%|████▎     | 211/485 [00:00<00:00, 24005.16it/s, Cached: Кастлвания]          Resolving IDs:  44%|████▎     | 212/485 [00:00<00:00, 24022.49it/s, Cached: Игра на понижение]Resolving IDs:  44%|████▍     | 213/485 [00:00<00:00, 24038.39it/s, Cached: Маэстро]          Resolving IDs:  44%|████▍     | 214/485 [00:00<00:00, 24056.10it/s, Cached: Знакомьтесь, Джо Блэ]Resolving IDs:  44%|████▍     | 215/485 [00:00<00:00, 24070.45it/s, Cached: Рождественское обеща]Resolving IDs:  45%|████▍     | 216/485 [00:00<00:00, 24086.61it/s, Cached: Предел риска]        Resolving IDs:  45%|████▍     | 217/485 [00:00<00:00, 24103.28it/s, Cached: Обещать – не значит ]Resolving IDs:  45%|████▍     | 218/485 [00:00<00:00, 24118.55it/s, Cached: Довольно сложные дел]Resolving IDs:  45%|████▌     | 219/485 [00:00<00:00, 24134.33it/s, Cached: Перл из Уитстейбла]  Resolving IDs:  45%|████▌     | 220/485 [00:00<00:00, 24151.25it/s, Cached: Хорошая жена / Прави]Resolving IDs:  46%|████▌     | 221/485 [00:00<00:00, 24167.41it/s, Cached: Подозрительные лица] Resolving IDs:  46%|████▌     | 222/485 [00:00<00:00, 24182.82it/s, Cached: Охотник х Охотник]  Resolving IDs:  46%|████▌     | 223/485 [00:00<00:00, 24198.74it/s, Cached: Прибытие]         Resolving IDs:  46%|████▌     | 224/485 [00:00<00:00, 24217.04it/s, Cached: В погоне за счастьем]Resolving IDs:  46%|████▋     | 225/485 [00:00<00:00, 24231.46it/s, Cached: Секретные материалы] Resolving IDs:  47%|████▋     | 226/485 [00:00<00:00, 24246.39it/s, Cached: Киберпанк: Бегущие п]Resolving IDs:  47%|████▋     | 227/485 [00:00<00:00, 24261.83it/s, Cached: Ночной дозор]        Resolving IDs:  47%|████▋     | 228/485 [00:00<00:00, 24277.77it/s, Cached: Пуаро]       Resolving IDs:  47%|████▋     | 229/485 [00:00<00:00, 24294.82it/s, Cached: Бэтмен: Крестоносец ]Resolving IDs:  47%|████▋     | 230/485 [00:00<00:00, 24310.52it/s, Cached: Здесь и сейчас]      Resolving IDs:  48%|████▊     | 231/485 [00:00<00:00, 24326.71it/s, Cached: Убойный отдел] Resolving IDs:  48%|████▊     | 232/485 [00:00<00:00, 24339.74it/s, Cached: Ворон]        Resolving IDs:  48%|████▊     | 233/485 [00:00<00:00, 24347.82it/s, Cached: Мир Дикого Запада / ]Resolving IDs:  48%|████▊     | 234/485 [00:00<00:00, 24361.88it/s, Cached: Касл]                Resolving IDs:  48%|████▊     | 235/485 [00:00<00:00, 24378.25it/s, Cached: Коломбо]Resolving IDs:  49%|████▊     | 236/485 [00:00<00:00, 24377.08it/s, Cached: Люди в черном: Интер]Resolving IDs:  49%|████▉     | 237/485 [00:00<00:00, 24387.28it/s, Cached: Новобранец / Новичок]Resolving IDs:  49%|████▉     | 238/485 [00:00<00:00, 24400.39it/s, Cached: Частная практика]    Resolving IDs:  49%|████▉     | 239/485 [00:00<00:00, 24412.81it/s, Cached: Гарри Поттер 20 лет ]Resolving IDs:  49%|████▉     | 240/485 [00:00<00:00, 24425.72it/s, Cached: Шерлок Холмс]        Resolving IDs:  50%|████▉     | 241/485 [00:00<00:00, 24437.37it/s, Cached: Как отделаться от па]Resolving IDs:  50%|████▉     | 242/485 [00:00<00:00, 24449.51it/s, Cached: Лучшее предложение]  Resolving IDs:  50%|█████     | 243/485 [00:00<00:00, 24462.75it/s, Cached: Как избежать наказан]Resolving IDs:  50%|█████     | 244/485 [00:00<00:00, 24474.71it/s, Cached: Элли МакБил]         Resolving IDs:  51%|█████     | 245/485 [00:00<00:00, 24489.51it/s, Cached: Фокус]      Resolving IDs:  51%|█████     | 246/485 [00:00<00:00, 24504.79it/s, Cached: Джессика Джонс]Resolving IDs:  51%|█████     | 247/485 [00:00<00:00, 24512.42it/s, Cached: Парки и зоны отдыха]Resolving IDs:  51%|█████     | 248/485 [00:00<00:00, 24524.62it/s, Cached: Пираты Карибского мо]Resolving IDs:  51%|█████▏    | 249/485 [00:00<00:00, 24535.01it/s, Cached: Трансформеры]        Resolving IDs:  52%|█████▏    | 250/485 [00:00<00:00, 24547.62it/s, Cached: Майор Гром: Игра]Resolving IDs:  52%|█████▏    | 251/485 [00:00<00:00, 24560.71it/s, Cached: Пираты Карибского мо]Resolving IDs:  52%|█████▏    | 252/485 [00:00<00:00, 24574.29it/s, Cached: Открытый брак]       Resolving IDs:  52%|█████▏    | 253/485 [00:00<00:00, 24588.34it/s, Cached: Медленные лошади / Х]Resolving IDs:  52%|█████▏    | 254/485 [00:00<00:00, 24600.59it/s, Cached: Пираты Карибского мо]Resolving IDs:  53%|█████▎    | 255/485 [00:00<00:00, 24612.76it/s, Cached: Анна-детективъ]      Resolving IDs:  53%|█████▎    | 256/485 [00:00<00:00, 24624.85it/s, Cached: Чужой: Ромул]  Resolving IDs:  53%|█████▎    | 257/485 [00:00<00:00, 24636.85it/s, Cached: Двадцать одно]Resolving IDs:  53%|█████▎    | 258/485 [00:00<00:00, 24648.21it/s, Cached: Лас Вегас]    Resolving IDs:  53%|█████▎    | 259/485 [00:00<00:00, 24657.26it/s, Cached: Каскадёры]Resolving IDs:  54%|█████▎    | 260/485 [00:00<00:00, 24668.47it/s, Cached: Пираты Карибского мо]Resolving IDs:  54%|█████▍    | 261/485 [00:00<00:00, 24676.27it/s, Cached: Пацаны]              Resolving IDs:  54%|█████▍    | 262/485 [00:00<00:00, 24688.45it/s, Cached: Дэдпул и Росомаха]Resolving IDs:  54%|█████▍    | 263/485 [00:00<00:00, 24699.45it/s, Cached: Деньги на двоих]  Resolving IDs:  54%|█████▍    | 264/485 [00:00<00:00, 24710.37it/s, Cached: Лютер: Падшее солнце]Resolving IDs:  55%|█████▍    | 265/485 [00:00<00:00, 24722.31it/s, Cached: Мобильный доспех Ган]Resolving IDs:  55%|█████▍    | 266/485 [00:00<00:00, 24733.64it/s, Cached: Пираты Карибского мо]Resolving IDs:  55%|█████▌    | 267/485 [00:00<00:00, 24744.88it/s, Cached: Азазель]             Resolving IDs:  55%|█████▌    | 268/485 [00:00<00:00, 24754.97it/s, Cached: Супергёрл / Супердев]Resolving IDs:  55%|█████▌    | 269/485 [00:00<00:00, 24765.52it/s, Cached: Лютер]               Resolving IDs:  56%|█████▌    | 270/485 [00:00<00:00, 24777.64it/s, Cached: Человек-паук: Через ]Resolving IDs:  56%|█████▌    | 271/485 [00:00<00:00, 24787.52it/s, Cached: Андор]               Resolving IDs:  56%|█████▌    | 272/485 [00:00<00:00, 24800.02it/s, Cached: Бесславные ублюдки]Resolving IDs:  56%|█████▋    | 273/485 [00:00<00:00, 24811.91it/s, Cached: Ликвидация]        Resolving IDs:  56%|█████▋    | 274/485 [00:00<00:00, 24823.19it/s, Cached: Мертвые до востребов]Resolving IDs:  57%|█████▋    | 275/485 [00:00<00:00, 24833.86it/s, Cached: Три икса]            Resolving IDs:  57%|█████▋    | 276/485 [00:00<00:00, 24806.14it/s, Cached: Напарницы / Риццоли ]Resolving IDs:  57%|█████▋    | 277/485 [00:00<00:00, 24811.48it/s, Cached: Мадам Си Джей Уокер:]Resolving IDs:  57%|█████▋    | 278/485 [00:00<00:00, 24821.01it/s, Cached: О чём говорят мужчин]Resolving IDs:  58%|█████▊    | 279/485 [00:00<00:00, 24829.43it/s, Cached: Английский пациент]  Resolving IDs:  58%|█████▊    | 280/485 [00:00<00:00, 24840.41it/s, Cached: Гарри Поттер и Орден]Resolving IDs:  58%|█████▊    | 281/485 [00:00<00:00, 24850.29it/s, Cached: Настоящий детектив]  Resolving IDs:  58%|█████▊    | 282/485 [00:00<00:00, 24861.14it/s, Cached: Ночной агент]      Resolving IDs:  58%|█████▊    | 283/485 [00:00<00:00, 24816.29it/s, Cached: Гарри Поттер и Принц]Resolving IDs:  59%|█████▊    | 284/485 [00:00<00:00, 24797.70it/s, Cached: Сквозь снег]         Resolving IDs:  59%|█████▉    | 285/485 [00:00<00:00, 24771.56it/s, Cached: Зло]        Resolving IDs:  59%|█████▉    | 286/485 [00:00<00:00, 24772.24it/s, Cached: Гарри Поттер и Дары ]Resolving IDs:  59%|█████▉    | 287/485 [00:00<00:00, 24749.48it/s, Cached: Девочки Гилмор]      Resolving IDs:  59%|█████▉    | 288/485 [00:00<00:00, 24753.78it/s, Cached: К звёздам]     Resolving IDs:  60%|█████▉    | 289/485 [00:00<00:00, 24748.95it/s, Cached: Дживс и Вустер]Resolving IDs:  60%|█████▉    | 290/485 [00:00<00:00, 24756.74it/s, Cached: Гарри Поттер и Дары ]Resolving IDs:  60%|██████    | 291/485 [00:00<00:00, 24765.49it/s, Cached: Индиана Джонс: В пои]Resolving IDs:  60%|██████    | 292/485 [00:00<00:00, 24774.69it/s, Cached: Спасти мистера Бэнкс]Resolving IDs:  60%|██████    | 293/485 [00:00<00:00, 24784.33it/s, Cached: Сердца трёх]         Resolving IDs:  61%|██████    | 294/485 [00:00<00:00, 24792.42it/s, Cached: Мисс Марпл: Объявлен]Resolving IDs:  61%|██████    | 295/485 [00:00<00:00, 24801.45it/s, Cached: One Piece. Большой к]Resolving IDs:  61%|██████    | 296/485 [00:00<00:00, 24810.93it/s, Cached: Реальная любовь]     Resolving IDs:  61%|██████    | 297/485 [00:00<00:00, 24820.34it/s, Cached: Темный рыцарь: Возро]Resolving IDs:  61%|██████▏   | 298/485 [00:00<00:00, 24828.23it/s, Cached: Девушка моего лучшег]Resolving IDs:  62%|██████▏   | 299/485 [00:00<00:00, 24802.17it/s, Cached: Секретный уровень]   Resolving IDs:  62%|██████▏   | 300/485 [00:00<00:00, 24795.38it/s, Cached: Сорвиголова]      Resolving IDs:  62%|██████▏   | 301/485 [00:00<00:00, 24767.24it/s, Cached: Бриджит Джонс: Грани]Resolving IDs:  62%|██████▏   | 302/485 [00:00<00:00, 24734.53it/s, Cached: Напарницы: Астрид и ]Resolving IDs:  62%|██████▏   | 303/485 [00:00<00:00, 24679.56it/s, Cached: Жестокие игры]       Resolving IDs:  63%|██████▎   | 304/485 [00:00<00:00, 24636.62it/s, Cached: Гордость и предубежд]Resolving IDs:  63%|██████▎   | 305/485 [00:00<00:00, 24604.99it/s, Cached: Дневник Бриджит Джон]Resolving IDs:  63%|██████▎   | 306/485 [00:00<00:00, 24565.65it/s, Cached: Рискованный бизнес]  Resolving IDs:  63%|██████▎   | 307/485 [00:00<00:00, 24526.69it/s, Cached: Прослушка]         Resolving IDs:  64%|██████▎   | 308/485 [00:00<00:00, 24476.97it/s, Cached: Тор]      Resolving IDs:  64%|██████▎   | 309/485 [00:00<00:00, 24439.75it/s, Cached: Человек-паук: Нет пу]Resolving IDs:  64%|██████▍   | 310/485 [00:00<00:00, 24406.09it/s, Cached: Мисс Марпл Агаты Кри]Resolving IDs:  64%|██████▍   | 311/485 [00:00<00:00, 24366.81it/s, Cached: Тор 2: Царство тьмы] Resolving IDs:  64%|██████▍   | 312/485 [00:00<00:00, 24312.55it/s, Cached: Лунный рыцарь]      Resolving IDs:  65%|██████▍   | 313/485 [00:00<00:00, 24281.30it/s, Cached: Мисс Марпл: Тело в б]Resolving IDs:  65%|██████▍   | 314/485 [00:00<00:00, 24254.80it/s, Cached: Хоббит: Нежданное пу]Resolving IDs:  65%|██████▍   | 315/485 [00:00<00:00, 24229.86it/s, Cached: В поле зрения / Подо]Resolving IDs:  65%|██████▌   | 316/485 [00:00<00:00, 24205.57it/s, Cached: Мисс Марпл: Зеркало ]Resolving IDs:  65%|██████▌   | 317/485 [00:00<00:00, 24181.92it/s, Cached: Хоббит: Пустошь Смау]Resolving IDs:  66%|██████▌   | 318/485 [00:00<00:00, 24158.02it/s, Cached: Леди-детектив мисс Ф]Resolving IDs:  66%|██████▌   | 319/485 [00:00<00:00, 24136.94it/s, Cached: Мисс Марпл: Указующи]Resolving IDs:  66%|██████▌   | 320/485 [00:00<00:00, 24115.16it/s, Cached: Хоббит: Битва пяти в]Resolving IDs:  66%|██████▌   | 321/485 [00:00<00:00, 24093.98it/s, Cached: Убийства в одном зда]Resolving IDs:  66%|██████▋   | 322/485 [00:00<00:00, 24073.83it/s, Cached: Манхэттенская истори]Resolving IDs:  67%|██████▋   | 323/485 [00:00<00:00, 24055.55it/s, Cached: Аркейн]              Resolving IDs:  67%|██████▋   | 324/485 [00:00<00:00, 24036.98it/s, Cached: Чип и Дейл спешат на]Resolving IDs:  67%|██████▋   | 325/485 [00:00<00:00, 24016.86it/s, Cached: Удивительная миссис ]Resolving IDs:  67%|██████▋   | 326/485 [00:00<00:00, 23982.16it/s, Cached: Начальная школа «Эбб]Resolving IDs:  67%|██████▋   | 327/485 [00:00<00:00, 23942.35it/s, Cached: Мисс Марпл: С помощь]Resolving IDs:  68%|██████▊   | 328/485 [00:00<00:00, 23908.72it/s, Cached: Дрянь]               Resolving IDs:  68%|██████▊   | 329/485 [00:00<00:00, 23896.89it/s, Cached: Полярный экспресс]Resolving IDs:  68%|██████▊   | 330/485 [00:00<00:00, 23903.30it/s, Cached: Мисс Марпл: Тайна Ка]Resolving IDs:  68%|██████▊   | 331/485 [00:00<00:00, 23910.90it/s, Cached: Хороший год]         Resolving IDs:  68%|██████▊   | 332/485 [00:00<00:00, 23894.25it/s, Cached: Дюна]       Resolving IDs:  69%|██████▊   | 333/485 [00:00<00:00, 23880.17it/s, Cached: Идентификация]Resolving IDs:  69%|██████▉   | 334/485 [00:00<00:00, 23866.19it/s, Cached: Почти человек]Resolving IDs:  69%|██████▉   | 335/485 [00:00<00:00, 23850.69it/s, Cached: Человек-паук: Паутин]Resolving IDs:  69%|██████▉   | 336/485 [00:00<00:00, 23825.23it/s, Cached: Доктор Кто]          Resolving IDs:  69%|██████▉   | 337/485 [00:00<00:00, 23800.78it/s, Cached: На гребне волны]Resolving IDs:  70%|██████▉   | 338/485 [00:00<00:00, 23782.10it/s, Cached: Блич [ТВ-1]]    Resolving IDs:  70%|██████▉   | 339/485 [00:00<00:00, 23766.74it/s, Cached: Однажды в Ирландии]Resolving IDs:  70%|███████   | 340/485 [00:00<00:00, 23752.28it/s, Cached: Перелом]           Resolving IDs:  70%|███████   | 341/485 [00:00<00:00, 23738.72it/s, Cached: Человек-бензопила]Resolving IDs:  71%|███████   | 342/485 [00:00<00:00, 23725.24it/s, Cached: Ущелье]           Resolving IDs:  71%|███████   | 343/485 [00:00<00:00, 23709.91it/s, Cached: Преступник: Великобр]Resolving IDs:  71%|███████   | 344/485 [00:00<00:00, 23696.24it/s, Cached: Падение дома Ашеров] Resolving IDs:  71%|███████   | 345/485 [00:00<00:00, 23681.12it/s, Cached: Сёгун]              Resolving IDs:  71%|███████▏  | 346/485 [00:00<00:00, 23661.09it/s, Cached: Анатомия страсти / А]Resolving IDs:  72%|███████▏  | 347/485 [00:00<00:00, 23637.37it/s, Cached: Мисс Марпл: Забытое ]Resolving IDs:  72%|███████▏  | 348/485 [00:00<00:00, 23625.29it/s, Cached: Хорошие девчонки]    Resolving IDs:  72%|███████▏  | 349/485 [00:00<00:00, 23632.36it/s, Cached: Мисс Марпл: Точно по]Resolving IDs:  72%|███████▏  | 350/485 [00:00<00:00, 23642.82it/s, Cached: Наследники]          Resolving IDs:  72%|███████▏  | 351/485 [00:00<00:00, 23652.47it/s, Cached: Потерянная комната /]Resolving IDs:  73%|███████▎  | 352/485 [00:00<00:00, 23660.93it/s, Cached: Мисс Марпл: Убийство]Resolving IDs:  73%|███████▎  | 353/485 [00:00<00:00, 23670.49it/s, Cached: Вера]                Resolving IDs:  73%|███████▎  | 354/485 [00:00<00:00, 23660.38it/s, Cached: Темное дитя]Resolving IDs:  73%|███████▎  | 355/485 [00:00<00:00, 23648.46it/s, Cached: Патруль времени]Resolving IDs:  73%|███████▎  | 356/485 [00:00<00:00, 23634.37it/s, Cached: Миссия невыполнима: ]Resolving IDs:  74%|███████▎  | 357/485 [00:00<00:00, 23619.63it/s, Cached: Иллюзия обмана]      Resolving IDs:  74%|███████▍  | 358/485 [00:00<00:00, 23608.33it/s, Cached: Локи]          Resolving IDs:  74%|███████▍  | 359/485 [00:00<00:00, 23597.48it/s, Cached: Бэтмен: Начало]Resolving IDs:  74%|███████▍  | 360/485 [00:00<00:00, 23585.22it/s, Cached: Доктор Хаус]   Resolving IDs:  74%|███████▍  | 361/485 [00:00<00:00, 23573.78it/s, Cached: Кашемировая мафия]Resolving IDs:  75%|███████▍  | 362/485 [00:00<00:00, 23581.44it/s, Cached: Темный рыцарь]    Resolving IDs:  75%|███████▍  | 363/485 [00:00<00:00, 23592.35it/s, Cached: Джек Ричер]   Resolving IDs:  75%|███████▌  | 364/485 [00:00<00:00, 23603.94it/s, Cached: Анчартед: На картах ]Resolving IDs:  75%|███████▌  | 365/485 [00:00<00:00, 23612.93it/s, Cached: Розмари и Тайм]      Resolving IDs:  75%|███████▌  | 366/485 [00:00<00:00, 23622.25it/s, Cached: Друзья]        Resolving IDs:  76%|███████▌  | 367/485 [00:00<00:00, 23632.60it/s, Cached: Дефективный детектив]Resolving IDs:  76%|███████▌  | 368/485 [00:00<00:00, 23641.83it/s, Cached: Железный человек]    Resolving IDs:  76%|███████▌  | 369/485 [00:00<00:00, 23637.28it/s, Cached: Кухня]           Resolving IDs:  76%|███████▋  | 370/485 [00:00<00:00, 23622.69it/s, Cached: Основатель]Resolving IDs:  76%|███████▋  | 371/485 [00:00<00:00, 23602.82it/s, Cached: Доктор Стрэндж]Resolving IDs:  77%|███████▋  | 372/485 [00:00<00:00, 23590.58it/s, Cached: Бумажный дом]  Resolving IDs:  77%|███████▋  | 373/485 [00:00<00:00, 23578.78it/s, Cached: Ford против Ferrari]Resolving IDs:  77%|███████▋  | 374/485 [00:00<00:00, 23566.69it/s, Cached: Притворщик]         Resolving IDs:  77%|███████▋  | 375/485 [00:00<00:00, 23555.04it/s, Cached: Элементарно]Resolving IDs:  78%|███████▊  | 376/485 [00:00<00:00, 23543.45it/s, Cached: Сознавайтесь, Флетч]Resolving IDs:  78%|███████▊  | 377/485 [00:00<00:00, 23531.25it/s, Cached: Падение Олимпа]     Resolving IDs:  78%|███████▊  | 378/485 [00:00<00:00, 23518.76it/s, Cached: Отец Браун]    Resolving IDs:  78%|███████▊  | 379/485 [00:00<00:00, 23507.75it/s, Cached: Болота / Пляжный коп]Resolving IDs:  78%|███████▊  | 380/485 [00:00<00:00, 23491.61it/s, Cached: Расследование сестры]Resolving IDs:  79%|███████▊  | 381/485 [00:00<00:00, 23479.38it/s, Cached: Пятый элемент]       Resolving IDs:  79%|███████▉  | 382/485 [00:00<00:00, 23468.93it/s, Cached: Стражи Галактики]Resolving IDs:  79%|███████▉  | 383/485 [00:00<00:00, 23455.82it/s, Cached: РеГенезис]       Resolving IDs:  79%|███████▉  | 384/485 [00:00<00:00, 23444.49it/s, Cached: Человек на Луне]Resolving IDs:  79%|███████▉  | 385/485 [00:00<00:00, 23432.21it/s, Cached: Покровские ворота]Resolving IDs:  80%|███████▉  | 386/485 [00:00<00:00, 23421.02it/s, Cached: Джек Райан]       Resolving IDs:  80%|███████▉  | 387/485 [00:00<00:00, 23409.22it/s, Cached: Обыкновенное чудо]Resolving IDs:  80%|████████  | 388/485 [00:00<00:00, 23398.85it/s, Cached: Тайны Фрэнки Дрейк /]Resolving IDs:  80%|████████  | 389/485 [00:00<00:00, 23387.19it/s, Cached: Слепая зона / Слепое]Resolving IDs:  80%|████████  | 390/485 [00:00<00:00, 23376.95it/s, Cached: Вам письмо]          Resolving IDs:  81%|████████  | 391/485 [00:00<00:00, 23368.09it/s, Cached: Тайны Лауры]Resolving IDs:  81%|████████  | 392/485 [00:00<00:00, 23356.97it/s, Cached: Белый воротничок]Resolving IDs:  81%|████████  | 393/485 [00:00<00:00, 23347.23it/s, Cached: Гавайи 5.0 / Полиция]Resolving IDs:  81%|████████  | 394/485 [00:00<00:00, 23337.56it/s, Cached: Самая обаятельная и ]Resolving IDs:  81%|████████▏ | 395/485 [00:00<00:00, 23328.27it/s, Cached: Макдональд и Доддс]  Resolving IDs:  82%|████████▏ | 396/485 [00:00<00:00, 23314.77it/s, Cached: За гранью / Грань] Resolving IDs:  82%|████████▏ | 397/485 [00:00<00:00, 23303.97it/s, Cached: Как приручить дракон]Resolving IDs:  82%|████████▏ | 398/485 [00:00<00:00, 23283.49it/s, Cached: Секс в большом город]Resolving IDs:  82%|████████▏ | 399/485 [00:00<00:00, 23268.32it/s, Cached: Ешь, молись, люби]   Resolving IDs:  82%|████████▏ | 400/485 [00:00<00:00, 23250.34it/s, Cached: Неуязвимый]       Resolving IDs:  83%|████████▎ | 401/485 [00:00<00:00, 23236.66it/s, Cached: Кости]     Resolving IDs:  83%|████████▎ | 402/485 [00:00<00:00, 23227.86it/s, Cached: Зови меня Кэт]Resolving IDs:  83%|████████▎ | 403/485 [00:00<00:00, 23218.15it/s, Cached: Книжный]      Resolving IDs:  83%|████████▎ | 404/485 [00:00<00:00, 23210.40it/s, Cached: Дарби и Джоан]Resolving IDs:  84%|████████▎ | 405/485 [00:00<00:00, 23203.34it/s, Cached: Супермен]     Resolving IDs:  84%|████████▎ | 406/485 [00:00<00:00, 23191.89it/s, Cached: Джинни и Джорджия]Resolving IDs:  84%|████████▍ | 407/485 [00:00<00:00, 23180.19it/s, Cached: Из многих / Плюрибус]Resolving IDs:  84%|████████▍ | 408/485 [00:00<00:00, 23171.70it/s, Cached: Рецепты любви и убий]Resolving IDs:  84%|████████▍ | 409/485 [00:00<00:00, 23162.94it/s, Cached: Большой потенциал]   Resolving IDs:  85%|████████▍ | 410/485 [00:00<00:00, 23161.40it/s, Cached: Громовержцы*]     Resolving IDs:  85%|████████▍ | 411/485 [00:00<00:00, 23170.15it/s, Cached: Клиника]     Resolving IDs:  85%|████████▍ | 412/485 [00:00<00:00, 23180.41it/s, Cached: Умница] Resolving IDs:  85%|████████▌ | 413/485 [00:00<00:00, 23191.25it/s, Cached: Расследования мадам ]Resolving IDs:  85%|████████▌ | 414/485 [00:00<00:00, 23202.68it/s, Cached: Это мы]              Resolving IDs:  86%|████████▌ | 415/485 [00:00<00:00, 23213.43it/s, Cached: Тайны Броукенвуда]Resolving IDs:  86%|████████▌ | 416/485 [00:00<00:00, 23222.61it/s, Cached: Кейпоп-охотницы на д]Resolving IDs:  86%|████████▌ | 417/485 [00:00<00:00, 23230.81it/s, Cached: Моя геройская академ]Resolving IDs:  86%|████████▌ | 418/485 [00:00<00:00, 23239.61it/s, Cached: Пожарная часть 19]   Resolving IDs:  86%|████████▋ | 419/485 [00:00<00:00, 23249.59it/s, Cached: Шорзи / Шорси]    Resolving IDs:  87%|████████▋ | 420/485 [00:00<00:00, 23259.85it/s, Cached: С большой буквы / Жи]Resolving IDs:  87%|████████▋ | 421/485 [00:00<00:00, 23269.45it/s, Cached: Дандадан [ТВ-1]]     Resolving IDs:  87%|████████▋ | 422/485 [00:00<00:00, 23278.40it/s, Cached: Обмани меня / Теория]Resolving IDs:  87%|████████▋ | 423/485 [00:00<00:00, 23287.93it/s, Cached: Скандал]             Resolving IDs:  87%|████████▋ | 424/485 [00:00<00:00, 23298.64it/s, Cached: Люцифер]Resolving IDs:  88%|████████▊ | 425/485 [00:00<00:00, 23309.31it/s, Cached: Неукротимый / В глуш]Resolving IDs:  88%|████████▊ | 426/485 [00:00<00:00, 23319.33it/s, Cached: Резиденция]          Resolving IDs:  88%|████████▊ | 427/485 [00:00<00:00, 23329.92it/s, Cached: Бриджертоны]Resolving IDs:  88%|████████▊ | 428/485 [00:00<00:00, 23341.68it/s, Cached: Отчаянные домохозяйк]Resolving IDs:  88%|████████▊ | 429/485 [00:00<00:00, 23351.59it/s, Cached: Любовь с иголочки / ]Resolving IDs:  89%|████████▊ | 430/485 [00:00<00:00, 23361.75it/s, Cached: Карточный домик]     Resolving IDs:  89%|████████▉ | 431/485 [00:00<00:00, 23372.49it/s, Cached: Клуб убийств Марлоу]Resolving IDs:  89%|████████▉ | 432/485 [00:00<00:00, 23383.18it/s, Cached: Дандадан [ТВ-2]]    Resolving IDs:  89%|████████▉ | 433/485 [00:00<00:00, 23392.63it/s, Cached: Смотрите, как они бе]Resolving IDs:  89%|████████▉ | 434/485 [00:00<00:00, 23402.34it/s, Cached: Твин Пикс]           Resolving IDs:  90%|████████▉ | 435/485 [00:00<00:00, 23412.32it/s, Cached: Сумерки. Сага. Рассв]Resolving IDs:  90%|████████▉ | 436/485 [00:00<00:00, 23421.96it/s, Cached: Идентификация Борна] Resolving IDs:  90%|█████████ | 437/485 [00:00<00:00, 23431.87it/s, Cached: Тайлер Рейк: Операци]Resolving IDs:  90%|█████████ | 438/485 [00:00<00:00, 23442.03it/s, Cached: Последняя дуэль]     Resolving IDs:  91%|█████████ | 439/485 [00:00<00:00, 23451.56it/s, Cached: Тед Лассо]      Resolving IDs:  91%|█████████ | 440/485 [00:00<00:00, 23460.76it/s, Cached: Хинтерланд]Resolving IDs:  91%|█████████ | 441/485 [00:00<00:00, 23471.11it/s, Cached: Бруклин 9-9]Resolving IDs:  91%|█████████ | 442/485 [00:00<00:00, 23481.13it/s, Cached: Джонатан Крик]Resolving IDs:  91%|█████████▏| 443/485 [00:00<00:00, 23491.71it/s, Cached: Гордость и предубежд]Resolving IDs:  92%|█████████▏| 444/485 [00:00<00:00, 23501.36it/s, Cached: Счастливый конец]    Resolving IDs:  92%|█████████▏| 445/485 [00:00<00:00, 23511.26it/s, Cached: Убийство на пляже / ]Resolving IDs:  92%|█████████▏| 446/485 [00:00<00:00, 23520.84it/s, Cached: Убийство в Провансе] Resolving IDs:  92%|█████████▏| 447/485 [00:00<00:00, 23530.68it/s, Cached: Гарри Поттер и Тайна]Resolving IDs:  92%|█████████▏| 448/485 [00:00<00:00, 23539.60it/s, Cached: Гарри Поттер и узник]Resolving IDs:  93%|█████████▎| 449/485 [00:00<00:00, 23548.77it/s, Cached: Смерть на Ниле]      Resolving IDs:  93%|█████████▎| 450/485 [00:00<00:00, 23558.51it/s, Cached: Гарри Поттер и Кубок]Resolving IDs:  93%|█████████▎| 451/485 [00:00<00:00, 23568.20it/s, Cached: Убийство в маленьком]Resolving IDs:  93%|█████████▎| 452/485 [00:00<00:00, 23578.16it/s, Cached: Убийства под омелой] Resolving IDs:  93%|█████████▎| 453/485 [00:00<00:00, 23587.20it/s, Cached: Новый Амстердам]    Resolving IDs:  94%|█████████▎| 454/485 [00:00<00:00, 23596.79it/s, Cached: Шетланд]        Resolving IDs:  94%|█████████▍| 455/485 [00:00<00:00, 23584.47it/s, Cached: Испытание невиновнос]Resolving IDs:  94%|█████████▍| 456/485 [00:00<00:00, 23577.45it/s, Cached: Сумерки]             Resolving IDs:  94%|█████████▍| 457/485 [00:00<00:00, 23562.06it/s, Cached: Сумерки. Сага. Затме]Resolving IDs:  94%|█████████▍| 458/485 [00:00<00:00, 23566.69it/s, Cached: Иллюзионист]         Resolving IDs:  95%|█████████▍| 459/485 [00:00<00:00, 23574.76it/s, Cached: Сумерки. Сага. Новол]Resolving IDs:  95%|█████████▍| 460/485 [00:00<00:00, 23583.09it/s, Cached: По кладбищенской дор]Resolving IDs:  95%|█████████▌| 461/485 [00:00<00:00, 23591.39it/s, Cached: Профессор Т]         Resolving IDs:  95%|█████████▌| 462/485 [00:00<00:00, 23601.10it/s, Cached: Сумерки. Сага. Рассв]Resolving IDs:  95%|█████████▌| 463/485 [00:00<00:00, 23609.34it/s, Cached: Одна на рождество]   Resolving IDs:  96%|█████████▌| 464/485 [00:00<00:00, 23618.70it/s, Cached: Доставить к Рождеств]Resolving IDs:  96%|█████████▌| 465/485 [00:00<00:00, 23621.44it/s, Cached: Теория большого взры]Resolving IDs:  96%|█████████▌| 466/485 [00:00<00:00, 23628.17it/s, Cached: Отступники]          Resolving IDs:  96%|█████████▋| 467/485 [00:00<00:00, 23635.16it/s, Cached: Девятые врата]Resolving IDs:  96%|█████████▋| 468/485 [00:00<00:00, 23643.26it/s, Cached: Мэверик]      Resolving IDs:  97%|█████████▋| 469/485 [00:00<00:00, 23651.33it/s, Cached: Душа]   Resolving IDs:  97%|█████████▋| 470/485 [00:00<00:00, 23660.51it/s, Cached: Чудо-женщина: 1984]Resolving IDs:  97%|█████████▋| 471/485 [00:00<00:00, 23668.81it/s, Cached: Довод]             Resolving IDs:  97%|█████████▋| 472/485 [00:00<00:00, 23678.49it/s, Cached: Суррогаты]Resolving IDs:  98%|█████████▊| 473/485 [00:00<00:00, 23687.30it/s, Cached: Видоизмененный углер]Resolving IDs:  98%|█████████▊| 474/485 [00:00<00:00, 23694.94it/s, Cached: Две королевы]        Resolving IDs:  98%|█████████▊| 475/485 [00:00<00:00, 23703.68it/s, Cached: Меняющие реальность]Resolving IDs:  98%|█████████▊| 476/485 [00:00<00:00, 23711.27it/s, Cached: Маленькие женщины]  Resolving IDs:  98%|█████████▊| 477/485 [00:00<00:00, 23719.39it/s, Cached: Унесенные ветром] Resolving IDs:  99%|█████████▊| 478/485 [00:00<00:00, 23727.76it/s, Cached: Тайна Коко]      Resolving IDs:  99%|█████████▉| 479/485 [00:00<00:00, 23736.39it/s, Cached: Побег из Шоушенка]Resolving IDs:  99%|█████████▉| 480/485 [00:00<00:00, 23744.98it/s, Cached: Пока не сыграл в ящи]Resolving IDs:  99%|█████████▉| 481/485 [00:00<00:00, 23752.71it/s, Cached: Начало]              Resolving IDs:  99%|█████████▉| 482/485 [00:00<00:00, 23761.53it/s, Cached: Ирландец]Resolving IDs: 100%|█████████▉| 483/485 [00:00<00:00, 23770.04it/s, Cached: Познакомьтесь с Доро]Resolving IDs: 100%|█████████▉| 484/485 [00:00<00:00, 23777.96it/s, Cached: Аэронавты]           Resolving IDs: 100%|██████████| 485/485 [00:00<00:00, 23763.62it/s, Cached: Аэронавты]

--- Detected Progress & Status ---
Клаус -> HDRezka: Watched | [Trakt: S0E0 | Date: 01-03-2021] | [EQUAL] - Dates Match
Ход королевы / Ферзевый гамбит -> HDRezka: S1E1 | [Trakt: S1E1 | Date: 26-08-2022] | [EQUAL] - Dates Match
Братство волка -> HDRezka: Watched | [Trakt: S0E0 | Date: 22-12-2023] | [EQUAL] - Dates Match
Мирный воин -> HDRezka: Watched | [Trakt: S0E0 | Date: 13-03-2021] | [EQUAL] - Dates Match
Созданный в Бездне [ТВ-1] -> HDRezka: S1E9 | [Trakt: S1E13 | Date: 12-12-2025] | [TRAKT AHEAD] - Backfilling Date
Золотой компас -> HDRezka: Watched | [Trakt: S0E0 | Date: 01-01-2024] | [EQUAL] - Dates Match
Зелёная книга -> HDRezka: Watched | [Trakt: S0E0 | Date: 15-03-2021] | [EQUAL] - Dates Match
Шерлок Холмс и доктор Ватсон: Знакомство -> HDRezka: Watched | [Trakt: S1E2 | Date: 12-12-2025] | [DATE MISMATCH] -> 28-08-2022
Тариф Новогодний -> HDRezka: Watched | [Trakt: S0E0 | Date: 01-01-2024] | [EQUAL] - Dates Match
Трасса 60 -> HDRezka: Watched | [Trakt: S0E0 | Date: 17-03-2021] | [EQUAL] - Dates Match
Шерлок Холмс и доктор Ватсон: Кровавая надпись -> HDRezka: Watched | [Trakt: S0E0 | Date: 28-08-2022] | [EQUAL] - Dates Match
Замерзшая из Майами -> HDRezka: Watched | [Trakt: S0E0 | Date: 02-01-2024] | [EQUAL] - Dates Match
Подземелья и драконы: Честь среди воров -> HDRezka: Watched | [Trakt: S0E0 | Date: 12-12-2025] | [EQUAL] - Dates Match
Армагеддон -> HDRezka: Watched | [Trakt: S0E0 | Date: 20-03-2021] | [EQUAL] - Dates Match
Шерлок Холмс и доктор Ватсон: Король шантажа -> HDRezka: Watched | [Trakt: S0E0 | Date: 28-08-2022] | [EQUAL] - Dates Match
Четыре Рождества -> HDRezka: Watched | [Trakt: S0E0 | Date: 07-01-2024] | [EQUAL] - Dates Match
Король говорит! -> HDRezka: Watched | [Trakt: S0E0 | Date: 29-04-2021] | [EQUAL] - Dates Match
Шерлок Холмс и доктор Ватсон: Собака Баскервилей -> HDRezka: S0E1 | [Trakt: S0E0 | Date: 28-08-2022] | [SYNCING] - Progress Update
Рождественский коттедж -> HDRezka: Watched | [Trakt: S0E0 | Date: 07-01-2024] | [EQUAL] - Dates Match
Черная метка -> HDRezka: S1E1 | [Trakt: S2E16 | Date: 23-12-2025] | [TRAKT AHEAD] - Backfilling Date
Непокоренный -> HDRezka: Watched | [Trakt: S0E0 | Date: 29-08-2022] | [EQUAL] - Dates Match
Ночные игры -> HDRezka: Watched | [Trakt: S0E0 | Date: 08-01-2024] | [EQUAL] - Dates Match
Блудный сын -> HDRezka: S2E13 | [Trakt: S2E13 | Date: 23-12-2025] | [DATE MISMATCH] -> 05-06-2021
Патриотизм Мориарти [ТВ-1] -> HDRezka: S1E5 | [Trakt: S1E5 | Date: 23-12-2025] | [DATE MISMATCH] -> 04-09-2022
Агата Рэйзин -> HDRezka: S1E2 | [Trakt: S1E2 | Date: 09-01-2024] | [EQUAL] - Dates Match
Живая мишень -> HDRezka: S1E1 | [Trakt: S2E13 | Date: 23-12-2025] | [TRAKT AHEAD] - Backfilling Date
Ясновидец -> HDRezka: S1E2 | [Trakt: S1E2 | Date: 09-09-2022] | [EQUAL] - Dates Match
Я – зомби -> HDRezka: S1E3 | [Trakt: S1E3 | Date: 11-01-2024] | [EQUAL] - Dates Match
Твое имя -> HDRezka: Watched | [Trakt: S0E0 | Date: 07-06-2021] | [EQUAL] - Dates Match
Джуманджи -> HDRezka: Watched | [Trakt: S0E0 | Date: 30-09-2022] | [EQUAL] - Dates Match
Шекспир и Хэтэуэй: Частные детективы -> HDRezka: S3E9 | [Trakt: S3E9 | Date: 23-12-2025] | [DATE MISMATCH] -> 13-01-2024
Рождество не по плану / Лето. Солнце. Рождество -> HDRezka: Watched | [Trakt: S0E0 | Date: 22-12-2025] | [EQUAL] - Dates Match
Райя и последний дракон -> HDRezka: Watched | [Trakt: S0E0 | Date: 10-06-2021] | [EQUAL] - Dates Match
Хикару и Го -> HDRezka: S1E1 | [Trakt: S3E15 | Date: 12-12-2025] | [TRAKT AHEAD] - Backfilling Date
Игра престолов -> HDRezka: S1E1 | [Trakt: S1E1 | Date: 16-01-2024] | [EQUAL] - Dates Match
Университет монстров -> HDRezka: Watched | [Trakt: S0E0 | Date: 10-06-2021] | [EQUAL] - Dates Match
S. W. A. T.: Спецназ города ангелов -> HDRezka: S1E1 | [Trakt: S1E1 | Date: 19-10-2022] | [EQUAL] - Dates Match
Королевы тайн -> HDRezka: S2E6 | [Trakt: S2E6 | Date: 23-12-2025] | [DATE MISMATCH] -> 17-01-2024
Гаттака -> HDRezka: Watched | [Trakt: S0E0 | Date: 12-06-2021] | [EQUAL] - Dates Match
Тайные связи / Тайные операции -> HDRezka: S2E16 | [Trakt: S2E16 | Date: 23-12-2025] | [DATE MISMATCH] -> 22-10-2022
Вечеринка / Афтепати -> HDRezka: S1E1 | [Trakt: S1E1 | Date: 18-01-2024] | [EQUAL] - Dates Match
Аватар -> HDRezka: Watched | [Trakt: S0E0 | Date: 13-06-2021] | [EQUAL] - Dates Match
Превосходство Борна -> HDRezka: Watched | [Trakt: S0E0 | Date: 28-10-2022] | [EQUAL] - Dates Match
Достать ножи: Стеклянная луковица -> HDRezka: Watched | [Trakt: S0E0 | Date: 19-01-2024] | [EQUAL] - Dates Match
Любовь, смерть и роботы -> HDRezka: S2E4 | [Trakt: S4E10 | Date: 12-12-2025] | [TRAKT AHEAD] - Backfilling Date
Хороший доктор -> HDRezka: S1E8 | [Trakt: S1E8 | Date: 28-10-2022] | [EQUAL] - Dates Match
Расследования Мердока -> HDRezka: S2E3 | [Trakt: S2E3 | Date: 23-12-2025] | [DATE MISMATCH] -> 23-01-2024
Не пойман – не вор -> HDRezka: Watched | [Trakt: S0E0 | Date: 04-07-2021] | [EQUAL] - Dates Match
Следствие по телу -> HDRezka: S2E20 | [Trakt: S3E13 | Date: 23-12-2025] | [TRAKT AHEAD] - Backfilling Date
Зов крови / Потерянная -> HDRezka: S1E9 | [Trakt: S1E9 | Date: 02-02-2024] | [EQUAL] - Dates Match
P.S. Я люблю тебя -> HDRezka: Watched | [Trakt: S0E0 | Date: 23-07-2021] | [EQUAL] - Dates Match
Ультиматум Борна -> HDRezka: Watched | [Trakt: S0E0 | Date: 29-10-2022] | [EQUAL] - Dates Match
Алита: Боевой ангел -> HDRezka: Watched | [Trakt: S0E0 | Date: 12-02-2024] | [EQUAL] - Dates Match
Римские приключения -> HDRezka: Watched | [Trakt: S0E0 | Date: 01-08-2021] | [EQUAL] - Dates Match
Вечность -> HDRezka: S1E22 | [Trakt: S1E22 | Date: 10-11-2022] | [EQUAL] - Dates Match
Умри, но не сейчас -> HDRezka: Watched | [Trakt: S0E0 | Date: 18-02-2024] | [EQUAL] - Dates Match
Код Да Винчи -> HDRezka: Watched | [Trakt: S0E0 | Date: 06-08-2021] | [EQUAL] - Dates Match
Острые козырьки / Заточенные кепки -> HDRezka: S3E1 | [Trakt: S3E1 | Date: 23-12-2025] | [DATE MISMATCH] -> 19-11-2022
Как важно быть серьезным -> HDRezka: Watched | [Trakt: S0E0 | Date: 18-02-2024] | [EQUAL] - Dates Match
Грабь награбленное / Воздействие -> HDRezka: S1E4 | [Trakt: S3E16 | Date: 23-12-2025] | [TRAKT AHEAD] - Backfilling Date
Легион -> HDRezka: S1E2 | [Trakt: S1E8 | Date: 23-12-2025] | [TRAKT AHEAD] - Backfilling Date
Психопаспорт [ТВ-1] -> HDRezka: S1E7 | [Trakt: S1E22 | Date: 23-12-2025] | [TRAKT AHEAD] - Backfilling Date
Константин: Повелитель тьмы -> HDRezka: Watched | [Trakt: S0E0 | Date: 28-08-2021] | [EQUAL] - Dates Match
Чёрный Адам -> HDRezka: Watched | [Trakt: S0E0 | Date: 21-11-2022] | [EQUAL] - Dates Match
Марсианин -> HDRezka: Watched | [Trakt: S0E0 | Date: 23-02-2024] | [EQUAL] - Dates Match
Скотт Пилигрим против всех -> HDRezka: Watched | [Trakt: S0E0 | Date: 30-08-2021] | [EQUAL] - Dates Match
Шазам! -> HDRezka: Watched | [Trakt: S0E0 | Date: 22-11-2022] | [EQUAL] - Dates Match
Безумный Макс: Дорога ярости -> HDRezka: Watched | [Trakt: S0E0 | Date: 25-02-2024] | [EQUAL] - Dates Match
Тринадцатый этаж -> HDRezka: Watched | [Trakt: S0E0 | Date: 25-09-2021] | [EQUAL] - Dates Match
Горец -> HDRezka: S1E1 | [Trakt: S1E1 | Date: 26-11-2022] | [EQUAL] - Dates Match
Принцесса-невеста -> HDRezka: Watched | [Trakt: S0E0 | Date: 25-02-2024] | [EQUAL] - Dates Match
Титаник -> HDRezka: Watched | [Trakt: S0E0 | Date: 14-10-2021] | [EQUAL] - Dates Match
Тьма -> HDRezka: S1E2 | [Trakt: S1E2 | Date: 26-11-2022] | [EQUAL] - Dates Match
Джон Уик 4 -> HDRezka: Watched | [Trakt: S0E0 | Date: 07-03-2024] | [EQUAL] - Dates Match
Обратная тяга -> HDRezka: Watched | [Trakt: S0E0 | Date: 19-10-2021] | [EQUAL] - Dates Match
Гранд отель -> HDRezka: S1E7 | [Trakt: S1E7 | Date: 04-12-2022] | [EQUAL] - Dates Match
Крэнфорд -> HDRezka: S2E2 | [Trakt: S2E2 | Date: 23-12-2025] | [DATE MISMATCH] -> 09-03-2024
Kingsman: Секретная служба -> HDRezka: Watched | [Trakt: S0E0 | Date: 23-10-2021] | [EQUAL] - Dates Match
Эврика -> HDRezka: S2E1 | [Trakt: S2E1 | Date: 23-12-2025] | [DATE MISMATCH] -> 15-12-2022
Драйв -> HDRezka: Watched | [Trakt: S0E0 | Date: 10-03-2024] | [EQUAL] - Dates Match
Светлячок -> HDRezka: S1E1 | [Trakt: S1E11 | Date: 23-12-2025] | [TRAKT AHEAD] - Backfilling Date
Инспектор Морс -> HDRezka: S1E1 | [Trakt: S1E1 | Date: 15-12-2022] | [EQUAL] - Dates Match
Ноттинг Хилл -> HDRezka: Watched | [Trakt: S0E0 | Date: 12-03-2024] | [EQUAL] - Dates Match
Джон Уик -> HDRezka: Watched | [Trakt: S0E0 | Date: 24-10-2021] | [EQUAL] - Dates Match
Молодой Морс / Индевор -> HDRezka: S3E2 | [Trakt: S3E2 | Date: 23-12-2025] | [DATE MISMATCH] -> 17-12-2022
Леди-детектив мисс Перегрин Фишер -> HDRezka: S2E2 | [Trakt: S2E2 | Date: 23-12-2025] | [DATE MISMATCH] -> 16-03-2024
Джон Уик 2 -> HDRezka: Watched | [Trakt: S0E0 | Date: 25-10-2021] | [EQUAL] - Dates Match
Пространство / Экспансия -> HDRezka: S2E7 | [Trakt: S2E7 | Date: 23-12-2025] | [DATE MISMATCH] -> 20-12-2022
Адвокат дьявола -> HDRezka: Watched | [Trakt: S0E0 | Date: 17-03-2024] | [EQUAL] - Dates Match
Джон Уик 3 -> HDRezka: Watched | [Trakt: S0E0 | Date: 29-10-2021] | [EQUAL] - Dates Match
Мыслить как преступник -> HDRezka: S8E22 | [Trakt: S8E22 | Date: 23-12-2025] | [DATE MISMATCH] -> 21-12-2022
Меломанка / Hi-Fi / Фанатик -> HDRezka: S1E10 | [Trakt: S1E10 | Date: 17-03-2024] | [EQUAL] - Dates Match
Кейт и Лео -> HDRezka: Watched | [Trakt: S0E0 | Date: 30-10-2021] | [EQUAL] - Dates Match
День сурка -> HDRezka: Watched | [Trakt: S0E0 | Date: 24-12-2022] | [EQUAL] - Dates Match
Брат Кадфаэль -> HDRezka: S1E1 | [Trakt: S1E1 | Date: 19-03-2024] | [EQUAL] - Dates Match
Как я встретил вашу маму -> HDRezka: S1E6 | [Trakt: S8E24 | Date: 23-12-2025] | [TRAKT AHEAD] - Backfilling Date
Щелкунчик и четыре королевства -> HDRezka: Watched | [Trakt: S0E0 | Date: 24-12-2022] | [EQUAL] - Dates Match
Благие знамения -> HDRezka: S1E1 | [Trakt: S1E1 | Date: 24-03-2024] | [EQUAL] - Dates Match
Остров проклятых -> HDRezka: Watched | [Trakt: S0E0 | Date: 06-11-2021] | [EQUAL] - Dates Match
Горбун из Нотр Дама -> HDRezka: Watched | [Trakt: S0E0 | Date: 24-12-2022] | [EQUAL] - Dates Match
Бэтмен -> HDRezka: Watched | [Trakt: S0E0 | Date: 31-03-2024] | [EQUAL] - Dates Match
Триумф -> HDRezka: Watched | [Trakt: S0E0 | Date: 08-11-2021] | [EQUAL] - Dates Match
Шерлок -> HDRezka: S1E1 | [Trakt: S4E3 | Date: 23-12-2025] | [TRAKT AHEAD] - Backfilling Date
Моя жизнь — убийство -> HDRezka: S3E10 | [Trakt: S3E10 | Date: 23-12-2025] | [DATE MISMATCH] -> 04-04-2024
Последний отпуск / Последние каникулы -> HDRezka: Watched | [Trakt: S0E0 | Date: 14-12-2025] | [EQUAL] - Dates Match
Богемская рапсодия -> HDRezka: Watched | [Trakt: S0E0 | Date: 12-11-2021] | [EQUAL] - Dates Match
Разделение -> HDRezka: S1E2 | [Trakt: S1E2 | Date: 03-02-2023] | [EQUAL] - Dates Match
Почему не Эванс? -> HDRezka: S1E3 | [Trakt: S1E3 | Date: 06-04-2024] | [EQUAL] - Dates Match
Рейд -> HDRezka: Watched | [Trakt: S0E0 | Date: 12-11-2021] | [EQUAL] - Dates Match
Покерфейс -> HDRezka: S1E2 | [Trakt: S1E2 | Date: 04-02-2023] | [EQUAL] - Dates Match
Белый лотос -> HDRezka: S1E4 | [Trakt: S1E4 | Date: 18-04-2024] | [EQUAL] - Dates Match
Матрица -> HDRezka: Watched | [Trakt: S0E0 | Date: 12-11-2021] | [EQUAL] - Dates Match
Кукольный дом -> HDRezka: S1E2 | [Trakt: S2E13 | Date: 23-12-2025] | [TRAKT AHEAD] - Backfilling Date
Ночной администратор -> HDRezka: S1E8 | [Trakt: S1E6 | Date: 19-04-2024] | [SYNCING] - Progress Update
Карты, деньги, два ствола -> HDRezka: Watched | [Trakt: S0E0 | Date: 15-11-2021] | [EQUAL] - Dates Match
Лучший стрелок / Топ Ган -> HDRezka: Watched | [Trakt: S0E0 | Date: 12-02-2023] | [EQUAL] - Dates Match
Красные огни -> HDRezka: Watched | [Trakt: S0E0 | Date: 20-04-2024] | [EQUAL] - Dates Match
Веном 2 -> HDRezka: Watched | [Trakt: S0E0 | Date: 25-11-2021] | [EQUAL] - Dates Match
Город хищниц -> HDRezka: S1E12 | [Trakt: S6E13 | Date: 23-12-2025] | [TRAKT AHEAD] - Backfilling Date
Охотники за привидениями: Леденящий ужас -> HDRezka: Watched | [Trakt: S0E0 | Date: 01-05-2024] | [EQUAL] - Dates Match
Назад в будущее -> HDRezka: Watched | [Trakt: S0E0 | Date: 29-11-2021] | [EQUAL] - Dates Match
Бэтмен: Долгий Хэллоуин. Часть 1 -> HDRezka: Watched | [Trakt: S0E0 | Date: 23-02-2023] | [EQUAL] - Dates Match
Смерть не в раю / Вне рая -> HDRezka: S2E5 | [Trakt: S2E5 | Date: 23-12-2025] | [DATE MISMATCH] -> 01-05-2024
Назад в будущее 2 -> HDRezka: Watched | [Trakt: S0E0 | Date: 29-11-2021] | [EQUAL] - Dates Match
Бэтмен: Под колпаком -> HDRezka: Watched | [Trakt: S0E0 | Date: 23-02-2023] | [EQUAL] - Dates Match
Ферма Кларксона -> HDRezka: S1E2 | [Trakt: S1E2 | Date: 11-05-2024] | [EQUAL] - Dates Match
Назад в будущее 3 -> HDRezka: Watched | [Trakt: S0E0 | Date: 01-12-2021] | [EQUAL] - Dates Match
Достать ножи -> HDRezka: Watched | [Trakt: S0E0 | Date: 04-03-2023] | [EQUAL] - Dates Match
Стражи Галактики 2 -> HDRezka: Watched | [Trakt: S0E0 | Date: 11-05-2024] | [EQUAL] - Dates Match
Агенты А.Н.К.Л. -> HDRezka: Watched | [Trakt: S0E0 | Date: 11-12-2021] | [EQUAL] - Dates Match
Карнивал Роу -> HDRezka: S1E1 | [Trakt: S1E1 | Date: 07-03-2023] | [EQUAL] - Dates Match
